claude-experiments/hifigan-rocm-bisect/captures/grind/run_20260510T033906_0300870f/miopen_snapshot/user_db/gfx1151_20.HIP.3_5_1_5454e9e2da.ufdb.txt
12-8-8-3x3-64-8-8-8192-1x1-1x1-1x1-0-NCHW-FP16-F=ConvDirectNaiveConvFwd:122.224,0,miopenConvolutionFwdAlgoDirect;ConvBinWinogradRxSf2x3g1:1.22963,0,miopenConvolutionFwdAlgoWinograd;ConvBinWinogradRxSf3x2:1.50002,0,miopenConvolutionFwdAlgoWinograd;ConvWinoFuryRxS<2-3>:1.16673,2048,miopenConvolutionFwdAlgoWinograd;GemmFwdRest:695.713,13824,miopenConvolutionFwdAlgoGEMM;ConvHipImplicitGemmGroupFwdXdlops:2.78483,79705600,miopenConvolutionFwdAlgoImplicitGEMM
64-8-8-3x3-64-8-8-8192-1x1-1x1-1x1-0-NCHW-FP16-F=ConvDirectNaiveConvFwd:655.412,0,miopenConvolutionFwdAlgoDirect;ConvBinWinogradRxSf2x3g1:1.49008,0,miopenConvolutionFwdAlgoWinograd;ConvBinWinogradRxSf3x2:2.44975,0,miopenConvolutionFwdAlgoWinograd;ConvWinoFuryRxS<2-3>:2.77226,2048,miopenConvolutionFwdAlgoWinograd;GemmFwdRest:1073.96,73728,miopenConvolutionFwdAlgoGEMM;ConvHipImplicitGemmGroupFwdXdlops:4.37501,134291456,miopenConvolutionFwdAlgoImplicitGEMM
64-8-8-3x3-64-8-8-8192-1x1-1x1-1x1-0-NCHW-FP16-B=ConvDirectNaiveConvBwd:977.234,0,miopenConvolutionBwdDataAlgoDirect;ConvBinWinogradRxSf2x3g1:2.24661,0,miopenConvolutionBwdDataAlgoWinograd;ConvBinWinogradRxSf3x2:11.9115,0,miopenConvolutionBwdDataAlgoWinograd;ConvWinoFuryRxS<2-3>:2.52804,2048,miopenConvolutionBwdDataAlgoWinograd;GemmBwdRest:823.218,73728,miopenConvolutionBwdDataAlgoGEMM;ConvHipImplicitGemmGroupBwdXdlops:6.6603,134291456,miopenConvolutionBwdDataAlgoImplicitGEMM
64-8-8-3x3-64-8-8-8192-1x1-1x1-1x1-0-NCHW-FP16-W=ConvDirectNaiveConvWrw:1493.31,0,miopenConvolutionBwdWeightsAlgoDirect;ConvBinWinogradRxSf2x3g1:13.8527,0,miopenConvolutionBwdWeightsAlgoWinograd;ConvBinWinogradRxSf2x3:26.0357,0,miopenConvolutionBwdWeightsAlgoWinograd;ConvBinWinogradRxSf3x2:35.2487,0,miopenConvolutionBwdWeightsAlgoWinograd;GemmWrwUniversal:706.302,73728,miopenConvolutionBwdWeightsAlgoGEMM;ConvHipImplicitGemmGroupWrwXdlops:140.895,134438912,miopenConvolutionBwdWeightsAlgoImplicitGEMM
64-8-8-3x3-12-8-8-8192-1x1-1x1-1x1-0-NCHW-FP16-W=ConvDirectNaiveConvWrw:102.32,0,miopenConvolutionBwdWeightsAlgoDirect;ConvBinWinogradRxSf2x3g1:6.97772,0,miopenConvolutionBwdWeightsAlgoWinograd;ConvBinWinogradRxSf2x3:6.87791,0,miopenConvolutionBwdWeightsAlgoWinograd;ConvBinWinogradRxSf3x2:15.5829,0,miopenConvolutionBwdWeightsAlgoWinograd;GemmWrwUniversal:901.954,13824,miopenConvolutionBwdWeightsAlgoGEMM;ConvHipImplicitGemmGroupWrwXdlops:60.947,79733248,miopenConvolutionBwdWeightsAlgoImplicitGEMM
12-8-8-3x3-128-8-8-8192-1x1-1x1-1x1-0-NCHW-FP16-F=ConvDirectNaiveConvFwd:244.54,0,miopenConvolutionFwdAlgoDirect;ConvBinWinogradRxSf2x3g1:0.814356,0,miopenConvolutionFwdAlgoWinograd;ConvBinWinogradRxSf3x2:1.18155,0,miopenConvolutionFwdAlgoWinograd;ConvWinoFuryRxS<2-3>:0.989114,2048,miopenConvolutionFwdAlgoWinograd;GemmFwdRest:100.345,13824,miopenConvolutionFwdAlgoGEMM;ConvHipImplicitGemmGroupFwdXdlops:3.5303,146828288,miopenConvolutionFwdAlgoImplicitGEMM
128-8-8-3x3-128-8-8-8192-1x1-1x1-1x1-0-NCHW-FP16-F=ConvDirectNaiveConvFwd:2610.91,0,miopenConvolutionFwdAlgoDirect;ConvBinWinogradRxSf2x3g1:4.12443,0,miopenConvolutionFwdAlgoWinograd;ConvBinWinogradRxSf3x2:7.90771,0,miopenConvolutionFwdAlgoWinograd;ConvWinoFuryRxS<2-3>:3.21887,2048,miopenConvolutionFwdAlgoWinograd;GemmFwdRest:168.571,147456,miopenConvolutionFwdAlgoGEMM;ConvHipImplicitGemmGroupFwdXdlops:11.3964,268730368,miopenConvolutionFwdAlgoImplicitGEMM
128-8-8-3x3-128-8-8-8192-1x1-1x1-1x1-0-NCHW-FP16-B=ConvDirectNaiveConvBwd:3895.42,0,miopenConvolutionBwdDataAlgoDirect;ConvBinWinogradRxSf2x3g1:4.06022,0,miopenConvolutionBwdDataAlgoWinograd;ConvBinWinogradRxSf3x2:7.91744,0,miopenConvolutionBwdDataAlgoWinograd;ConvWinoFuryRxS<2-3>:3.14102,2048,miopenConvolutionBwdDataAlgoWinograd;GemmBwdRest:124.425,147456,miopenConvolutionBwdDataAlgoGEMM;ConvHipImplicitGemmGroupBwdXdlops:20.3474,268730368,miopenConvolutionBwdDataAlgoImplicitGEMM
128-8-8-3x3-128-8-8-8192-1x1-1x1-1x1-0-NCHW-FP16-W=ConvDirectNaiveConvWrw:1436.09,0,miopenConvolutionBwdWeightsAlgoDirect;ConvBinWinogradRxSf2x3g1:22.3031,0,miopenConvolutionBwdWeightsAlgoWinograd;ConvBinWinogradRxSf2x3:21.5962,0,miopenConvolutionBwdWeightsAlgoWinograd;ConvBinWinogradRxSf3x2:12.9904,0,miopenConvolutionBwdWeightsAlgoWinograd;GemmWrwUniversal:108.122,147456,miopenConvolutionBwdWeightsAlgoGEMM;ConvHipImplicitGemmGroupWrwXdlops:108.224,269320192,miopenConvolutionBwdWeightsAlgoImplicitGEMM
128-8-8-3x3-12-8-8-8192-1x1-1x1-1x1-0-NCHW-FP16-W=ConvDirectNaiveConvWrw:161.504,0,miopenConvolutionBwdWeightsAlgoDirect;ConvBinWinogradRxSf2x3g1:6.58638,0,miopenConvolutionBwdWeightsAlgoWinograd;ConvBinWinogradRxSf2x3:6.45888,0,miopenConvolutionBwdWeightsAlgoWinograd;ConvBinWinogradRxSf3x2:9.11341,0,miopenConvolutionBwdWeightsAlgoWinograd;GemmWrwUniversal:100.454,13824,miopenConvolutionBwdWeightsAlgoGEMM;ConvHipImplicitGemmGroupWrwXdlops:21.1705,146883584,miopenConvolutionBwdWeightsAlgoImplicitGEMM
12-8-8-3x3-256-8-8-8192-1x1-1x1-1x1-0-NCHW-FP16-F=ConvDirectNaiveConvFwd:483.878,0,miopenConvolutionFwdAlgoDirect;ConvBinWinogradRxSf2x3g1:1.50622,0,miopenConvolutionFwdAlgoWinograd;ConvBinWinogradRxSf3x2:2.41925,0,miopenConvolutionFwdAlgoWinograd;ConvWinoFuryRxS<2-3>:2.0152,2048,miopenConvolutionFwdAlgoWinograd;GemmFwdRest:100.378,13824,miopenConvolutionFwdAlgoGEMM;ConvHipImplicitGemmGroupFwdXdlops:7.05911,281073664,miopenConvolutionFwdAlgoImplicitGEMM
256-8-8-3x3-256-8-8-8192-1x1-1x1-1x1-0-NCHW-FP16-F=ConvDirectNaiveConvFwd:10422.4,0,miopenConvolutionFwdAlgoDirect;ConvBinWinogradRxSf2x3g1:15.5255,0,miopenConvolutionFwdAlgoWinograd;ConvBinWinogradRxSf3x2:32.0149,0,miopenConvolutionFwdAlgoWinograd;ConvWinoFuryRxS<2-3>:14.3906,2048,miopenConvolutionFwdAlgoWinograd;GemmFwdRest:196.385,294912,miopenConvolutionFwdAlgoGEMM;ConvHipImplicitGemmGroupFwdXdlops:39.2489,538050560,miopenConvolutionFwdAlgoImplicitGEMM
256-8-8-3x3-256-8-8-8192-1x1-1x1-1x1-0-NCHW-FP16-B=ConvDirectNaiveConvBwd:15456.4,0,miopenConvolutionBwdDataAlgoDirect;ConvBinWinogradRxSf2x3g1:15.3052,0,miopenConvolutionBwdDataAlgoWinograd;ConvBinWinogradRxSf3x2:31.8552,0,miopenConvolutionBwdDataAlgoWinograd;ConvWinoFuryRxS<2-3>:14.3147,2048,miopenConvolutionBwdDataAlgoWinograd;GemmBwdRest:191.583,294912,miopenConvolutionBwdDataAlgoGEMM;ConvHipImplicitGemmGroupBwdXdlops:74.3708,538050560,miopenConvolutionBwdDataAlgoImplicitGEMM
256-8-8-3x3-256-8-8-8192-1x1-1x1-1x1-0-NCHW-FP16-W=ConvDirectNaiveConvWrw:5627.8,0,miopenConvolutionBwdWeightsAlgoDirect;ConvBinWinogradRxSf2x3g1:163.841,0,miopenConvolutionBwdWeightsAlgoWinograd;ConvBinWinogradRxSf2x3:164.836,0,miopenConvolutionBwdWeightsAlgoWinograd;ConvBinWinogradRxSf3x2:84.4132,0,miopenConvolutionBwdWeightsAlgoWinograd;GemmWrwUniversal:149.227,294912,miopenConvolutionBwdWeightsAlgoGEMM;ConvHipImplicitGemmGroupWrwXdlops:1221.91,540409856,miopenConvolutionBwdWeightsAlgoImplicitGEMM
256-8-8-3x3-12-8-8-8192-1x1-1x1-1x1-0-NCHW-FP16-W=ConvDirectNaiveConvWrw:297.643,0,miopenConvolutionBwdWeightsAlgoDirect;ConvBinWinogradRxSf2x3g1:24.3678,0,miopenConvolutionBwdWeightsAlgoWinograd;ConvBinWinogradRxSf2x3:24.342,0,miopenConvolutionBwdWeightsAlgoWinograd;ConvBinWinogradRxSf3x2:25.0403,0,miopenConvolutionBwdWeightsAlgoWinograd;GemmWrwUniversal:111.682,13824,miopenConvolutionBwdWeightsAlgoGEMM;ConvHipImplicitGemmGroupWrwXdlops:22.6788,281184256,miopenConvolutionBwdWeightsAlgoImplicitGEMM
12-8-8-3x3-64-8-8-4849-1x1-1x1-1x1-0-NCHW-FP16-F=ConvDirectNaiveConvFwd:75.375,0,miopenConvolutionFwdAlgoDirect;ConvBinWinogradRxSf2x3g1:0.242657,0,miopenConvolutionFwdAlgoWinograd;ConvBinWinogradRxSf3x2:0.348449,0,miopenConvolutionFwdAlgoWinograd;ConvWinoFuryRxS<2-3>:0.236318,2048,miopenConvolutionFwdAlgoWinograd;GemmFwdRest:58.7054,13824,miopenConvolutionFwdAlgoGEMM;ConvHipImplicitGemmGroupFwdXdlops:1.34617,47184896,miopenConvolutionFwdAlgoImplicitGEMM
64-8-8-3x3-64-8-8-4849-1x1-1x1-1x1-0-NCHW-FP16-F=ConvDirectNaiveConvFwd:387.594,0,miopenConvolutionFwdAlgoDirect;ConvBinWinogradRxSf2x3g1:0.750579,0,miopenConvolutionFwdAlgoWinograd;ConvBinWinogradRxSf3x2:1.16123,0,miopenConvolutionFwdAlgoWinograd;ConvWinoFuryRxS<2-3>:0.561484,2048,miopenConvolutionFwdAlgoWinograd;GemmFwdRest:66.4934,73728,miopenConvolutionFwdAlgoGEMM;ConvHipImplicitGemmGroupFwdXdlops:2.15457,79519744,miopenConvolutionFwdAlgoImplicitGEMM
64-8-8-3x3-64-8-8-4849-1x1-1x1-1x1-0-NCHW-FP16-B=ConvDirectNaiveConvBwd:578.789,0,miopenConvolutionBwdDataAlgoDirect;ConvBinWinogradRxSf2x3g1:0.726506,0,miopenConvolutionBwdDataAlgoWinograd;ConvBinWinogradRxSf3x2:1.12821,0,miopenConvolutionBwdDataAlgoWinograd;ConvWinoFuryRxS<2-3>:0.544146,2048,miopenConvolutionBwdDataAlgoWinograd;GemmBwdRest:64.8191,73728,miopenConvolutionBwdDataAlgoGEMM;ConvHipImplicitGemmGroupBwdXdlops:3.42971,79519744,miopenConvolutionBwdDataAlgoImplicitGEMM
64-8-8-3x3-64-8-8-4849-1x1-1x1-1x1-0-NCHW-FP16-W=ConvDirectNaiveConvWrw:275.955,0,miopenConvolutionBwdWeightsAlgoDirect;ConvBinWinogradRxSf2x3g1:4.06582,0,miopenConvolutionBwdWeightsAlgoWinograd;ConvBinWinogradRxSf2x3:4.05443,0,miopenConvolutionBwdWeightsAlgoWinograd;ConvBinWinogradRxSf3x2:5.49644,0,miopenConvolutionBwdWeightsAlgoWinograd;GemmWrwUniversal:60.5659,73728,miopenConvolutionBwdWeightsAlgoGEMM;ConvHipImplicitGemmGroupWrwXdlops:13.8272,79667200,miopenConvolutionBwdWeightsAlgoImplicitGEMM
64-8-8-3x3-12-8-8-4849-1x1-1x1-1x1-0-NCHW-FP16-W=ConvDirectNaiveConvWrw:60.5211,0,miopenConvolutionBwdWeightsAlgoDirect;ConvBinWinogradRxSf2x3g1:3.64549,0,miopenConvolutionBwdWeightsAlgoWinograd;ConvBinWinogradRxSf2x3:3.63132,0,miopenConvolutionBwdWeightsAlgoWinograd;ConvBinWinogradRxSf3x2:4.45309,0,miopenConvolutionBwdWeightsAlgoWinograd;GemmWrwUniversal:59.7169,13824,miopenConvolutionBwdWeightsAlgoGEMM;ConvHipImplicitGemmGroupWrwXdlops:11.4464,47212544,miopenConvolutionBwdWeightsAlgoImplicitGEMM
12-8-8-3x3-64-8-8-16384-1x1-1x1-1x1-0-NCHW-FP16-F=ConvDirectNaiveConvFwd:243.363,0,miopenConvolutionFwdAlgoDirect;ConvBinWinogradRxSf2x3g1:0.818854,0,miopenConvolutionFwdAlgoWinograd;ConvBinWinogradRxSf3x2:1.14682,0,miopenConvolutionFwdAlgoWinograd;ConvWinoFuryRxS<2-3>:1.03915,2048,miopenConvolutionFwdAlgoWinograd;GemmFwdRest:202.46,13824,miopenConvolutionFwdAlgoGEMM;ConvHipImplicitGemmGroupFwdXdlops:4.38284,159397376,miopenConvolutionFwdAlgoImplicitGEMM
64-8-8-3x3-64-8-8-16384-1x1-1x1-1x1-0-NCHW-FP16-F=ConvDirectNaiveConvFwd:1309.43,0,miopenConvolutionFwdAlgoDirect;ConvBinWinogradRxSf2x3g1:2.28668,0,miopenConvolutionFwdAlgoWinograd;ConvBinWinogradRxSf3x2:4.17503,0,miopenConvolutionFwdAlgoWinograd;ConvWinoFuryRxS<2-3>:1.69028,2048,miopenConvolutionFwdAlgoWinograd;GemmFwdRest:232.187,73728,miopenConvolutionFwdAlgoGEMM;ConvHipImplicitGemmGroupFwdXdlops:7.289,268509184,miopenConvolutionFwdAlgoImplicitGEMM
