claude-experiments/hifigan-rocm-bisect/captures/grind/run_20260510T033906_0300870f/miopen_snapshot/user_db/gfx1151_20.HIP.3_5_1_5b515cf1bc.ufdb.txt
3-1-14-14-1x14x14-1280-1-1-1-23088-0x0x0-1x14x14-1x1x1-0-NCDHW-BF16-F=GemmFwdRest:1435.07,1176,miopenConvolutionFwdAlgoGEMM;ConvDirectNaiveConvFwd:15258.2,0,miopenConvolutionFwdAlgoDirect
3-1-14-14-1x14x14-1280-1-1-1-12096-0x0x0-1x14x14-1x1x1-0-NCDHW-BF16-F=GemmFwdRest:751.606,1176,miopenConvolutionFwdAlgoGEMM;ConvDirectNaiveConvFwd:18502.2,0,miopenConvolutionFwdAlgoDirect
3-1-14-14-1x14x14-1280-1-1-1-6048-0x0x0-1x14x14-1x1x1-0-NCDHW-BF16-F=GemmFwdRest:371.397,1176,miopenConvolutionFwdAlgoGEMM;ConvDirectNaiveConvFwd:9245.05,0,miopenConvolutionFwdAlgoDirect
3-1-14-14-1x14x14-1280-1-1-1-10080-0x0x0-1x14x14-1x1x1-0-NCDHW-BF16-F=GemmFwdRest:624.655,1176,miopenConvolutionFwdAlgoGEMM;ConvDirectNaiveConvFwd:15401.9,0,miopenConvolutionFwdAlgoDirect
3-1-14-14-1x14x14-1280-1-1-1-8064-0x0x0-1x14x14-1x1x1-0-NCDHW-BF16-F=GemmFwdRest:493.654,1176,miopenConvolutionFwdAlgoGEMM;ConvDirectNaiveConvFwd:12326.3,0,miopenConvolutionFwdAlgoDirect
3-1200-1200-3x3-32-600-600-5-1x1-2x2-1x1-0-NCHW-FP16-F=ConvBinWinogradRxSf2x3g1:0.965311,0,miopenConvolutionFwdAlgoWinograd;ConvBinWinogradRxSf3x2:0.861348,0,miopenConvolutionFwdAlgoWinograd;GemmFwdRest:1.80331,19440000,miopenConvolutionFwdAlgoGEMM;ConvDirectNaiveConvFwd:27.3636,0,miopenConvolutionFwdAlgoDirect
32-600-600-3x3-32-600-600-5-1x1-1x1-1x1-0-NCHW-FP16-F=ConvBinWinogradRxSf2x3g1:1.26622,0,miopenConvolutionFwdAlgoWinograd;ConvBinWinogradRxSf3x2:1.54939,0,miopenConvolutionFwdAlgoWinograd;GemmFwdRest:11.4557,207360000,miopenConvolutionFwdAlgoGEMM;ConvDirectNaiveConvFwd:284.02,0,miopenConvolutionFwdAlgoDirect
32-600-600-3x3-512-300-300-5-1x1-2x2-1x1-0-NCHW-FP16-F=ConvBinWinogradRxSf2x3g1:14.9971,0,miopenConvolutionFwdAlgoWinograd;ConvBinWinogradRxSf3x2:7.50314,0,miopenConvolutionFwdAlgoWinograd;GemmFwdRest:7.21832,51840000,miopenConvolutionFwdAlgoGEMM;ConvDirectNaiveConvFwd:1138.7,0,miopenConvolutionFwdAlgoDirect
512-300-300-1x1-64-300-300-5-0x0-1x1-1x1-0-NCHW-FP16-F=ConvBinWinogradRxSf2x3g1:6.20484,0,miopenConvolutionFwdAlgoWinograd;ConvBinWinogradRxSf3x2:3.54486,0,miopenConvolutionFwdAlgoWinograd;GemmFwd1x1_0_1:2.4581,0,miopenConvolutionFwdAlgoGEMM;ConvDirectNaiveConvFwd:313.818,0,miopenConvolutionFwdAlgoDirect
64-300-300-3x3-256-300-300-5-1x1-1x1-1x1-0-NCHW-FP16-F=ConvBinWinogradRxSf2x3g1:3.79563,0,miopenConvolutionFwdAlgoWinograd;ConvBinWinogradRxSf3x2:5.50842,0,miopenConvolutionFwdAlgoWinograd;GemmFwdRest:7.58183,103680000,miopenConvolutionFwdAlgoGEMM;ConvDirectNaiveConvFwd:1150.92,0,miopenConvolutionFwdAlgoDirect
256-300-300-1x1-64-300-300-5-0x0-1x1-1x1-0-NCHW-FP16-F=ConvBinWinogradRxSf2x3g1:3.13175,0,miopenConvolutionFwdAlgoWinograd;ConvBinWinogradRxSf3x2:1.86484,0,miopenConvolutionFwdAlgoWinograd;GemmFwd1x1_0_1:1.3868,0,miopenConvolutionFwdAlgoGEMM;ConvDirectNaiveConvFwd:146.69,0,miopenConvolutionFwdAlgoDirect
64-300-300-3x3-1024-150-150-5-1x1-2x2-1x1-0-NCHW-FP16-F=ConvBinWinogradRxSf2x3g1:14.3199,0,miopenConvolutionFwdAlgoWinograd;ConvBinWinogradRxSf3x2:6.553,0,miopenConvolutionFwdAlgoWinograd;GemmFwdRest:5.0982,25920000,miopenConvolutionFwdAlgoGEMM;ConvDirectNaiveConvFwd:1142.67,0,miopenConvolutionFwdAlgoDirect
1024-150-150-1x1-128-150-150-5-0x0-1x1-1x1-0-NCHW-FP16-F=ConvBinWinogradRxSf2x3g1:6.08225,0,miopenConvolutionFwdAlgoWinograd;ConvBinWinogradRxSf3x2:3.38675,0,miopenConvolutionFwdAlgoWinograd;GemmFwd1x1_0_1:1.31158,0,miopenConvolutionFwdAlgoGEMM;ConvDirectNaiveConvFwd:302.601,0,miopenConvolutionFwdAlgoDirect
128-150-150-3x3-512-150-150-5-1x1-1x1-1x1-0-NCHW-FP16-F=ConvBinWinogradRxSf2x3g1:3.47963,0,miopenConvolutionFwdAlgoWinograd;ConvBinWinogradRxSf3x2:5.44033,0,miopenConvolutionFwdAlgoWinograd;GemmFwdRest:5.04049,51840000,miopenConvolutionFwdAlgoGEMM;ConvDirectNaiveConvFwd:1135.88,0,miopenConvolutionFwdAlgoDirect
512-150-150-1x1-128-150-150-5-0x0-1x1-1x1-0-NCHW-FP16-F=ConvBinWinogradRxSf2x3g1:3.15009,0,miopenConvolutionFwdAlgoWinograd;ConvBinWinogradRxSf3x2:1.60518,0,miopenConvolutionFwdAlgoWinograd;GemmFwd1x1_0_1:0.747566,0,miopenConvolutionFwdAlgoGEMM;ConvDirectNaiveConvFwd:147.181,0,miopenConvolutionFwdAlgoDirect
128-150-150-1x1-2048-150-150-5-0x0-1x1-1x1-0-NCHW-FP16-F=ConvBinWinogradRxSf2x3g1:13.0766,0,miopenConvolutionFwdAlgoWinograd;ConvBinWinogradRxSf3x2:6.72341,0,miopenConvolutionFwdAlgoWinograd;GemmFwd1x1_0_1:3.1349,0,miopenConvolutionFwdAlgoGEMM;ConvDirectNaiveConvFwd:568.428,0,miopenConvolutionFwdAlgoDirect
2048-150-150-3x3-2048-75-75-5-1x1-2x2-1x1-0-NCHW-FP16-F_g2048=ConvBinWinogradRxSf2x3:22.2789,0,miopenConvolutionFwdAlgoWinograd;ConvBinWinogradRxSf3x2:14.3714,0,miopenConvolutionFwdAlgoWinograd;GemmFwdRest:36.4735,207360000,miopenConvolutionFwdAlgoGEMM;ConvDirectNaiveConvFwd:10.2927,0,miopenConvolutionFwdAlgoDirect
2048-75-75-1x1-256-75-75-5-0x0-1x1-1x1-0-NCHW-FP16-F=ConvBinWinogradRxSf2x3g1:6.27405,0,miopenConvolutionFwdAlgoWinograd;ConvBinWinogradRxSf3x2:4.45394,0,miopenConvolutionFwdAlgoWinograd;GemmFwd1x1_0_1:0.909367,0,miopenConvolutionFwdAlgoGEMM;ConvDirectNaiveConvFwd:303.37,0,miopenConvolutionFwdAlgoDirect
256-75-75-1x1-1024-75-75-5-0x0-1x1-1x1-0-NCHW-FP16-F=ConvBinWinogradRxSf2x3g1:3.25355,0,miopenConvolutionFwdAlgoWinograd;ConvBinWinogradRxSf3x2:1.47246,0,miopenConvolutionFwdAlgoWinograd;GemmFwd1x1_0_1:0.587028,0,miopenConvolutionFwdAlgoGEMM;ConvDirectNaiveConvFwd:140.478,0,miopenConvolutionFwdAlgoDirect
1024-75-75-3x3-1024-75-75-5-1x1-1x1-1x1-0-NCHW-FP16-F_g1024=ConvBinWinogradRxSf2x3:7.17982,0,miopenConvolutionFwdAlgoWinograd;ConvBinWinogradRxSf3x2:7.08931,0,miopenConvolutionFwdAlgoWinograd;GemmFwdRest:16.9985,103680000,miopenConvolutionFwdAlgoGEMM;ConvDirectNaiveConvFwd:4.91063,0,miopenConvolutionFwdAlgoDirect
1024-75-75-1x1-256-75-75-5-0x0-1x1-1x1-0-NCHW-FP16-F=ConvBinWinogradRxSf2x3g1:3.18817,0,miopenConvolutionFwdAlgoWinograd;ConvBinWinogradRxSf3x2:1.45124,0,miopenConvolutionFwdAlgoWinograd;GemmFwd1x1_0_1:0.43028,0,miopenConvolutionFwdAlgoGEMM;ConvDirectNaiveConvFwd:146.343,0,miopenConvolutionFwdAlgoDirect
256-75-75-1x1-6144-75-75-5-0x0-1x1-1x1-0-NCHW-FP16-F=ConvBinWinogradRxSf2x3g1:19.6477,0,miopenConvolutionFwdAlgoWinograd;ConvBinWinogradRxSf3x2:9.10838,0,miopenConvolutionFwdAlgoWinograd;GemmFwd1x1_0_1:2.90011,0,miopenConvolutionFwdAlgoGEMM;ConvDirectNaiveConvFwd:843.3,0,miopenConvolutionFwdAlgoDirect
6144-75-75-3x3-6144-38-38-5-1x1-2x2-1x1-0-NCHW-FP16-F_g6144=ConvBinWinogradRxSf2x3:16.816,0,miopenConvolutionFwdAlgoWinograd;ConvBinWinogradRxSf3x2:12.3789,0,miopenConvolutionFwdAlgoWinograd;GemmFwdRest:30.2292,159694848,miopenConvolutionFwdAlgoGEMM;ConvDirectNaiveConvFwd:8.12773,0,miopenConvolutionFwdAlgoDirect
6144-38-38-1x1-512-38-38-5-0x0-1x1-1x1-0-NCHW-FP16-F=ConvBinWinogradRxSf2x3g1:9.6185,0,miopenConvolutionFwdAlgoWinograd;ConvBinWinogradRxSf3x2:6.1619,0,miopenConvolutionFwdAlgoWinograd;GemmFwd1x1_0_1:1.78212,0,miopenConvolutionFwdAlgoGEMM;ConvDirectNaiveConvFwd:491.32,0,miopenConvolutionFwdAlgoDirect
512-38-38-1x1-1536-38-38-5-0x0-1x1-1x1-0-NCHW-FP16-F=ConvBinWinogradRxSf2x3g1:2.54674,0,miopenConvolutionFwdAlgoWinograd;ConvBinWinogradRxSf3x2:1.06282,0,miopenConvolutionFwdAlgoWinograd;GemmFwd1x1_0_1:0.308964,0,miopenConvolutionFwdAlgoGEMM;ConvDirectNaiveConvFwd:112.212,0,miopenConvolutionFwdAlgoDirect
1536-38-38-5x5-1536-38-38-5-2x2-1x1-1x1-0-NCHW-FP16-F_g1536=ConvBinWinogradRxSf2x3:4.24523,0,miopenConvolutionFwdAlgoWinograd;ConvBinWinogradRxSf3x2:5.1738,0,miopenConvolutionFwdAlgoWinograd;GemmFwdRest:9.6838,110899200,miopenConvolutionFwdAlgoGEMM;ConvDirectNaiveConvFwd:4.80542,0,miopenConvolutionFwdAlgoDirect
1536-38-38-1x1-1536-38-38-5-0x0-1x1-1x1-0-NCHW-FP16-F_g48=ConvBinWinogradRxSf2x3:0.261474,0,miopenConvolutionFwdAlgoWinograd;ConvBinWinogradRxSf3x2:0.213987,0,miopenConvolutionFwdAlgoWinograd;GemmFwd1x1_0_1:0.312226,0,miopenConvolutionFwdAlgoGEMM;ConvDirectNaiveConvFwd:7.29757,0,miopenConvolutionFwdAlgoDirect
1024-38-38-1x1-512-38-38-5-0x0-1x1-1x1-0-NCHW-FP16-F=ConvBinWinogradRxSf2x3g1:1.74797,0,miopenConvolutionFwdAlgoWinograd;ConvBinWinogradRxSf3x2:0.664874,0,miopenConvolutionFwdAlgoWinograd;GemmFwd1x1_0_1:0.233056,0,miopenConvolutionFwdAlgoGEMM;ConvDirectNaiveConvFwd:75.2855,0,miopenConvolutionFwdAlgoDirect
512-38-38-1x1-3072-38-38-5-0x0-1x1-1x1-0-NCHW-FP16-F=ConvBinWinogradRxSf2x3g1:5.0069,0,miopenConvolutionFwdAlgoWinograd;ConvBinWinogradRxSf3x2:2.20652,0,miopenConvolutionFwdAlgoWinograd;GemmFwd1x1_0_1:0.640276,0,miopenConvolutionFwdAlgoGEMM;ConvDirectNaiveConvFwd:224.116,0,miopenConvolutionFwdAlgoDirect
3072-38-38-3x3-3072-38-38-5-1x1-1x1-1x1-0-NCHW-FP16-F_g3072=ConvBinWinogradRxSf2x3:5.47589,0,miopenConvolutionFwdAlgoWinograd;ConvBinWinogradRxSf3x2:5.94428,0,miopenConvolutionFwdAlgoWinograd;GemmFwdRest:13.7296,79847424,miopenConvolutionFwdAlgoGEMM;ConvDirectNaiveConvFwd:3.89105,0,miopenConvolutionFwdAlgoDirect
3072-38-38-1x1-512-38-38-5-0x0-1x1-1x1-0-NCHW-FP16-F=ConvBinWinogradRxSf2x3g1:4.73069,0,miopenConvolutionFwdAlgoWinograd;ConvBinWinogradRxSf3x2:2.45105,0,miopenConvolutionFwdAlgoWinograd;GemmFwd1x1_0_1:0.787245,0,miopenConvolutionFwdAlgoGEMM;ConvDirectNaiveConvFwd:236.224,0,miopenConvolutionFwdAlgoDirect
512-300-300-1x1-512-300-300-5-0x0-1x1-1x1-0-NCHW-FP16-F=ConvBinWinogradRxSf2x3g1:49.2663,0,miopenConvolutionFwdAlgoWinograd;ConvBinWinogradRxSf3x2:22.723,0,miopenConvolutionFwdAlgoWinograd;GemmFwd1x1_0_1:7.88631,0,miopenConvolutionFwdAlgoGEMM;ConvDirectNaiveConvFwd:2887.21,0,miopenConvolutionFwdAlgoDirect
512-300-300-1x1-2-300-300-5-0x0-1x1-1x1-0-NCHW-FP16-F=ConvBinWinogradRxSf2x3g1:2.9652,0,miopenConvolutionFwdAlgoWinograd;ConvBinWinogradRxSf3x2:2.26412,0,miopenConvolutionFwdAlgoWinograd;GemmFwd1x1_0_1:2.08252,0,miopenConvolutionFwdAlgoGEMM;ConvDirectNaiveConvFwd:70.8042,0,miopenConvolutionFwdAlgoDirect
3-1-14-14-1x14x14-1280-1-1-1-14392-0x0x0-1x14x14-1x1x1-0-NCDHW-BF16-F=GemmFwdRest:891.016,1176,miopenConvolutionFwdAlgoGEMM;ConvDirectNaiveConvFwd:1965.66,0,miopenConvolutionFwdAlgoDirect
3-1-14-14-1x14x14-1280-1-1-1-512-0x0x0-1x14x14-1x1x1-0-NCDHW-BF16-F=GemmFwdRest:31.0276,1176,miopenConvolutionFwdAlgoGEMM;ConvDirectNaiveConvFwd:783.511,0,miopenConvolutionFwdAlgoDirect
3-1-14-14-1x14x14-1280-1-1-1-1020-0x0x0-1x14x14-1x1x1-0-NCDHW-BF16-F=GemmFwdRest:61.7048,1176,miopenConvolutionFwdAlgoGEMM;ConvDirectNaiveConvFwd:1560.65,0,miopenConvolutionFwdAlgoDirect
3-768-768-4x4-128-192-192-3-0x0-4x4-1x1-0-NCHW-FP16-F=GemmFwdRest:0.285997,3538944,miopenConvolutionFwdAlgoGEMM;ConvDirectNaiveConvFwd:12.0017,0,miopenConvolutionFwdAlgoDirect
3-1-14-14-1x14x14-1280-1-1-1-22372-0x0x0-1x14x14-1x1x1-0-NCDHW-BF16-F=GemmFwdRest:1400.19,1176,miopenConvolutionFwdAlgoGEMM;ConvDirectNaiveConvFwd:14162.5,0,miopenConvolutionFwdAlgoDirect
3-1-14-14-1x14x14-1280-1-1-1-5712-0x0x0-1x14x14-1x1x1-0-NCDHW-BF16-F=GemmFwdRest:355.587,1176,miopenConvolutionFwdAlgoGEMM;ConvDirectNaiveConvFwd:8725.61,0,miopenConvolutionFwdAlgoDirect
3-1-14-14-1x14x14-1280-1-1-1-7616-0x0x0-1x14x14-1x1x1-0-NCDHW-BF16-F=GemmFwdRest:474.917,1176,miopenConvolutionFwdAlgoGEMM;ConvDirectNaiveConvFwd:11637.2,0,miopenConvolutionFwdAlgoDirect
3-1-14-14-1x14x14-1280-1-1-1-9520-0x0x0-1x14x14-1x1x1-0-NCDHW-BF16-F=GemmFwdRest:595.793,1176,miopenConvolutionFwdAlgoGEMM;ConvDirectNaiveConvFwd:14543.8,0,miopenConvolutionFwdAlgoDirect
3-1200-1200-3x3-32-600-600-6-1x1-2x2-1x1-0-NCHW-FP16-F=ConvBinWinogradRxSf2x3g1:1.14884,0,miopenConvolutionFwdAlgoWinograd;ConvBinWinogradRxSf3x2:1.02601,0,miopenConvolutionFwdAlgoWinograd;GemmFwdRest:2.13897,19440000,miopenConvolutionFwdAlgoGEMM;ConvDirectNaiveConvFwd:35.4057,0,miopenConvolutionFwdAlgoDirect
32-600-600-3x3-32-600-600-6-1x1-1x1-1x1-0-NCHW-FP16-F=ConvBinWinogradRxSf2x3g1:1.50687,0,miopenConvolutionFwdAlgoWinograd;ConvBinWinogradRxSf3x2:1.8874,0,miopenConvolutionFwdAlgoWinograd;GemmFwdRest:13.6946,207360000,miopenConvolutionFwdAlgoGEMM;ConvDirectNaiveConvFwd:372.754,0,miopenConvolutionFwdAlgoDirect
32-600-600-3x3-512-300-300-6-1x1-2x2-1x1-0-NCHW-FP16-F=ConvBinWinogradRxSf2x3g1:18.0628,0,miopenConvolutionFwdAlgoWinograd;ConvBinWinogradRxSf3x2:9.02718,0,miopenConvolutionFwdAlgoWinograd;GemmFwdRest:8.81306,51840000,miopenConvolutionFwdAlgoGEMM;ConvDirectNaiveConvFwd:1358.97,0,miopenConvolutionFwdAlgoDirect
512-300-300-1x1-64-300-300-6-0x0-1x1-1x1-0-NCHW-FP16-F=ConvBinWinogradRxSf2x3g1:7.56312,0,miopenConvolutionFwdAlgoWinograd;ConvBinWinogradRxSf3x2:4.21324,0,miopenConvolutionFwdAlgoWinograd;GemmFwd1x1_0_1:2.93821,0,miopenConvolutionFwdAlgoGEMM;ConvDirectNaiveConvFwd:419.968,0,miopenConvolutionFwdAlgoDirect
64-300-300-3x3-256-300-300-6-1x1-1x1-1x1-0-NCHW-FP16-F=ConvBinWinogradRxSf2x3g1:4.58002,0,miopenConvolutionFwdAlgoWinograd;ConvBinWinogradRxSf3x2:6.63308,0,miopenConvolutionFwdAlgoWinograd;GemmFwdRest:9.11141,103680000,miopenConvolutionFwdAlgoGEMM;ConvDirectNaiveConvFwd:1359.52,0,miopenConvolutionFwdAlgoDirect
256-300-300-1x1-64-300-300-6-0x0-1x1-1x1-0-NCHW-FP16-F=ConvBinWinogradRxSf2x3g1:3.76287,0,miopenConvolutionFwdAlgoWinograd;ConvBinWinogradRxSf3x2:2.22564,0,miopenConvolutionFwdAlgoWinograd;GemmFwd1x1_0_1:1.65782,0,miopenConvolutionFwdAlgoGEMM;ConvDirectNaiveConvFwd:195.065,0,miopenConvolutionFwdAlgoDirect
64-300-300-3x3-1024-150-150-6-1x1-2x2-1x1-0-NCHW-FP16-F=ConvBinWinogradRxSf2x3g1:17.1333,0,miopenConvolutionFwdAlgoWinograd;ConvBinWinogradRxSf3x2:7.78929,0,miopenConvolutionFwdAlgoWinograd;GemmFwdRest:6.05369,25920000,miopenConvolutionFwdAlgoGEMM;ConvDirectNaiveConvFwd:1370.93,0,miopenConvolutionFwdAlgoDirect
1024-150-150-1x1-128-150-150-6-0x0-1x1-1x1-0-NCHW-FP16-F=ConvBinWinogradRxSf2x3g1:7.37844,0,miopenConvolutionFwdAlgoWinograd;ConvBinWinogradRxSf3x2:4.0923,0,miopenConvolutionFwdAlgoWinograd;GemmFwd1x1_0_1:1.56741,0,miopenConvolutionFwdAlgoGEMM;ConvDirectNaiveConvFwd:366.524,0,miopenConvolutionFwdAlgoDirect
128-150-150-3x3-512-150-150-6-1x1-1x1-1x1-0-NCHW-FP16-F=ConvBinWinogradRxSf2x3g1:4.17718,0,miopenConvolutionFwdAlgoWinograd;ConvBinWinogradRxSf3x2:6.46364,0,miopenConvolutionFwdAlgoWinograd;GemmFwdRest:6.1813,51840000,miopenConvolutionFwdAlgoGEMM;ConvDirectNaiveConvFwd:1356.57,0,miopenConvolutionFwdAlgoDirect
512-150-150-1x1-128-150-150-6-0x0-1x1-1x1-0-NCHW-FP16-F=ConvBinWinogradRxSf2x3g1:3.71418,0,miopenConvolutionFwdAlgoWinograd;ConvBinWinogradRxSf3x2:1.91275,0,miopenConvolutionFwdAlgoWinograd;GemmFwd1x1_0_1:0.903013,0,miopenConvolutionFwdAlgoGEMM;ConvDirectNaiveConvFwd:178.266,0,miopenConvolutionFwdAlgoDirect
128-150-150-1x1-2048-150-150-6-0x0-1x1-1x1-0-NCHW-FP16-F=ConvBinWinogradRxSf2x3g1:15.6431,0,miopenConvolutionFwdAlgoWinograd;ConvBinWinogradRxSf3x2:7.94797,0,miopenConvolutionFwdAlgoWinograd;GemmFwd1x1_0_1:3.76325,0,miopenConvolutionFwdAlgoGEMM;ConvDirectNaiveConvFwd:681.944,0,miopenConvolutionFwdAlgoDirect
2048-150-150-3x3-2048-75-75-6-1x1-2x2-1x1-0-NCHW-FP16-F_g2048=ConvBinWinogradRxSf2x3:26.3071,0,miopenConvolutionFwdAlgoWinograd;ConvBinWinogradRxSf3x2:17.2501,0,miopenConvolutionFwdAlgoWinograd;GemmFwdRest:43.7522,207360000,miopenConvolutionFwdAlgoGEMM;ConvDirectNaiveConvFwd:12.3367,0,miopenConvolutionFwdAlgoDirect
2048-75-75-1x1-256-75-75-6-0x0-1x1-1x1-0-NCHW-FP16-F=ConvBinWinogradRxSf2x3g1:7.49857,0,miopenConvolutionFwdAlgoWinograd;ConvBinWinogradRxSf3x2:5.6505,0,miopenConvolutionFwdAlgoWinograd;GemmFwd1x1_0_1:1.15486,0,miopenConvolutionFwdAlgoGEMM;ConvDirectNaiveConvFwd:369.404,0,miopenConvolutionFwdAlgoDirect
256-75-75-1x1-1024-75-75-6-0x0-1x1-1x1-0-NCHW-FP16-F=ConvBinWinogradRxSf2x3g1:3.86585,0,miopenConvolutionFwdAlgoWinograd;ConvBinWinogradRxSf3x2:1.73842,0,miopenConvolutionFwdAlgoWinograd;GemmFwd1x1_0_1:0.700288,0,miopenConvolutionFwdAlgoGEMM;ConvDirectNaiveConvFwd:167.402,0,miopenConvolutionFwdAlgoDirect
1024-75-75-3x3-1024-75-75-6-1x1-1x1-1x1-0-NCHW-FP16-F_g1024=ConvBinWinogradRxSf2x3:8.45958,0,miopenConvolutionFwdAlgoWinograd;ConvBinWinogradRxSf3x2:8.5793,0,miopenConvolutionFwdAlgoWinograd;GemmFwdRest:20.5973,103680000,miopenConvolutionFwdAlgoGEMM;ConvDirectNaiveConvFwd:5.88309,0,miopenConvolutionFwdAlgoDirect
1024-75-75-1x1-256-75-75-6-0x0-1x1-1x1-0-NCHW-FP16-F=ConvBinWinogradRxSf2x3g1:3.81283,0,miopenConvolutionFwdAlgoWinograd;ConvBinWinogradRxSf3x2:1.8778,0,miopenConvolutionFwdAlgoWinograd;GemmFwd1x1_0_1:0.529337,0,miopenConvolutionFwdAlgoGEMM;ConvDirectNaiveConvFwd:174.812,0,miopenConvolutionFwdAlgoDirect
256-75-75-1x1-6144-75-75-6-0x0-1x1-1x1-0-NCHW-FP16-F=ConvBinWinogradRxSf2x3g1:23.4965,0,miopenConvolutionFwdAlgoWinograd;ConvBinWinogradRxSf3x2:10.9577,0,miopenConvolutionFwdAlgoWinograd;GemmFwd1x1_0_1:3.47116,0,miopenConvolutionFwdAlgoGEMM;ConvDirectNaiveConvFwd:1009.14,0,miopenConvolutionFwdAlgoDirect
6144-75-75-3x3-6144-38-38-6-1x1-2x2-1x1-0-NCHW-FP16-F_g6144=ConvBinWinogradRxSf2x3:19.9537,0,miopenConvolutionFwdAlgoWinograd;ConvBinWinogradRxSf3x2:14.4976,0,miopenConvolutionFwdAlgoWinograd;GemmFwdRest:36.335,159694848,miopenConvolutionFwdAlgoGEMM;ConvDirectNaiveConvFwd:9.74212,0,miopenConvolutionFwdAlgoDirect
6144-38-38-1x1-512-38-38-6-0x0-1x1-1x1-0-NCHW-FP16-F=ConvBinWinogradRxSf2x3g1:11.5415,0,miopenConvolutionFwdAlgoWinograd;ConvBinWinogradRxSf3x2:9.16766,0,miopenConvolutionFwdAlgoWinograd;GemmFwd1x1_0_1:1.96549,0,miopenConvolutionFwdAlgoGEMM;ConvDirectNaiveConvFwd:593.294,0,miopenConvolutionFwdAlgoDirect
512-38-38-1x1-1536-38-38-6-0x0-1x1-1x1-0-NCHW-FP16-F=ConvBinWinogradRxSf2x3g1:2.97964,0,miopenConvolutionFwdAlgoWinograd;ConvBinWinogradRxSf3x2:1.29682,0,miopenConvolutionFwdAlgoWinograd;GemmFwd1x1_0_1:0.368994,0,miopenConvolutionFwdAlgoGEMM;ConvDirectNaiveConvFwd:133.944,0,miopenConvolutionFwdAlgoDirect
1536-38-38-5x5-1536-38-38-6-2x2-1x1-1x1-0-NCHW-FP16-F_g1536=ConvBinWinogradRxSf2x3:5.10608,0,miopenConvolutionFwdAlgoWinograd;ConvBinWinogradRxSf3x2:6.12267,0,miopenConvolutionFwdAlgoWinograd;GemmFwdRest:11.6087,110899200,miopenConvolutionFwdAlgoGEMM;ConvDirectNaiveConvFwd:5.75124,0,miopenConvolutionFwdAlgoDirect
1536-38-38-1x1-1536-38-38-6-0x0-1x1-1x1-0-NCHW-FP16-F_g48=ConvBinWinogradRxSf2x3:0.309582,0,miopenConvolutionFwdAlgoWinograd;ConvBinWinogradRxSf3x2:0.282295,0,miopenConvolutionFwdAlgoWinograd;GemmFwd1x1_0_1:0.366844,0,miopenConvolutionFwdAlgoGEMM;ConvDirectNaiveConvFwd:8.90528,0,miopenConvolutionFwdAlgoDirect
1024-38-38-1x1-512-38-38-6-0x0-1x1-1x1-0-NCHW-FP16-F=ConvBinWinogradRxSf2x3g1:1.9974,0,miopenConvolutionFwdAlgoWinograd;ConvBinWinogradRxSf3x2:0.797991,0,miopenConvolutionFwdAlgoWinograd;GemmFwd1x1_0_1:0.250328,0,miopenConvolutionFwdAlgoGEMM;ConvDirectNaiveConvFwd:90.2602,0,miopenConvolutionFwdAlgoDirect
512-38-38-1x1-3072-38-38-6-0x0-1x1-1x1-0-NCHW-FP16-F=ConvBinWinogradRxSf2x3g1:5.94018,0,miopenConvolutionFwdAlgoWinograd;ConvBinWinogradRxSf3x2:2.60914,0,miopenConvolutionFwdAlgoWinograd;GemmFwd1x1_0_1:0.769203,0,miopenConvolutionFwdAlgoGEMM;ConvDirectNaiveConvFwd:270.237,0,miopenConvolutionFwdAlgoDirect
3072-38-38-3x3-3072-38-38-6-1x1-1x1-1x1-0-NCHW-FP16-F_g3072=ConvBinWinogradRxSf2x3:6.48685,0,miopenConvolutionFwdAlgoWinograd;ConvBinWinogradRxSf3x2:7.15788,0,miopenConvolutionFwdAlgoWinograd;GemmFwdRest:16.6746,79847424,miopenConvolutionFwdAlgoGEMM;ConvDirectNaiveConvFwd:4.65888,0,miopenConvolutionFwdAlgoDirect
3072-38-38-1x1-512-38-38-6-0x0-1x1-1x1-0-NCHW-FP16-F=ConvBinWinogradRxSf2x3g1:5.79926,0,miopenConvolutionFwdAlgoWinograd;ConvBinWinogradRxSf3x2:3.48947,0,miopenConvolutionFwdAlgoWinograd;GemmFwd1x1_0_1:0.882834,0,miopenConvolutionFwdAlgoGEMM;ConvDirectNaiveConvFwd:282.941,0,miopenConvolutionFwdAlgoDirect
512-300-300-1x1-512-300-300-6-0x0-1x1-1x1-0-NCHW-FP16-F=ConvBinWinogradRxSf2x3g1:59.2529,0,miopenConvolutionFwdAlgoWinograd;ConvBinWinogradRxSf3x2:29.3572,0,miopenConvolutionFwdAlgoWinograd;GemmFwd1x1_0_1:9.47535,0,miopenConvolutionFwdAlgoGEMM;ConvDirectNaiveConvFwd:3494.47,0,miopenConvolutionFwdAlgoDirect
512-300-300-1x1-2-300-300-6-0x0-1x1-1x1-0-NCHW-FP16-F=ConvBinWinogradRxSf2x3g1:3.54423,0,miopenConvolutionFwdAlgoWinograd;ConvBinWinogradRxSf3x2:2.75266,0,miopenConvolutionFwdAlgoWinograd;GemmFwd1x1_0_1:2.50014,0,miopenConvolutionFwdAlgoGEMM;ConvDirectNaiveConvFwd:72.7145,0,miopenConvolutionFwdAlgoDirect
3-1-14-14-1x14x14-1280-1-1-1-13640-0x0x0-1x14x14-1x1x1-0-NCDHW-BF16-F=GemmFwdRest:853.855,1176,miopenConvolutionFwdAlgoGEMM;ConvDirectNaiveConvFwd:812.227,0,miopenConvolutionFwdAlgoDirect
3-1-14-14-1x14x14-1280-1-1-1-1212-0x0x0-1x14x14-1x1x1-0-NCDHW-BF16-F=GemmFwdRest:72.9733,1176,miopenConvolutionFwdAlgoGEMM;ConvDirectNaiveConvFwd:1851.01,0,miopenConvolutionFwdAlgoDirect
3-1200-1200-3x3-32-600-600-4-1x1-2x2-1x1-0-NCHW-FP16-F=ConvBinWinogradRxSf2x3g1:0.752529,0,miopenConvolutionFwdAlgoWinograd;ConvBinWinogradRxSf3x2:0.676045,0,miopenConvolutionFwdAlgoWinograd;GemmFwdRest:1.43936,19440000,miopenConvolutionFwdAlgoGEMM;ConvDirectNaiveConvFwd:23.9535,0,miopenConvolutionFwdAlgoDirect
32-600-600-3x3-32-600-600-4-1x1-1x1-1x1-0-NCHW-FP16-F=ConvBinWinogradRxSf2x3g1:1.00153,0,miopenConvolutionFwdAlgoWinograd;ConvBinWinogradRxSf3x2:1.1817,0,miopenConvolutionFwdAlgoWinograd;GemmFwdRest:9.17514,207360000,miopenConvolutionFwdAlgoGEMM;ConvDirectNaiveConvFwd:254.607,0,miopenConvolutionFwdAlgoDirect
32-600-600-3x3-512-300-300-4-1x1-2x2-1x1-0-NCHW-FP16-F=ConvBinWinogradRxSf2x3g1:11.6081,0,miopenConvolutionFwdAlgoWinograd;ConvBinWinogradRxSf3x2:5.74507,0,miopenConvolutionFwdAlgoWinograd;GemmFwdRest:5.74349,51840000,miopenConvolutionFwdAlgoGEMM;ConvDirectNaiveConvFwd:909.713,0,miopenConvolutionFwdAlgoDirect
512-300-300-1x1-64-300-300-4-0x0-1x1-1x1-0-NCHW-FP16-F=ConvBinWinogradRxSf2x3g1:4.75065,0,miopenConvolutionFwdAlgoWinograd;ConvBinWinogradRxSf3x2:2.79439,0,miopenConvolutionFwdAlgoWinograd;GemmFwd1x1_0_1:1.98247,0,miopenConvolutionFwdAlgoGEMM;ConvDirectNaiveConvFwd:282.211,0,miopenConvolutionFwdAlgoDirect
64-300-300-3x3-256-300-300-4-1x1-1x1-1x1-0-NCHW-FP16-F=ConvBinWinogradRxSf2x3g1:2.92497,0,miopenConvolutionFwdAlgoWinograd;ConvBinWinogradRxSf3x2:4.17261,0,miopenConvolutionFwdAlgoWinograd;GemmFwdRest:6.06393,103680000,miopenConvolutionFwdAlgoGEMM;ConvDirectNaiveConvFwd:918.294,0,miopenConvolutionFwdAlgoDirect
256-300-300-1x1-64-300-300-4-0x0-1x1-1x1-0-NCHW-FP16-F=ConvBinWinogradRxSf2x3g1:2.4108,0,miopenConvolutionFwdAlgoWinograd;ConvBinWinogradRxSf3x2:1.47491,0,miopenConvolutionFwdAlgoWinograd;GemmFwd1x1_0_1:1.12054,0,miopenConvolutionFwdAlgoGEMM;ConvDirectNaiveConvFwd:131.278,0,miopenConvolutionFwdAlgoDirect
64-300-300-3x3-1024-150-150-4-1x1-2x2-1x1-0-NCHW-FP16-F=ConvBinWinogradRxSf2x3g1:11.0635,0,miopenConvolutionFwdAlgoWinograd;ConvBinWinogradRxSf3x2:4.99478,0,miopenConvolutionFwdAlgoWinograd;GemmFwdRest:4.03551,25920000,miopenConvolutionFwdAlgoGEMM;ConvDirectNaiveConvFwd:912.069,0,miopenConvolutionFwdAlgoDirect
1024-150-150-1x1-128-150-150-4-0x0-1x1-1x1-0-NCHW-FP16-F=ConvBinWinogradRxSf2x3g1:4.67412,0,miopenConvolutionFwdAlgoWinograd;ConvBinWinogradRxSf3x2:2.57376,0,miopenConvolutionFwdAlgoWinograd;GemmFwd1x1_0_1:1.05884,0,miopenConvolutionFwdAlgoGEMM;ConvDirectNaiveConvFwd:257.945,0,miopenConvolutionFwdAlgoDirect
128-150-150-3x3-512-150-150-4-1x1-1x1-1x1-0-NCHW-FP16-F=ConvBinWinogradRxSf2x3g1:2.66556,0,miopenConvolutionFwdAlgoWinograd;ConvBinWinogradRxSf3x2:4.097,0,miopenConvolutionFwdAlgoWinograd;GemmFwdRest:3.95879,51840000,miopenConvolutionFwdAlgoGEMM;ConvDirectNaiveConvFwd:907.829,0,miopenConvolutionFwdAlgoDirect
512-150-150-1x1-128-150-150-4-0x0-1x1-1x1-0-NCHW-FP16-F=ConvBinWinogradRxSf2x3g1:2.51859,0,miopenConvolutionFwdAlgoWinograd;ConvBinWinogradRxSf3x2:1.26657,0,miopenConvolutionFwdAlgoWinograd;GemmFwd1x1_0_1:0.605111,0,miopenConvolutionFwdAlgoGEMM;ConvDirectNaiveConvFwd:125.121,0,miopenConvolutionFwdAlgoDirect
128-150-150-1x1-2048-150-150-4-0x0-1x1-1x1-0-NCHW-FP16-F=ConvBinWinogradRxSf2x3g1:10.009,0,miopenConvolutionFwdAlgoWinograd;ConvBinWinogradRxSf3x2:5.22904,0,miopenConvolutionFwdAlgoWinograd;GemmFwd1x1_0_1:2.5032,0,miopenConvolutionFwdAlgoGEMM;ConvDirectNaiveConvFwd:453.662,0,miopenConvolutionFwdAlgoDirect
2048-150-150-3x3-2048-75-75-4-1x1-2x2-1x1-0-NCHW-FP16-F_g2048=ConvBinWinogradRxSf2x3:17.7552,0,miopenConvolutionFwdAlgoWinograd;ConvBinWinogradRxSf3x2:11.6434,0,miopenConvolutionFwdAlgoWinograd;GemmFwdRest:29.1624,207360000,miopenConvolutionFwdAlgoGEMM;ConvDirectNaiveConvFwd:8.23394,0,miopenConvolutionFwdAlgoDirect
2048-75-75-1x1-256-75-75-4-0x0-1x1-1x1-0-NCHW-FP16-F=ConvBinWinogradRxSf2x3g1:4.89219,0,miopenConvolutionFwdAlgoWinograd;ConvBinWinogradRxSf3x2:3.60968,0,miopenConvolutionFwdAlgoWinograd;GemmFwd1x1_0_1:0.705572,0,miopenConvolutionFwdAlgoGEMM;ConvDirectNaiveConvFwd:246.004,0,miopenConvolutionFwdAlgoDirect
256-75-75-1x1-1024-75-75-4-0x0-1x1-1x1-0-NCHW-FP16-F=ConvBinWinogradRxSf2x3g1:2.5437,0,miopenConvolutionFwdAlgoWinograd;ConvBinWinogradRxSf3x2:1.04061,0,miopenConvolutionFwdAlgoWinograd;GemmFwd1x1_0_1:0.473781,0,miopenConvolutionFwdAlgoGEMM;ConvDirectNaiveConvFwd:111.61,0,miopenConvolutionFwdAlgoDirect
1024-75-75-3x3-1024-75-75-4-1x1-1x1-1x1-0-NCHW-FP16-F_g1024=ConvBinWinogradRxSf2x3:5.71854,0,miopenConvolutionFwdAlgoWinograd;ConvBinWinogradRxSf3x2:5.75829,0,miopenConvolutionFwdAlgoWinograd;GemmFwdRest:13.6614,103680000,miopenConvolutionFwdAlgoGEMM;ConvDirectNaiveConvFwd:3.93616,0,miopenConvolutionFwdAlgoDirect
1024-75-75-1x1-256-75-75-4-0x0-1x1-1x1-0-NCHW-FP16-F=ConvBinWinogradRxSf2x3g1:2.49218,0,miopenConvolutionFwdAlgoWinograd;ConvBinWinogradRxSf3x2:1.23617,0,miopenConvolutionFwdAlgoWinograd;GemmFwd1x1_0_1:0.344751,0,miopenConvolutionFwdAlgoGEMM;ConvDirectNaiveConvFwd:117.737,0,miopenConvolutionFwdAlgoDirect
256-75-75-1x1-6144-75-75-4-0x0-1x1-1x1-0-NCHW-FP16-F=ConvBinWinogradRxSf2x3g1:15.426,0,miopenConvolutionFwdAlgoWinograd;ConvBinWinogradRxSf3x2:7.22729,0,miopenConvolutionFwdAlgoWinograd;GemmFwd1x1_0_1:2.33428,0,miopenConvolutionFwdAlgoGEMM;ConvDirectNaiveConvFwd:672.785,0,miopenConvolutionFwdAlgoDirect
6144-75-75-3x3-6144-38-38-4-1x1-2x2-1x1-0-NCHW-FP16-F_g6144=ConvBinWinogradRxSf2x3:13.7886,0,miopenConvolutionFwdAlgoWinograd;ConvBinWinogradRxSf3x2:10.3452,0,miopenConvolutionFwdAlgoWinograd;GemmFwdRest:24.5357,159694848,miopenConvolutionFwdAlgoGEMM;ConvDirectNaiveConvFwd:6.49171,0,miopenConvolutionFwdAlgoDirect
6144-38-38-1x1-512-38-38-4-0x0-1x1-1x1-0-NCHW-FP16-F=ConvBinWinogradRxSf2x3g1:7.76773,0,miopenConvolutionFwdAlgoWinograd;ConvBinWinogradRxSf3x2:4.45639,0,miopenConvolutionFwdAlgoWinograd;GemmFwd1x1_0_1:1.30324,0,miopenConvolutionFwdAlgoGEMM;ConvDirectNaiveConvFwd:388.714,0,miopenConvolutionFwdAlgoDirect
512-38-38-1x1-1536-38-38-4-0x0-1x1-1x1-0-NCHW-FP16-F=ConvBinWinogradRxSf2x3g1:1.97702,0,miopenConvolutionFwdAlgoWinograd;ConvBinWinogradRxSf3x2:0.825094,0,miopenConvolutionFwdAlgoWinograd;GemmFwd1x1_0_1:0.240863,0,miopenConvolutionFwdAlgoGEMM;ConvDirectNaiveConvFwd:89.0345,0,miopenConvolutionFwdAlgoDirect
1536-38-38-5x5-1536-38-38-4-2x2-1x1-1x1-0-NCHW-FP16-F_g1536=ConvBinWinogradRxSf2x3:3.51921,0,miopenConvolutionFwdAlgoWinograd;ConvBinWinogradRxSf3x2:4.25274,0,miopenConvolutionFwdAlgoWinograd;GemmFwdRest:7.84241,110899200,miopenConvolutionFwdAlgoGEMM;ConvDirectNaiveConvFwd:3.81728,0,miopenConvolutionFwdAlgoDirect
1536-38-38-1x1-1536-38-38-4-0x0-1x1-1x1-0-NCHW-FP16-F_g48=ConvBinWinogradRxSf2x3:0.19998,0,miopenConvolutionFwdAlgoWinograd;ConvBinWinogradRxSf3x2:0.136752,0,miopenConvolutionFwdAlgoWinograd;GemmFwd1x1_0_1:0.225482,0,miopenConvolutionFwdAlgoGEMM;ConvDirectNaiveConvFwd:5.85306,0,miopenConvolutionFwdAlgoDirect
1024-38-38-1x1-512-38-38-4-0x0-1x1-1x1-0-NCHW-FP16-F=ConvBinWinogradRxSf2x3g1:1.36419,0,miopenConvolutionFwdAlgoWinograd;ConvBinWinogradRxSf3x2:0.527335,0,miopenConvolutionFwdAlgoWinograd;GemmFwd1x1_0_1:0.168921,0,miopenConvolutionFwdAlgoGEMM;ConvDirectNaiveConvFwd:60.6916,0,miopenConvolutionFwdAlgoDirect
512-38-38-1x1-3072-38-38-4-0x0-1x1-1x1-0-NCHW-FP16-F=ConvBinWinogradRxSf2x3g1:4.03087,0,miopenConvolutionFwdAlgoWinograd;ConvBinWinogradRxSf3x2:1.77184,0,miopenConvolutionFwdAlgoWinograd;GemmFwd1x1_0_1:0.489383,0,miopenConvolutionFwdAlgoGEMM;ConvDirectNaiveConvFwd:179.314,0,miopenConvolutionFwdAlgoDirect
3072-38-38-3x3-3072-38-38-4-1x1-1x1-1x1-0-NCHW-FP16-F_g3072=ConvBinWinogradRxSf2x3:4.56176,0,miopenConvolutionFwdAlgoWinograd;ConvBinWinogradRxSf3x2:5.23462,0,miopenConvolutionFwdAlgoWinograd;GemmFwdRest:11.2257,79847424,miopenConvolutionFwdAlgoGEMM;ConvDirectNaiveConvFwd:3.08921,0,miopenConvolutionFwdAlgoDirect
3072-38-38-1x1-512-38-38-4-0x0-1x1-1x1-0-NCHW-FP16-F=ConvBinWinogradRxSf2x3g1:3.84182,0,miopenConvolutionFwdAlgoWinograd;ConvBinWinogradRxSf3x2:1.75952,0,miopenConvolutionFwdAlgoWinograd;GemmFwd1x1_0_1:0.596704,0,miopenConvolutionFwdAlgoGEMM;ConvDirectNaiveConvFwd:187.434,0,miopenConvolutionFwdAlgoDirect
512-300-300-1x1-512-300-300-4-0x0-1x1-1x1-0-NCHW-FP16-F=ConvBinWinogradRxSf2x3g1:38.6074,0,miopenConvolutionFwdAlgoWinograd;ConvBinWinogradRxSf3x2:19.8916,0,miopenConvolutionFwdAlgoWinograd;GemmFwd1x1_0_1:6.25123,0,miopenConvolutionFwdAlgoGEMM;ConvDirectNaiveConvFwd:2279.17,0,miopenConvolutionFwdAlgoDirect
512-300-300-1x1-2-300-300-4-0x0-1x1-1x1-0-NCHW-FP16-F=ConvBinWinogradRxSf2x3g1:2.30948,0,miopenConvolutionFwdAlgoWinograd;ConvBinWinogradRxSf3x2:1.77255,0,miopenConvolutionFwdAlgoWinograd;GemmFwd1x1_0_1:1.67415,0,miopenConvolutionFwdAlgoGEMM;ConvDirectNaiveConvFwd:69.3176,0,miopenConvolutionFwdAlgoDirect
3-1-14-14-1x14x14-1280-1-1-1-26828-0x0x0-1x14x14-1x1x1-0-NCDHW-BF16-F=GemmFwdRest:7086.64,1176,miopenConvolutionFwdAlgoGEMM;ConvDirectNaiveConvFwd:941.547,0,miopenConvolutionFwdAlgoDirect
3-1-14-14-1x14x14-1280-1-1-1-9424-0x0x0-1x14x14-1x1x1-0-NCDHW-BF16-F=GemmFwdRest:1211.41,1176,miopenConvolutionFwdAlgoGEMM;ConvDirectNaiveConvFwd:14392.8,0,miopenConvolutionFwdAlgoDirect
3-1-14-14-1x14x14-1280-1-1-1-11780-0x0x0-1x14x14-1x1x1-0-NCDHW-BF16-F=GemmFwdRest:1564.6,1176,miopenConvolutionFwdAlgoGEMM;ConvDirectNaiveConvFwd:19569.5,0,miopenConvolutionFwdAlgoDirect
3-1-14-14-1x14x14-1280-1-1-1-7068-0x0x0-1x14x14-1x1x1-0-NCDHW-BF16-F=GemmFwdRest:992.716,1176,miopenConvolutionFwdAlgoGEMM;ConvDirectNaiveConvFwd:11796.2,0,miopenConvolutionFwdAlgoDirect
3-1-14-14-1x14x14-1280-1-1-1-14136-0x0x0-1x14x14-1x1x1-0-NCDHW-BF16-F=GemmFwdRest:2986.59,1176,miopenConvolutionFwdAlgoGEMM;ConvDirectNaiveConvFwd:1572.22,0,miopenConvolutionFwdAlgoDirect
3-1-14-14-1x14x14-1280-1-1-1-2356-0x0x0-1x14x14-1x1x1-0-NCDHW-BF16-F=GemmFwdRest:291.543,1176,miopenConvolutionFwdAlgoGEMM;ConvDirectNaiveConvFwd:3602.55,0,miopenConvolutionFwdAlgoDirect
3-1200-1200-3x3-32-600-600-10-1x1-2x2-1x1-0-NCHW-FP16-F=ConvBinWinogradRxSf2x3g1:2.90898,0,miopenConvolutionFwdAlgoWinograd;ConvBinWinogradRxSf3x2:2.02892,0,miopenConvolutionFwdAlgoWinograd;GemmFwdRest:17.1163,19440000,miopenConvolutionFwdAlgoGEMM;ConvDirectNaiveConvFwd:89.8846,0,miopenConvolutionFwdAlgoDirect
32-600-600-3x3-32-600-600-10-1x1-1x1-1x1-0-NCHW-FP16-F=ConvBinWinogradRxSf2x3g1:4.08492,0,miopenConvolutionFwdAlgoWinograd;ConvBinWinogradRxSf3x2:6.42696,0,miopenConvolutionFwdAlgoWinograd;GemmFwdRest:59.0405,207360000,miopenConvolutionFwdAlgoGEMM;ConvDirectNaiveConvFwd:789.855,0,miopenConvolutionFwdAlgoDirect
32-600-600-3x3-512-300-300-10-1x1-2x2-1x1-0-NCHW-FP16-F=ConvBinWinogradRxSf2x3g1:48.7814,0,miopenConvolutionFwdAlgoWinograd;ConvBinWinogradRxSf3x2:26.9167,0,miopenConvolutionFwdAlgoWinograd;GemmFwdRest:22.3194,51840000,miopenConvolutionFwdAlgoGEMM;ConvDirectNaiveConvFwd:2673.57,0,miopenConvolutionFwdAlgoDirect
512-300-300-1x1-64-300-300-10-0x0-1x1-1x1-0-NCHW-FP16-F=ConvBinWinogradRxSf2x3g1:18.1459,0,miopenConvolutionFwdAlgoWinograd;ConvBinWinogradRxSf3x2:13.8478,0,miopenConvolutionFwdAlgoWinograd;GemmFwd1x1_0_1:5.54222,0,miopenConvolutionFwdAlgoGEMM;ConvDirectNaiveConvFwd:790.425,0,miopenConvolutionFwdAlgoDirect
64-300-300-3x3-256-300-300-10-1x1-1x1-1x1-0-NCHW-FP16-F=ConvBinWinogradRxSf2x3g1:8.28727,0,miopenConvolutionFwdAlgoWinograd;ConvBinWinogradRxSf3x2:12.5336,0,miopenConvolutionFwdAlgoWinograd;GemmFwdRest:24.3141,103680000,miopenConvolutionFwdAlgoGEMM;ConvDirectNaiveConvFwd:2333.5,0,miopenConvolutionFwdAlgoDirect
256-300-300-1x1-64-300-300-10-0x0-1x1-1x1-0-NCHW-FP16-F=ConvBinWinogradRxSf2x3g1:6.47177,0,miopenConvolutionFwdAlgoWinograd;ConvBinWinogradRxSf3x2:3.71774,0,miopenConvolutionFwdAlgoWinograd;GemmFwd1x1_0_1:3.57447,0,miopenConvolutionFwdAlgoGEMM;ConvDirectNaiveConvFwd:309.369,0,miopenConvolutionFwdAlgoDirect
64-300-300-3x3-1024-150-150-10-1x1-2x2-1x1-0-NCHW-FP16-F=ConvBinWinogradRxSf2x3g1:32.4649,0,miopenConvolutionFwdAlgoWinograd;ConvBinWinogradRxSf3x2:13.2562,0,miopenConvolutionFwdAlgoWinograd;GemmFwdRest:16.6838,25920000,miopenConvolutionFwdAlgoGEMM;ConvDirectNaiveConvFwd:2286.53,0,miopenConvolutionFwdAlgoDirect
1024-150-150-1x1-128-150-150-10-0x0-1x1-1x1-0-NCHW-FP16-F=ConvBinWinogradRxSf2x3g1:14.4325,0,miopenConvolutionFwdAlgoWinograd;ConvBinWinogradRxSf3x2:7.14897,0,miopenConvolutionFwdAlgoWinograd;GemmFwd1x1_0_1:3.36832,0,miopenConvolutionFwdAlgoGEMM;ConvDirectNaiveConvFwd:648.047,0,miopenConvolutionFwdAlgoDirect
128-150-150-3x3-512-150-150-10-1x1-1x1-1x1-0-NCHW-FP16-F=ConvBinWinogradRxSf2x3g1:9.55365,0,miopenConvolutionFwdAlgoWinograd;ConvBinWinogradRxSf3x2:11.0405,0,miopenConvolutionFwdAlgoWinograd;GemmFwdRest:16.8806,51840000,miopenConvolutionFwdAlgoGEMM;ConvDirectNaiveConvFwd:2288.07,0,miopenConvolutionFwdAlgoDirect
512-150-150-1x1-128-150-150-10-0x0-1x1-1x1-0-NCHW-FP16-F=ConvBinWinogradRxSf2x3g1:7.26754,0,miopenConvolutionFwdAlgoWinograd;ConvBinWinogradRxSf3x2:4.83463,0,miopenConvolutionFwdAlgoWinograd;GemmFwd1x1_0_1:1.81599,0,miopenConvolutionFwdAlgoGEMM;ConvDirectNaiveConvFwd:307.464,0,miopenConvolutionFwdAlgoDirect
128-150-150-1x1-2048-150-150-10-0x0-1x1-1x1-0-NCHW-FP16-F=ConvBinWinogradRxSf2x3g1:28.5836,0,miopenConvolutionFwdAlgoWinograd;ConvBinWinogradRxSf3x2:14.6163,0,miopenConvolutionFwdAlgoWinograd;GemmFwd1x1_0_1:9.32318,0,miopenConvolutionFwdAlgoGEMM;ConvDirectNaiveConvFwd:1142.54,0,miopenConvolutionFwdAlgoDirect
2048-150-150-3x3-2048-75-75-10-1x1-2x2-1x1-0-NCHW-FP16-F_g2048=ConvBinWinogradRxSf2x3:57.1425,0,miopenConvolutionFwdAlgoWinograd;ConvBinWinogradRxSf3x2:41.6242,0,miopenConvolutionFwdAlgoWinograd;GemmFwdRest:105.324,207360000,miopenConvolutionFwdAlgoGEMM;ConvDirectNaiveConvFwd:20.7647,0,miopenConvolutionFwdAlgoDirect
2048-75-75-1x1-256-75-75-10-0x0-1x1-1x1-0-NCHW-FP16-F=ConvBinWinogradRxSf2x3g1:13.1728,0,miopenConvolutionFwdAlgoWinograd;ConvBinWinogradRxSf3x2:9.89953,0,miopenConvolutionFwdAlgoWinograd;GemmFwd1x1_0_1:4.03155,0,miopenConvolutionFwdAlgoGEMM;ConvDirectNaiveConvFwd:642.455,0,miopenConvolutionFwdAlgoDirect
256-75-75-1x1-1024-75-75-10-0x0-1x1-1x1-0-NCHW-FP16-F=ConvBinWinogradRxSf2x3g1:7.51738,0,miopenConvolutionFwdAlgoWinograd;ConvBinWinogradRxSf3x2:4.56684,0,miopenConvolutionFwdAlgoWinograd;GemmFwd1x1_0_1:2.75279,0,miopenConvolutionFwdAlgoGEMM;ConvDirectNaiveConvFwd:283.131,0,miopenConvolutionFwdAlgoDirect
1024-75-75-3x3-1024-75-75-10-1x1-1x1-1x1-0-NCHW-FP16-F_g1024=ConvBinWinogradRxSf2x3:28.052,0,miopenConvolutionFwdAlgoWinograd;ConvBinWinogradRxSf3x2:30.3659,0,miopenConvolutionFwdAlgoWinograd;GemmFwdRest:107.105,103680000,miopenConvolutionFwdAlgoGEMM;ConvDirectNaiveConvFwd:11.2985,0,miopenConvolutionFwdAlgoDirect
1024-75-75-1x1-256-75-75-10-0x0-1x1-1x1-0-NCHW-FP16-F=ConvBinWinogradRxSf2x3g1:6.97657,0,miopenConvolutionFwdAlgoWinograd;ConvBinWinogradRxSf3x2:3.63379,0,miopenConvolutionFwdAlgoWinograd;GemmFwd1x1_0_1:1.557,0,miopenConvolutionFwdAlgoGEMM;ConvDirectNaiveConvFwd:305.548,0,miopenConvolutionFwdAlgoDirect
256-75-75-1x1-6144-75-75-10-0x0-1x1-1x1-0-NCHW-FP16-F=ConvBinWinogradRxSf2x3g1:44.3726,0,miopenConvolutionFwdAlgoWinograd;ConvBinWinogradRxSf3x2:20.1901,0,miopenConvolutionFwdAlgoWinograd;GemmFwd1x1_0_1:11.8919,0,miopenConvolutionFwdAlgoGEMM;ConvDirectNaiveConvFwd:1693.51,0,miopenConvolutionFwdAlgoDirect
6144-75-75-3x3-6144-38-38-10-1x1-2x2-1x1-0-NCHW-FP16-F_g6144=ConvBinWinogradRxSf2x3:56.2361,0,miopenConvolutionFwdAlgoWinograd;ConvBinWinogradRxSf3x2:62.8494,0,miopenConvolutionFwdAlgoWinograd;GemmFwdRest:170.419,159694848,miopenConvolutionFwdAlgoGEMM;ConvDirectNaiveConvFwd:16.4026,0,miopenConvolutionFwdAlgoDirect
6144-38-38-1x1-512-38-38-10-0x0-1x1-1x1-0-NCHW-FP16-F=ConvBinWinogradRxSf2x3g1:21.6791,0,miopenConvolutionFwdAlgoWinograd;ConvBinWinogradRxSf3x2:20.4794,0,miopenConvolutionFwdAlgoWinograd;GemmFwd1x1_0_1:7.90191,0,miopenConvolutionFwdAlgoGEMM;ConvDirectNaiveConvFwd:1008.84,0,miopenConvolutionFwdAlgoDirect
512-38-38-1x1-1536-38-38-10-0x0-1x1-1x1-0-NCHW-FP16-F=ConvBinWinogradRxSf2x3g1:5.1843,0,miopenConvolutionFwdAlgoWinograd;ConvBinWinogradRxSf3x2:3.15072,0,miopenConvolutionFwdAlgoWinograd;GemmFwd1x1_0_1:1.75334,0,miopenConvolutionFwdAlgoGEMM;ConvDirectNaiveConvFwd:227.314,0,miopenConvolutionFwdAlgoDirect
1536-38-38-5x5-1536-38-38-10-2x2-1x1-1x1-0-NCHW-FP16-F_g1536=ConvBinWinogradRxSf2x3:11.3338,0,miopenConvolutionFwdAlgoWinograd;ConvBinWinogradRxSf3x2:12.5057,0,miopenConvolutionFwdAlgoWinograd;GemmFwdRest:27.1509,110899200,miopenConvolutionFwdAlgoGEMM;ConvDirectNaiveConvFwd:10.1663,0,miopenConvolutionFwdAlgoDirect
1536-38-38-1x1-1536-38-38-10-0x0-1x1-1x1-0-NCHW-FP16-F_g48=ConvBinWinogradRxSf2x3:0.725556,0,miopenConvolutionFwdAlgoWinograd;ConvBinWinogradRxSf3x2:0.732889,0,miopenConvolutionFwdAlgoWinograd;GemmFwd1x1_0_1:1.02345,0,miopenConvolutionFwdAlgoGEMM;ConvDirectNaiveConvFwd:14.6637,0,miopenConvolutionFwdAlgoDirect
1024-38-38-1x1-512-38-38-10-0x0-1x1-1x1-0-NCHW-FP16-F=ConvBinWinogradRxSf2x3g1:4.00284,0,miopenConvolutionFwdAlgoWinograd;ConvBinWinogradRxSf3x2:1.50083,0,miopenConvolutionFwdAlgoWinograd;GemmFwd1x1_0_1:0.578124,0,miopenConvolutionFwdAlgoGEMM;ConvDirectNaiveConvFwd:155.502,0,miopenConvolutionFwdAlgoDirect
512-38-38-1x1-3072-38-38-10-0x0-1x1-1x1-0-NCHW-FP16-F=ConvBinWinogradRxSf2x3g1:10.3075,0,miopenConvolutionFwdAlgoWinograd;ConvBinWinogradRxSf3x2:5.5261,0,miopenConvolutionFwdAlgoWinograd;GemmFwd1x1_0_1:2.03316,0,miopenConvolutionFwdAlgoGEMM;ConvDirectNaiveConvFwd:453.856,0,miopenConvolutionFwdAlgoDirect
3072-38-38-3x3-3072-38-38-10-1x1-1x1-1x1-0-NCHW-FP16-F_g3072=ConvBinWinogradRxSf2x3:14.2699,0,miopenConvolutionFwdAlgoWinograd;ConvBinWinogradRxSf3x2:15.8498,0,miopenConvolutionFwdAlgoWinograd;GemmFwdRest:40.1568,79847424,miopenConvolutionFwdAlgoGEMM;ConvDirectNaiveConvFwd:7.97199,0,miopenConvolutionFwdAlgoDirect
3072-38-38-1x1-512-38-38-10-0x0-1x1-1x1-0-NCHW-FP16-F=ConvBinWinogradRxSf2x3g1:10.4694,0,miopenConvolutionFwdAlgoWinograd;ConvBinWinogradRxSf3x2:6.65727,0,miopenConvolutionFwdAlgoWinograd;GemmFwd1x1_0_1:2.42797,0,miopenConvolutionFwdAlgoGEMM;ConvDirectNaiveConvFwd:482.063,0,miopenConvolutionFwdAlgoDirect
512-300-300-1x1-512-300-300-10-0x0-1x1-1x1-0-NCHW-FP16-F=ConvBinWinogradRxSf2x3g1:108.084,0,miopenConvolutionFwdAlgoWinograd;ConvBinWinogradRxSf3x2:58.8474,0,miopenConvolutionFwdAlgoWinograd;GemmFwd1x1_0_1:22.6382,0,miopenConvolutionFwdAlgoGEMM;ConvDirectNaiveConvFwd:6025.2,0,miopenConvolutionFwdAlgoDirect
512-300-300-1x1-2-300-300-10-0x0-1x1-1x1-0-NCHW-FP16-F=ConvBinWinogradRxSf2x3g1:6.0978,0,miopenConvolutionFwdAlgoWinograd;ConvBinWinogradRxSf3x2:7.91154,0,miopenConvolutionFwdAlgoWinograd;GemmFwd1x1_0_1:5.32469,0,miopenConvolutionFwdAlgoGEMM;ConvDirectNaiveConvFwd:121.775,0,miopenConvolutionFwdAlgoDirect
3-1200-1200-3x3-32-600-600-7-1x1-2x2-1x1-0-NCHW-FP16-F=ConvBinWinogradRxSf2x3g1:1.49001,0,miopenConvolutionFwdAlgoWinograd;ConvBinWinogradRxSf3x2:2.24735,0,miopenConvolutionFwdAlgoWinograd;GemmFwdRest:4.55081,19440000,miopenConvolutionFwdAlgoGEMM;ConvDirectNaiveConvFwd:52.3878,0,miopenConvolutionFwdAlgoDirect
32-600-600-3x3-32-600-600-7-1x1-1x1-1x1-0-NCHW-FP16-F=ConvBinWinogradRxSf2x3g1:3.56366,0,miopenConvolutionFwdAlgoWinograd;ConvBinWinogradRxSf3x2:2.49694,0,miopenConvolutionFwdAlgoWinograd;GemmFwdRest:24.2395,207360000,miopenConvolutionFwdAlgoGEMM;ConvDirectNaiveConvFwd:564.778,0,miopenConvolutionFwdAlgoDirect
32-600-600-3x3-512-300-300-7-1x1-2x2-1x1-0-NCHW-FP16-F=ConvBinWinogradRxSf2x3g1:22.2239,0,miopenConvolutionFwdAlgoWinograd;ConvBinWinogradRxSf3x2:10.5916,0,miopenConvolutionFwdAlgoWinograd;GemmFwdRest:16.343,51840000,miopenConvolutionFwdAlgoGEMM;ConvDirectNaiveConvFwd:1610.89,0,miopenConvolutionFwdAlgoDirect
512-300-300-1x1-64-300-300-7-0x0-1x1-1x1-0-NCHW-FP16-F=ConvBinWinogradRxSf2x3g1:10.4593,0,miopenConvolutionFwdAlgoWinograd;ConvBinWinogradRxSf3x2:4.98827,0,miopenConvolutionFwdAlgoWinograd;GemmFwd1x1_0_1:4.43358,0,miopenConvolutionFwdAlgoGEMM;ConvDirectNaiveConvFwd:473.882,0,miopenConvolutionFwdAlgoDirect
64-300-300-3x3-256-300-300-7-1x1-1x1-1x1-0-NCHW-FP16-F=ConvBinWinogradRxSf2x3g1:6.55925,0,miopenConvolutionFwdAlgoWinograd;ConvBinWinogradRxSf3x2:7.80678,0,miopenConvolutionFwdAlgoWinograd;GemmFwdRest:17.3089,103680000,miopenConvolutionFwdAlgoGEMM;ConvDirectNaiveConvFwd:1645.67,0,miopenConvolutionFwdAlgoDirect
256-300-300-1x1-64-300-300-7-0x0-1x1-1x1-0-NCHW-FP16-F=ConvBinWinogradRxSf2x3g1:6.49999,0,miopenConvolutionFwdAlgoWinograd;ConvBinWinogradRxSf3x2:4.25973,0,miopenConvolutionFwdAlgoWinograd;GemmFwd1x1_0_1:2.38297,0,miopenConvolutionFwdAlgoGEMM;ConvDirectNaiveConvFwd:233.807,0,miopenConvolutionFwdAlgoDirect
64-300-300-3x3-1024-150-150-7-1x1-2x2-1x1-0-NCHW-FP16-F=ConvBinWinogradRxSf2x3g1:21.9183,0,miopenConvolutionFwdAlgoWinograd;ConvBinWinogradRxSf3x2:11.9833,0,miopenConvolutionFwdAlgoWinograd;GemmFwdRest:11.5945,25920000,miopenConvolutionFwdAlgoGEMM;ConvDirectNaiveConvFwd:1602.89,0,miopenConvolutionFwdAlgoDirect
1024-150-150-1x1-128-150-150-7-0x0-1x1-1x1-0-NCHW-FP16-F=ConvBinWinogradRxSf2x3g1:8.63475,0,miopenConvolutionFwdAlgoWinograd;ConvBinWinogradRxSf3x2:5.41749,0,miopenConvolutionFwdAlgoWinograd;GemmFwd1x1_0_1:2.34593,0,miopenConvolutionFwdAlgoGEMM;ConvDirectNaiveConvFwd:462.396,0,miopenConvolutionFwdAlgoDirect
128-150-150-3x3-512-150-150-7-1x1-1x1-1x1-0-NCHW-FP16-F=ConvBinWinogradRxSf2x3g1:5.31663,0,miopenConvolutionFwdAlgoWinograd;ConvBinWinogradRxSf3x2:7.83842,0,miopenConvolutionFwdAlgoWinograd;GemmFwdRest:12.474,51840000,miopenConvolutionFwdAlgoGEMM;ConvDirectNaiveConvFwd:1609.68,0,miopenConvolutionFwdAlgoDirect
512-150-150-1x1-128-150-150-7-0x0-1x1-1x1-0-NCHW-FP16-F=ConvBinWinogradRxSf2x3g1:4.59163,0,miopenConvolutionFwdAlgoWinograd;ConvBinWinogradRxSf3x2:3.61936,0,miopenConvolutionFwdAlgoWinograd;GemmFwd1x1_0_1:1.3013,0,miopenConvolutionFwdAlgoGEMM;ConvDirectNaiveConvFwd:221.776,0,miopenConvolutionFwdAlgoDirect
128-150-150-1x1-2048-150-150-7-0x0-1x1-1x1-0-NCHW-FP16-F=ConvBinWinogradRxSf2x3g1:19.3077,0,miopenConvolutionFwdAlgoWinograd;ConvBinWinogradRxSf3x2:10.5429,0,miopenConvolutionFwdAlgoWinograd;GemmFwd1x1_0_1:6.52289,0,miopenConvolutionFwdAlgoGEMM;ConvDirectNaiveConvFwd:798.766,0,miopenConvolutionFwdAlgoDirect
2048-150-150-3x3-2048-75-75-7-1x1-2x2-1x1-0-NCHW-FP16-F_g2048=ConvBinWinogradRxSf2x3:41.5339,0,miopenConvolutionFwdAlgoWinograd;ConvBinWinogradRxSf3x2:30.8995,0,miopenConvolutionFwdAlgoWinograd;GemmFwdRest:75.3021,207360000,miopenConvolutionFwdAlgoGEMM;ConvDirectNaiveConvFwd:14.5836,0,miopenConvolutionFwdAlgoDirect
2048-75-75-1x1-256-75-75-7-0x0-1x1-1x1-0-NCHW-FP16-F=ConvBinWinogradRxSf2x3g1:9.19149,0,miopenConvolutionFwdAlgoWinograd;ConvBinWinogradRxSf3x2:8.64934,0,miopenConvolutionFwdAlgoWinograd;GemmFwd1x1_0_1:2.61627,0,miopenConvolutionFwdAlgoGEMM;ConvDirectNaiveConvFwd:452.611,0,miopenConvolutionFwdAlgoDirect
256-75-75-1x1-1024-75-75-7-0x0-1x1-1x1-0-NCHW-FP16-F=ConvBinWinogradRxSf2x3g1:6.12041,0,miopenConvolutionFwdAlgoWinograd;ConvBinWinogradRxSf3x2:3.08645,0,miopenConvolutionFwdAlgoWinograd;GemmFwd1x1_0_1:1.99264,0,miopenConvolutionFwdAlgoGEMM;ConvDirectNaiveConvFwd:198.968,0,miopenConvolutionFwdAlgoDirect
1024-75-75-3x3-1024-75-75-7-1x1-1x1-1x1-0-NCHW-FP16-F_g1024=ConvBinWinogradRxSf2x3:15.1323,0,miopenConvolutionFwdAlgoWinograd;ConvBinWinogradRxSf3x2:14.7948,0,miopenConvolutionFwdAlgoWinograd;GemmFwdRest:77.8708,103680000,miopenConvolutionFwdAlgoGEMM;ConvDirectNaiveConvFwd:8.04364,0,miopenConvolutionFwdAlgoDirect
1024-75-75-1x1-256-75-75-7-0x0-1x1-1x1-0-NCHW-FP16-F=ConvBinWinogradRxSf2x3g1:4.95781,0,miopenConvolutionFwdAlgoWinograd;ConvBinWinogradRxSf3x2:2.62086,0,miopenConvolutionFwdAlgoWinograd;GemmFwd1x1_0_1:1.56833,0,miopenConvolutionFwdAlgoGEMM;ConvDirectNaiveConvFwd:217.546,0,miopenConvolutionFwdAlgoDirect
256-75-75-1x1-6144-75-75-7-0x0-1x1-1x1-0-NCHW-FP16-F=ConvBinWinogradRxSf2x3g1:30.5912,0,miopenConvolutionFwdAlgoWinograd;ConvBinWinogradRxSf3x2:14.7102,0,miopenConvolutionFwdAlgoWinograd;GemmFwd1x1_0_1:8.50138,0,miopenConvolutionFwdAlgoGEMM;ConvDirectNaiveConvFwd:1184.17,0,miopenConvolutionFwdAlgoDirect
6144-75-75-3x3-6144-38-38-7-1x1-2x2-1x1-0-NCHW-FP16-F_g6144=ConvBinWinogradRxSf2x3:44.5946,0,miopenConvolutionFwdAlgoWinograd;ConvBinWinogradRxSf3x2:35.6542,0,miopenConvolutionFwdAlgoWinograd;GemmFwdRest:131.831,159694848,miopenConvolutionFwdAlgoGEMM;ConvDirectNaiveConvFwd:12.0974,0,miopenConvolutionFwdAlgoDirect
6144-38-38-1x1-512-38-38-7-0x0-1x1-1x1-0-NCHW-FP16-F=ConvBinWinogradRxSf2x3g1:15.2275,0,miopenConvolutionFwdAlgoWinograd;ConvBinWinogradRxSf3x2:13.0095,0,miopenConvolutionFwdAlgoWinograd;GemmFwd1x1_0_1:5.43189,0,miopenConvolutionFwdAlgoGEMM;ConvDirectNaiveConvFwd:697.456,0,miopenConvolutionFwdAlgoDirect
512-38-38-1x1-1536-38-38-7-0x0-1x1-1x1-0-NCHW-FP16-F=ConvBinWinogradRxSf2x3g1:3.88897,0,miopenConvolutionFwdAlgoWinograd;ConvBinWinogradRxSf3x2:3.29843,0,miopenConvolutionFwdAlgoWinograd;GemmFwd1x1_0_1:1.01944,0,miopenConvolutionFwdAlgoGEMM;ConvDirectNaiveConvFwd:159.971,0,miopenConvolutionFwdAlgoDirect
1536-38-38-5x5-1536-38-38-7-2x2-1x1-1x1-0-NCHW-FP16-F_g1536=ConvBinWinogradRxSf2x3:11.3571,0,miopenConvolutionFwdAlgoWinograd;ConvBinWinogradRxSf3x2:12.6037,0,miopenConvolutionFwdAlgoWinograd;GemmFwdRest:45.7827,110899200,miopenConvolutionFwdAlgoGEMM;ConvDirectNaiveConvFwd:8.01178,0,miopenConvolutionFwdAlgoDirect
1536-38-38-1x1-1536-38-38-7-0x0-1x1-1x1-0-NCHW-FP16-F_g48=ConvBinWinogradRxSf2x3:1.38458,0,miopenConvolutionFwdAlgoWinograd;ConvBinWinogradRxSf3x2:1.36444,0,miopenConvolutionFwdAlgoWinograd;GemmFwd1x1_0_1:1.60109,0,miopenConvolutionFwdAlgoGEMM;ConvDirectNaiveConvFwd:11.5937,0,miopenConvolutionFwdAlgoDirect
1024-38-38-1x1-512-38-38-7-0x0-1x1-1x1-0-NCHW-FP16-F=ConvBinWinogradRxSf2x3g1:3.03244,0,miopenConvolutionFwdAlgoWinograd;ConvBinWinogradRxSf3x2:2.26422,0,miopenConvolutionFwdAlgoWinograd;GemmFwd1x1_0_1:0.578411,0,miopenConvolutionFwdAlgoGEMM;ConvDirectNaiveConvFwd:110.042,0,miopenConvolutionFwdAlgoDirect
512-38-38-1x1-3072-38-38-7-0x0-1x1-1x1-0-NCHW-FP16-F=ConvBinWinogradRxSf2x3g1:7.90812,0,miopenConvolutionFwdAlgoWinograd;ConvBinWinogradRxSf3x2:4.1978,0,miopenConvolutionFwdAlgoWinograd;GemmFwd1x1_0_1:1.62431,0,miopenConvolutionFwdAlgoGEMM;ConvDirectNaiveConvFwd:319.788,0,miopenConvolutionFwdAlgoDirect
3072-38-38-3x3-3072-38-38-7-1x1-1x1-1x1-0-NCHW-FP16-F_g3072=ConvBinWinogradRxSf2x3:25.8041,0,miopenConvolutionFwdAlgoWinograd;ConvBinWinogradRxSf3x2:25.7612,0,miopenConvolutionFwdAlgoWinograd;GemmFwdRest:66.1347,79847424,miopenConvolutionFwdAlgoGEMM;ConvDirectNaiveConvFwd:6.71739,0,miopenConvolutionFwdAlgoDirect
3072-38-38-1x1-512-38-38-7-0x0-1x1-1x1-0-NCHW-FP16-F=ConvBinWinogradRxSf2x3g1:9.863,0,miopenConvolutionFwdAlgoWinograd;ConvBinWinogradRxSf3x2:8.45761,0,miopenConvolutionFwdAlgoWinograd;GemmFwd1x1_0_1:1.52165,0,miopenConvolutionFwdAlgoGEMM;ConvDirectNaiveConvFwd:382.973,0,miopenConvolutionFwdAlgoDirect
512-300-300-1x1-512-300-300-7-0x0-1x1-1x1-0-NCHW-FP16-F=ConvBinWinogradRxSf2x3g1:75.4126,0,miopenConvolutionFwdAlgoWinograd;ConvBinWinogradRxSf3x2:38.557,0,miopenConvolutionFwdAlgoWinograd;GemmFwd1x1_0_1:13.4266,0,miopenConvolutionFwdAlgoGEMM;ConvDirectNaiveConvFwd:4181.92,0,miopenConvolutionFwdAlgoDirect
512-300-300-1x1-2-300-300-7-0x0-1x1-1x1-0-NCHW-FP16-F=ConvBinWinogradRxSf2x3g1:4.5233,0,miopenConvolutionFwdAlgoWinograd;ConvBinWinogradRxSf3x2:4.01608,0,miopenConvolutionFwdAlgoWinograd;GemmFwd1x1_0_1:3.35405,0,miopenConvolutionFwdAlgoGEMM;ConvDirectNaiveConvFwd:104.17,0,miopenConvolutionFwdAlgoDirect
3-1-14-14-1x14x14-1280-1-1-1-33604-0x0x0-1x14x14-1x1x1-0-NCDHW-BF16-F=GemmFwdRest:2099.4,1176,miopenConvolutionFwdAlgoGEMM;ConvDirectNaiveConvFwd:11282.3,0,miopenConvolutionFwdAlgoDirect
3-1-14-14-1x14x14-1280-1-1-1-23040-0x0x0-1x14x14-1x1x1-0-NCDHW-BF16-F=GemmFwdRest:1442.63,1176,miopenConvolutionFwdAlgoGEMM;ConvDirectNaiveConvFwd:15180.2,0,miopenConvolutionFwdAlgoDirect
3-1-14-14-1x14x14-1280-1-1-1-5008-0x0x0-1x14x14-1x1x1-0-NCDHW-BF16-F=GemmFwdRest:310.965,1176,miopenConvolutionFwdAlgoGEMM;ConvDirectNaiveConvFwd:7647.26,0,miopenConvolutionFwdAlgoDirect
3-1-14-14-1x14x14-1280-1-1-1-3452-0x0x0-1x14x14-1x1x1-0-NCDHW-BF16-F=GemmFwdRest:214.591,1176,miopenConvolutionFwdAlgoGEMM;ConvDirectNaiveConvFwd:5273.58,0,miopenConvolutionFwdAlgoDirect
3-1-14-14-1x14x14-1280-1-1-1-2552-0x0x0-1x14x14-1x1x1-0-NCDHW-BF16-F=GemmFwdRest:158.531,1176,miopenConvolutionFwdAlgoGEMM;ConvDirectNaiveConvFwd:3896.04,0,miopenConvolutionFwdAlgoDirect
3-1-14-14-1x14x14-1280-1-1-1-2496-0x0x0-1x14x14-1x1x1-0-NCDHW-BF16-F=GemmFwdRest:152.515,1176,miopenConvolutionFwdAlgoGEMM;ConvDirectNaiveConvFwd:3810.75,0,miopenConvolutionFwdAlgoDirect
3-1-14-14-1x14x14-1280-1-1-1-2480-0x0x0-1x14x14-1x1x1-0-NCDHW-BF16-F=GemmFwdRest:151.039,1176,miopenConvolutionFwdAlgoGEMM;ConvDirectNaiveConvFwd:3787.18,0,miopenConvolutionFwdAlgoDirect
3-1-14-14-1x14x14-1280-1-1-1-2520-0x0x0-1x14x14-1x1x1-0-NCDHW-BF16-F=GemmFwdRest:152.113,1176,miopenConvolutionFwdAlgoGEMM;ConvDirectNaiveConvFwd:3849.13,0,miopenConvolutionFwdAlgoDirect
3-1-14-14-1x14x14-1280-1-1-1-2560-0x0x0-1x14x14-1x1x1-0-NCDHW-BF16-F=GemmFwdRest:158.768,1176,miopenConvolutionFwdAlgoGEMM;ConvDirectNaiveConvFwd:3908.18,0,miopenConvolutionFwdAlgoDirect
3-1-14-14-1x14x14-1280-1-1-1-2816-0x0x0-1x14x14-1x1x1-0-NCDHW-BF16-F=GemmFwdRest:174.684,1176,miopenConvolutionFwdAlgoGEMM;ConvDirectNaiveConvFwd:4303.23,0,miopenConvolutionFwdAlgoDirect
3-1-14-14-1x14x14-1280-1-1-1-3008-0x0x0-1x14x14-1x1x1-0-NCDHW-BF16-F=GemmFwdRest:186.418,1176,miopenConvolutionFwdAlgoGEMM;ConvDirectNaiveConvFwd:4591.52,0,miopenConvolutionFwdAlgoDirect
3-1-14-14-1x14x14-1280-1-1-1-3160-0x0x0-1x14x14-1x1x1-0-NCDHW-BF16-F=GemmFwdRest:195.665,1176,miopenConvolutionFwdAlgoGEMM;ConvDirectNaiveConvFwd:4824.49,0,miopenConvolutionFwdAlgoDirect
3-1-14-14-1x14x14-1280-1-1-1-2100-0x0x0-1x14x14-1x1x1-0-NCDHW-BF16-F=GemmFwdRest:127.645,1176,miopenConvolutionFwdAlgoGEMM;ConvDirectNaiveConvFwd:3206.23,0,miopenConvolutionFwdAlgoDirect
3-1-14-14-1x14x14-1280-1-1-1-2064-0x0x0-1x14x14-1x1x1-0-NCDHW-BF16-F=GemmFwdRest:126.97,1176,miopenConvolutionFwdAlgoGEMM;ConvDirectNaiveConvFwd:3150.99,0,miopenConvolutionFwdAlgoDirect
3-1-14-14-1x14x14-1280-1-1-1-2160-0x0x0-1x14x14-1x1x1-0-NCDHW-BF16-F=GemmFwdRest:133.227,1176,miopenConvolutionFwdAlgoGEMM;ConvDirectNaiveConvFwd:3298.67,0,miopenConvolutionFwdAlgoDirect
3-1-14-14-1x14x14-1280-1-1-1-2060-0x0x0-1x14x14-1x1x1-0-NCDHW-BF16-F=GemmFwdRest:127.758,1176,miopenConvolutionFwdAlgoGEMM;ConvDirectNaiveConvFwd:3150.19,0,miopenConvolutionFwdAlgoDirect
3-1-14-14-1x14x14-1280-1-1-1-1776-0x0x0-1x14x14-1x1x1-0-NCDHW-BF16-F=GemmFwdRest:107.171,1176,miopenConvolutionFwdAlgoGEMM;ConvDirectNaiveConvFwd:2712.04,0,miopenConvolutionFwdAlgoDirect
3-1-14-14-1x14x14-1280-1-1-1-480-0x0x0-1x14x14-1x1x1-0-NCDHW-BF16-F=GemmFwdRest:28.8033,1176,miopenConvolutionFwdAlgoGEMM;ConvDirectNaiveConvFwd:733.081,0,miopenConvolutionFwdAlgoDirect
3-1-14-14-1x14x14-1280-1-1-1-3740-0x0x0-1x14x14-1x1x1-0-NCDHW-BF16-F=GemmFwdRest:230.967,1176,miopenConvolutionFwdAlgoGEMM;ConvDirectNaiveConvFwd:5714.16,0,miopenConvolutionFwdAlgoDirect
3-1-14-14-1x14x14-1280-1-1-1-33880-0x0x0-1x14x14-1x1x1-0-NCDHW-BF16-F=GemmFwdRest:2116.7,1176,miopenConvolutionFwdAlgoGEMM;ConvDirectNaiveConvFwd:11702.5,0,miopenConvolutionFwdAlgoDirect
3-1-14-14-1x14x14-1280-1-1-1-11264-0x0x0-1x14x14-1x1x1-0-NCDHW-BF16-F=GemmFwdRest:704.934,1176,miopenConvolutionFwdAlgoGEMM;ConvDirectNaiveConvFwd:17200.4,0,miopenConvolutionFwdAlgoDirect
3-1-14-14-1x14x14-1280-1-1-1-8448-0x0x0-1x14x14-1x1x1-0-NCDHW-BF16-F=GemmFwdRest:526.683,1176,miopenConvolutionFwdAlgoGEMM;ConvDirectNaiveConvFwd:12897.4,0,miopenConvolutionFwdAlgoDirect
3-1-14-14-1x14x14-1280-1-1-1-14080-0x0x0-1x14x14-1x1x1-0-NCDHW-BF16-F=GemmFwdRest:876.363,1176,miopenConvolutionFwdAlgoGEMM;ConvDirectNaiveConvFwd:1487.41,0,miopenConvolutionFwdAlgoDirect
3-1-14-14-1x14x14-1280-1-1-1-5632-0x0x0-1x14x14-1x1x1-0-NCDHW-BF16-F=GemmFwdRest:350.356,1176,miopenConvolutionFwdAlgoGEMM;ConvDirectNaiveConvFwd:8588,0,miopenConvolutionFwdAlgoDirect
3-1200-1200-3x3-32-600-600-8-1x1-2x2-1x1-0-NCHW-FP16-F=ConvBinWinogradRxSf2x3g1:1.52564,0,miopenConvolutionFwdAlgoWinograd;ConvBinWinogradRxSf3x2:1.32219,0,miopenConvolutionFwdAlgoWinograd;GemmFwdRest:2.85945,19440000,miopenConvolutionFwdAlgoGEMM;ConvDirectNaiveConvFwd:44.9938,0,miopenConvolutionFwdAlgoDirect
32-600-600-3x3-32-600-600-8-1x1-1x1-1x1-0-NCHW-FP16-F=ConvBinWinogradRxSf2x3g1:2.01313,0,miopenConvolutionFwdAlgoWinograd;ConvBinWinogradRxSf3x2:2.52148,0,miopenConvolutionFwdAlgoWinograd;GemmFwdRest:18.2846,207360000,miopenConvolutionFwdAlgoGEMM;ConvDirectNaiveConvFwd:491.431,0,miopenConvolutionFwdAlgoDirect
32-600-600-3x3-512-300-300-8-1x1-2x2-1x1-0-NCHW-FP16-F=ConvBinWinogradRxSf2x3g1:24.0654,0,miopenConvolutionFwdAlgoWinograd;ConvBinWinogradRxSf3x2:12.0015,0,miopenConvolutionFwdAlgoWinograd;GemmFwdRest:11.8949,51840000,miopenConvolutionFwdAlgoGEMM;ConvDirectNaiveConvFwd:1818.58,0,miopenConvolutionFwdAlgoDirect
512-300-300-1x1-64-300-300-8-0x0-1x1-1x1-0-NCHW-FP16-F=ConvBinWinogradRxSf2x3g1:10.0411,0,miopenConvolutionFwdAlgoWinograd;ConvBinWinogradRxSf3x2:5.71612,0,miopenConvolutionFwdAlgoWinograd;GemmFwd1x1_0_1:3.90071,0,miopenConvolutionFwdAlgoGEMM;ConvDirectNaiveConvFwd:576.472,0,miopenConvolutionFwdAlgoDirect
64-300-300-3x3-256-300-300-8-1x1-1x1-1x1-0-NCHW-FP16-F=ConvBinWinogradRxSf2x3g1:6.08775,0,miopenConvolutionFwdAlgoWinograd;ConvBinWinogradRxSf3x2:8.83453,0,miopenConvolutionFwdAlgoWinograd;GemmFwdRest:12.18,103680000,miopenConvolutionFwdAlgoGEMM;ConvDirectNaiveConvFwd:1830.73,0,miopenConvolutionFwdAlgoDirect
256-300-300-1x1-64-300-300-8-0x0-1x1-1x1-0-NCHW-FP16-F=ConvBinWinogradRxSf2x3g1:5.12638,0,miopenConvolutionFwdAlgoWinograd;ConvBinWinogradRxSf3x2:2.95125,0,miopenConvolutionFwdAlgoWinograd;GemmFwd1x1_0_1:2.19987,0,miopenConvolutionFwdAlgoGEMM;ConvDirectNaiveConvFwd:253.842,0,miopenConvolutionFwdAlgoDirect
64-300-300-3x3-1024-150-150-8-1x1-2x2-1x1-0-NCHW-FP16-F=ConvBinWinogradRxSf2x3g1:22.995,0,miopenConvolutionFwdAlgoWinograd;ConvBinWinogradRxSf3x2:10.3705,0,miopenConvolutionFwdAlgoWinograd;GemmFwdRest:8.11114,25920000,miopenConvolutionFwdAlgoGEMM;ConvDirectNaiveConvFwd:1823.91,0,miopenConvolutionFwdAlgoDirect
1024-150-150-1x1-128-150-150-8-0x0-1x1-1x1-0-NCHW-FP16-F=ConvBinWinogradRxSf2x3g1:9.74411,0,miopenConvolutionFwdAlgoWinograd;ConvBinWinogradRxSf3x2:5.536,0,miopenConvolutionFwdAlgoWinograd;GemmFwd1x1_0_1:2.09316,0,miopenConvolutionFwdAlgoGEMM;ConvDirectNaiveConvFwd:504.442,0,miopenConvolutionFwdAlgoDirect
128-150-150-3x3-512-150-150-8-1x1-1x1-1x1-0-NCHW-FP16-F=ConvBinWinogradRxSf2x3g1:5.63896,0,miopenConvolutionFwdAlgoWinograd;ConvBinWinogradRxSf3x2:8.57211,0,miopenConvolutionFwdAlgoWinograd;GemmFwdRest:8.27671,51840000,miopenConvolutionFwdAlgoGEMM;ConvDirectNaiveConvFwd:1817.89,0,miopenConvolutionFwdAlgoDirect
512-150-150-1x1-128-150-150-8-0x0-1x1-1x1-0-NCHW-FP16-F=ConvBinWinogradRxSf2x3g1:5.07673,0,miopenConvolutionFwdAlgoWinograd;ConvBinWinogradRxSf3x2:2.59148,0,miopenConvolutionFwdAlgoWinograd;GemmFwd1x1_0_1:1.19768,0,miopenConvolutionFwdAlgoGEMM;ConvDirectNaiveConvFwd:239.322,0,miopenConvolutionFwdAlgoDirect
128-150-150-1x1-2048-150-150-8-0x0-1x1-1x1-0-NCHW-FP16-F=ConvBinWinogradRxSf2x3g1:20.9995,0,miopenConvolutionFwdAlgoWinograd;ConvBinWinogradRxSf3x2:10.6891,0,miopenConvolutionFwdAlgoWinograd;GemmFwd1x1_0_1:5.03348,0,miopenConvolutionFwdAlgoGEMM;ConvDirectNaiveConvFwd:910.664,0,miopenConvolutionFwdAlgoDirect
2048-150-150-3x3-2048-75-75-8-1x1-2x2-1x1-0-NCHW-FP16-F_g2048=ConvBinWinogradRxSf2x3:34.8896,0,miopenConvolutionFwdAlgoWinograd;ConvBinWinogradRxSf3x2:22.8521,0,miopenConvolutionFwdAlgoWinograd;GemmFwdRest:58.6043,207360000,miopenConvolutionFwdAlgoGEMM;ConvDirectNaiveConvFwd:16.4166,0,miopenConvolutionFwdAlgoDirect
2048-75-75-1x1-256-75-75-8-0x0-1x1-1x1-0-NCHW-FP16-F=ConvBinWinogradRxSf2x3g1:9.98946,0,miopenConvolutionFwdAlgoWinograd;ConvBinWinogradRxSf3x2:7.5491,0,miopenConvolutionFwdAlgoWinograd;GemmFwd1x1_0_1:1.57157,0,miopenConvolutionFwdAlgoGEMM;ConvDirectNaiveConvFwd:492.525,0,miopenConvolutionFwdAlgoDirect
256-75-75-1x1-1024-75-75-8-0x0-1x1-1x1-0-NCHW-FP16-F=ConvBinWinogradRxSf2x3g1:5.15368,0,miopenConvolutionFwdAlgoWinograd;ConvBinWinogradRxSf3x2:2.38369,0,miopenConvolutionFwdAlgoWinograd;GemmFwd1x1_0_1:0.958846,0,miopenConvolutionFwdAlgoGEMM;ConvDirectNaiveConvFwd:223.917,0,miopenConvolutionFwdAlgoDirect
1024-75-75-3x3-1024-75-75-8-1x1-1x1-1x1-0-NCHW-FP16-F_g1024=ConvBinWinogradRxSf2x3:11.2594,0,miopenConvolutionFwdAlgoWinograd;ConvBinWinogradRxSf3x2:11.2865,0,miopenConvolutionFwdAlgoWinograd;GemmFwdRest:27.3835,103680000,miopenConvolutionFwdAlgoGEMM;ConvDirectNaiveConvFwd:7.85175,0,miopenConvolutionFwdAlgoDirect
1024-75-75-1x1-256-75-75-8-0x0-1x1-1x1-0-NCHW-FP16-F=ConvBinWinogradRxSf2x3g1:5.17036,0,miopenConvolutionFwdAlgoWinograd;ConvBinWinogradRxSf3x2:2.43195,0,miopenConvolutionFwdAlgoWinograd;GemmFwd1x1_0_1:0.694311,0,miopenConvolutionFwdAlgoGEMM;ConvDirectNaiveConvFwd:235.894,0,miopenConvolutionFwdAlgoDirect
256-75-75-1x1-6144-75-75-8-0x0-1x1-1x1-0-NCHW-FP16-F=ConvBinWinogradRxSf2x3g1:31.4944,0,miopenConvolutionFwdAlgoWinograd;ConvBinWinogradRxSf3x2:14.6119,0,miopenConvolutionFwdAlgoWinograd;GemmFwd1x1_0_1:4.61623,0,miopenConvolutionFwdAlgoGEMM;ConvDirectNaiveConvFwd:1347.83,0,miopenConvolutionFwdAlgoDirect
6144-75-75-3x3-6144-38-38-8-1x1-2x2-1x1-0-NCHW-FP16-F_g6144=ConvBinWinogradRxSf2x3:26.5101,0,miopenConvolutionFwdAlgoWinograd;ConvBinWinogradRxSf3x2:19.1907,0,miopenConvolutionFwdAlgoWinograd;GemmFwdRest:48.3705,159694848,miopenConvolutionFwdAlgoGEMM;ConvDirectNaiveConvFwd:12.9911,0,miopenConvolutionFwdAlgoDirect
6144-38-38-1x1-512-38-38-8-0x0-1x1-1x1-0-NCHW-FP16-F=ConvBinWinogradRxSf2x3g1:15.3931,0,miopenConvolutionFwdAlgoWinograd;ConvBinWinogradRxSf3x2:14.3785,0,miopenConvolutionFwdAlgoWinograd;GemmFwd1x1_0_1:2.67853,0,miopenConvolutionFwdAlgoGEMM;ConvDirectNaiveConvFwd:790.698,0,miopenConvolutionFwdAlgoDirect
512-38-38-1x1-1536-38-38-8-0x0-1x1-1x1-0-NCHW-FP16-F=ConvBinWinogradRxSf2x3g1:4.08746,0,miopenConvolutionFwdAlgoWinograd;ConvBinWinogradRxSf3x2:1.7327,0,miopenConvolutionFwdAlgoWinograd;GemmFwd1x1_0_1:0.527022,0,miopenConvolutionFwdAlgoGEMM;ConvDirectNaiveConvFwd:180.068,0,miopenConvolutionFwdAlgoDirect
1536-38-38-5x5-1536-38-38-8-2x2-1x1-1x1-0-NCHW-FP16-F_g1536=ConvBinWinogradRxSf2x3:6.57307,0,miopenConvolutionFwdAlgoWinograd;ConvBinWinogradRxSf3x2:7.77369,0,miopenConvolutionFwdAlgoWinograd;GemmFwdRest:15.229,110899200,miopenConvolutionFwdAlgoGEMM;ConvDirectNaiveConvFwd:7.68315,0,miopenConvolutionFwdAlgoDirect
1536-38-38-1x1-1536-38-38-8-0x0-1x1-1x1-0-NCHW-FP16-F_g48=ConvBinWinogradRxSf2x3:0.405332,0,miopenConvolutionFwdAlgoWinograd;ConvBinWinogradRxSf3x2:0.371549,0,miopenConvolutionFwdAlgoWinograd;GemmFwd1x1_0_1:0.512512,0,miopenConvolutionFwdAlgoGEMM;ConvDirectNaiveConvFwd:11.6828,0,miopenConvolutionFwdAlgoDirect
1024-38-38-1x1-512-38-38-8-0x0-1x1-1x1-0-NCHW-FP16-F=ConvBinWinogradRxSf2x3g1:2.65623,0,miopenConvolutionFwdAlgoWinograd;ConvBinWinogradRxSf3x2:1.11324,0,miopenConvolutionFwdAlgoWinograd;GemmFwd1x1_0_1:0.351176,0,miopenConvolutionFwdAlgoGEMM;ConvDirectNaiveConvFwd:122.292,0,miopenConvolutionFwdAlgoDirect
512-38-38-1x1-3072-38-38-8-0x0-1x1-1x1-0-NCHW-FP16-F=ConvBinWinogradRxSf2x3g1:8.10247,0,miopenConvolutionFwdAlgoWinograd;ConvBinWinogradRxSf3x2:3.60381,0,miopenConvolutionFwdAlgoWinograd;GemmFwd1x1_0_1:1.04359,0,miopenConvolutionFwdAlgoGEMM;ConvDirectNaiveConvFwd:361.362,0,miopenConvolutionFwdAlgoDirect
3072-38-38-3x3-3072-38-38-8-1x1-1x1-1x1-0-NCHW-FP16-F_g3072=ConvBinWinogradRxSf2x3:8.58768,0,miopenConvolutionFwdAlgoWinograd;ConvBinWinogradRxSf3x2:9.50761,0,miopenConvolutionFwdAlgoWinograd;GemmFwdRest:22.3032,79847424,miopenConvolutionFwdAlgoGEMM;ConvDirectNaiveConvFwd:6.21121,0,miopenConvolutionFwdAlgoDirect
3072-38-38-1x1-512-38-38-8-0x0-1x1-1x1-0-NCHW-FP16-F=ConvBinWinogradRxSf2x3g1:7.62187,0,miopenConvolutionFwdAlgoWinograd;ConvBinWinogradRxSf3x2:6.15956,0,miopenConvolutionFwdAlgoWinograd;GemmFwd1x1_0_1:1.31452,0,miopenConvolutionFwdAlgoGEMM;ConvDirectNaiveConvFwd:378.53,0,miopenConvolutionFwdAlgoDirect
512-300-300-1x1-512-300-300-8-0x0-1x1-1x1-0-NCHW-FP16-F=ConvBinWinogradRxSf2x3g1:78.9795,0,miopenConvolutionFwdAlgoWinograd;ConvBinWinogradRxSf3x2:36.4348,0,miopenConvolutionFwdAlgoWinograd;GemmFwd1x1_0_1:12.6223,0,miopenConvolutionFwdAlgoGEMM;ConvDirectNaiveConvFwd:4720.25,0,miopenConvolutionFwdAlgoDirect
512-300-300-1x1-2-300-300-8-0x0-1x1-1x1-0-NCHW-FP16-F=ConvBinWinogradRxSf2x3g1:4.7295,0,miopenConvolutionFwdAlgoWinograd;ConvBinWinogradRxSf3x2:3.84756,0,miopenConvolutionFwdAlgoWinograd;GemmFwd1x1_0_1:3.30735,0,miopenConvolutionFwdAlgoGEMM;ConvDirectNaiveConvFwd:77.402,0,miopenConvolutionFwdAlgoDirect
3-1-14-14-1x14x14-1280-1-1-1-27576-0x0x0-1x14x14-1x1x1-0-NCDHW-BF16-F=GemmFwdRest:1726.56,1176,miopenConvolutionFwdAlgoGEMM;ConvDirectNaiveConvFwd:2079.23,0,miopenConvolutionFwdAlgoDirect
3-1-14-14-1x14x14-1280-1-1-1-2840-0x0x0-1x14x14-1x1x1-0-NCDHW-BF16-F=GemmFwdRest:173.654,1176,miopenConvolutionFwdAlgoGEMM;ConvDirectNaiveConvFwd:4338.7,0,miopenConvolutionFwdAlgoDirect
3-1-14-14-1x14x14-1280-1-1-1-2872-0x0x0-1x14x14-1x1x1-0-NCDHW-BF16-F=GemmFwdRest:175.272,1176,miopenConvolutionFwdAlgoGEMM;ConvDirectNaiveConvFwd:4379.87,0,miopenConvolutionFwdAlgoDirect
3-1-14-14-1x14x14-1280-1-1-1-1612-0x0x0-1x14x14-1x1x1-0-NCDHW-BF16-F=GemmFwdRest:96.8087,1176,miopenConvolutionFwdAlgoGEMM;ConvDirectNaiveConvFwd:2461.28,0,miopenConvolutionFwdAlgoDirect
3-1-14-14-1x14x14-1280-1-1-1-1560-0x0x0-1x14x14-1x1x1-0-NCDHW-BF16-F=GemmFwdRest:94.8217,1176,miopenConvolutionFwdAlgoGEMM;ConvDirectNaiveConvFwd:2380.78,0,miopenConvolutionFwdAlgoDirect
3-1-14-14-1x14x14-1280-1-1-1-1580-0x0x0-1x14x14-1x1x1-0-NCDHW-BF16-F=GemmFwdRest:94.6989,1176,miopenConvolutionFwdAlgoGEMM;ConvDirectNaiveConvFwd:2411.93,0,miopenConvolutionFwdAlgoDirect
3-1-14-14-1x14x14-1280-1-1-1-1996-0x0x0-1x14x14-1x1x1-0-NCDHW-BF16-F=GemmFwdRest:119.594,1176,miopenConvolutionFwdAlgoGEMM;ConvDirectNaiveConvFwd:3048.97,0,miopenConvolutionFwdAlgoDirect
3-1-14-14-1x14x14-1280-1-1-1-1964-0x0x0-1x14x14-1x1x1-0-NCDHW-BF16-F=GemmFwdRest:122.316,1176,miopenConvolutionFwdAlgoGEMM;ConvDirectNaiveConvFwd:2997.73,0,miopenConvolutionFwdAlgoDirect
3-1-14-14-1x14x14-1280-1-1-1-216-0x0x0-1x14x14-1x1x1-0-NCDHW-BF16-F=GemmFwdRest:12.9542,1176,miopenConvolutionFwdAlgoGEMM;ConvDirectNaiveConvFwd:329.796,0,miopenConvolutionFwdAlgoDirect
3-1-14-14-1x14x14-1280-1-1-1-276-0x0x0-1x14x14-1x1x1-0-NCDHW-BF16-F=GemmFwdRest:16.5605,1176,miopenConvolutionFwdAlgoGEMM;ConvDirectNaiveConvFwd:422.302,0,miopenConvolutionFwdAlgoDirect
3-768-768-4x4-128-192-192-6-0x0-4x4-1x1-0-NCHW-FP16-F=GemmFwdRest:0.598592,3538944,miopenConvolutionFwdAlgoGEMM;ConvDirectNaiveConvFwd:23.4274,0,miopenConvolutionFwdAlgoDirect
3-1-14-14-1x14x14-1280-1-1-1-25992-0x0x0-1x14x14-1x1x1-0-NCDHW-BF16-F=GemmFwdRest:1625.86,1176,miopenConvolutionFwdAlgoGEMM;ConvDirectNaiveConvFwd:19677.5,0,miopenConvolutionFwdAlgoDirect
3-1-14-14-1x14x14-1280-1-1-1-6840-0x0x0-1x14x14-1x1x1-0-NCDHW-BF16-F=GemmFwdRest:426.603,1176,miopenConvolutionFwdAlgoGEMM;ConvDirectNaiveConvFwd:10441.3,0,miopenConvolutionFwdAlgoDirect
3-1-14-14-1x14x14-1280-1-1-1-9120-0x0x0-1x14x14-1x1x1-0-NCDHW-BF16-F=GemmFwdRest:570.087,1176,miopenConvolutionFwdAlgoGEMM;ConvDirectNaiveConvFwd:13928.4,0,miopenConvolutionFwdAlgoDirect
3-1-14-14-1x14x14-1280-1-1-1-11400-0x0x0-1x14x14-1x1x1-0-NCDHW-BF16-F=GemmFwdRest:712.522,1176,miopenConvolutionFwdAlgoGEMM;ConvDirectNaiveConvFwd:17409.6,0,miopenConvolutionFwdAlgoDirect
3-1-14-14-1x14x14-1280-1-1-1-13680-0x0x0-1x14x14-1x1x1-0-NCDHW-BF16-F=GemmFwdRest:856.56,1176,miopenConvolutionFwdAlgoGEMM;ConvDirectNaiveConvFwd:874.624,0,miopenConvolutionFwdAlgoDirect
3-1-14-14-1x14x14-1280-1-1-1-4560-0x0x0-1x14x14-1x1x1-0-NCDHW-BF16-F=GemmFwdRest:277.457,1176,miopenConvolutionFwdAlgoGEMM;ConvDirectNaiveConvFwd:6964.33,0,miopenConvolutionFwdAlgoDirect
3-1200-1200-3x3-32-600-600-3-1x1-2x2-1x1-0-NCHW-FP16-F=ConvBinWinogradRxSf2x3g1:0.561929,0,miopenConvolutionFwdAlgoWinograd;ConvBinWinogradRxSf3x2:0.509871,0,miopenConvolutionFwdAlgoWinograd;GemmFwdRest:1.08574,19440000,miopenConvolutionFwdAlgoGEMM;ConvDirectNaiveConvFwd:17.8599,0,miopenConvolutionFwdAlgoDirect
32-600-600-3x3-32-600-600-3-1x1-1x1-1x1-0-NCHW-FP16-F=ConvBinWinogradRxSf2x3g1:0.764386,0,miopenConvolutionFwdAlgoWinograd;ConvBinWinogradRxSf3x2:0.906251,0,miopenConvolutionFwdAlgoWinograd;GemmFwdRest:6.86629,207360000,miopenConvolutionFwdAlgoGEMM;ConvDirectNaiveConvFwd:191.297,0,miopenConvolutionFwdAlgoDirect
32-600-600-3x3-512-300-300-3-1x1-2x2-1x1-0-NCHW-FP16-F=ConvBinWinogradRxSf2x3g1:9.02672,0,miopenConvolutionFwdAlgoWinograd;ConvBinWinogradRxSf3x2:4.52471,0,miopenConvolutionFwdAlgoWinograd;GemmFwdRest:4.36653,51840000,miopenConvolutionFwdAlgoGEMM;ConvDirectNaiveConvFwd:678.609,0,miopenConvolutionFwdAlgoDirect
512-300-300-1x1-64-300-300-3-0x0-1x1-1x1-0-NCHW-FP16-F=ConvBinWinogradRxSf2x3g1:3.72031,0,miopenConvolutionFwdAlgoWinograd;ConvBinWinogradRxSf3x2:2.09882,0,miopenConvolutionFwdAlgoWinograd;GemmFwd1x1_0_1:1.49245,0,miopenConvolutionFwdAlgoGEMM;ConvDirectNaiveConvFwd:225.512,0,miopenConvolutionFwdAlgoDirect
64-300-300-3x3-256-300-300-3-1x1-1x1-1x1-0-NCHW-FP16-F=ConvBinWinogradRxSf2x3g1:2.30425,0,miopenConvolutionFwdAlgoWinograd;ConvBinWinogradRxSf3x2:3.339,0,miopenConvolutionFwdAlgoWinograd;GemmFwdRest:4.5636,103680000,miopenConvolutionFwdAlgoGEMM;ConvDirectNaiveConvFwd:693.832,0,miopenConvolutionFwdAlgoDirect
256-300-300-1x1-64-300-300-3-0x0-1x1-1x1-0-NCHW-FP16-F=ConvBinWinogradRxSf2x3g1:1.91931,0,miopenConvolutionFwdAlgoWinograd;ConvBinWinogradRxSf3x2:1.11648,0,miopenConvolutionFwdAlgoWinograd;GemmFwd1x1_0_1:0.846915,0,miopenConvolutionFwdAlgoGEMM;ConvDirectNaiveConvFwd:106.742,0,miopenConvolutionFwdAlgoDirect
64-300-300-3x3-1024-150-150-3-1x1-2x2-1x1-0-NCHW-FP16-F=ConvBinWinogradRxSf2x3g1:8.65719,0,miopenConvolutionFwdAlgoWinograd;ConvBinWinogradRxSf3x2:3.93314,0,miopenConvolutionFwdAlgoWinograd;GemmFwdRest:3.02166,25920000,miopenConvolutionFwdAlgoGEMM;ConvDirectNaiveConvFwd:684.012,0,miopenConvolutionFwdAlgoDirect
1024-150-150-1x1-128-150-150-3-0x0-1x1-1x1-0-NCHW-FP16-F=ConvBinWinogradRxSf2x3g1:3.68332,0,miopenConvolutionFwdAlgoWinograd;ConvBinWinogradRxSf3x2:2.12254,0,miopenConvolutionFwdAlgoWinograd;GemmFwd1x1_0_1:0.793636,0,miopenConvolutionFwdAlgoGEMM;ConvDirectNaiveConvFwd:196.091,0,miopenConvolutionFwdAlgoDirect
128-150-150-3x3-512-150-150-3-1x1-1x1-1x1-0-NCHW-FP16-F=ConvBinWinogradRxSf2x3g1:2.11476,0,miopenConvolutionFwdAlgoWinograd;ConvBinWinogradRxSf3x2:3.29629,0,miopenConvolutionFwdAlgoWinograd;GemmFwdRest:3.01536,51840000,miopenConvolutionFwdAlgoGEMM;ConvDirectNaiveConvFwd:671.944,0,miopenConvolutionFwdAlgoDirect
512-150-150-1x1-128-150-150-3-0x0-1x1-1x1-0-NCHW-FP16-F=ConvBinWinogradRxSf2x3g1:1.89673,0,miopenConvolutionFwdAlgoWinograd;ConvBinWinogradRxSf3x2:0.957142,0,miopenConvolutionFwdAlgoWinograd;GemmFwd1x1_0_1:0.452594,0,miopenConvolutionFwdAlgoGEMM;ConvDirectNaiveConvFwd:97.555,0,miopenConvolutionFwdAlgoDirect
128-150-150-1x1-2048-150-150-3-0x0-1x1-1x1-0-NCHW-FP16-F=ConvBinWinogradRxSf2x3g1:7.92587,0,miopenConvolutionFwdAlgoWinograd;ConvBinWinogradRxSf3x2:4.09066,0,miopenConvolutionFwdAlgoWinograd;GemmFwd1x1_0_1:1.86657,0,miopenConvolutionFwdAlgoGEMM;ConvDirectNaiveConvFwd:339.877,0,miopenConvolutionFwdAlgoDirect
2048-150-150-3x3-2048-75-75-3-1x1-2x2-1x1-0-NCHW-FP16-F_g2048=ConvBinWinogradRxSf2x3:13.3732,0,miopenConvolutionFwdAlgoWinograd;ConvBinWinogradRxSf3x2:8.77913,0,miopenConvolutionFwdAlgoWinograd;GemmFwdRest:21.9868,207360000,miopenConvolutionFwdAlgoGEMM;ConvDirectNaiveConvFwd:6.18703,0,miopenConvolutionFwdAlgoDirect
2048-75-75-1x1-256-75-75-3-0x0-1x1-1x1-0-NCHW-FP16-F=ConvBinWinogradRxSf2x3g1:3.93675,0,miopenConvolutionFwdAlgoWinograd;ConvBinWinogradRxSf3x2:2.5123,0,miopenConvolutionFwdAlgoWinograd;GemmFwd1x1_0_1:0.491866,0,miopenConvolutionFwdAlgoGEMM;ConvDirectNaiveConvFwd:177.305,0,miopenConvolutionFwdAlgoDirect
256-75-75-1x1-1024-75-75-3-0x0-1x1-1x1-0-NCHW-FP16-F=ConvBinWinogradRxSf2x3g1:1.97922,0,miopenConvolutionFwdAlgoWinograd;ConvBinWinogradRxSf3x2:0.811994,0,miopenConvolutionFwdAlgoWinograd;GemmFwd1x1_0_1:0.320138,0,miopenConvolutionFwdAlgoGEMM;ConvDirectNaiveConvFwd:83.4324,0,miopenConvolutionFwdAlgoDirect
1024-75-75-3x3-1024-75-75-3-1x1-1x1-1x1-0-NCHW-FP16-F_g1024=ConvBinWinogradRxSf2x3:4.44735,0,miopenConvolutionFwdAlgoWinograd;ConvBinWinogradRxSf3x2:4.47398,0,miopenConvolutionFwdAlgoWinograd;GemmFwdRest:10.2607,103680000,miopenConvolutionFwdAlgoGEMM;ConvDirectNaiveConvFwd:2.94611,0,miopenConvolutionFwdAlgoDirect
1024-75-75-1x1-256-75-75-3-0x0-1x1-1x1-0-NCHW-FP16-F=ConvBinWinogradRxSf2x3g1:1.97014,0,miopenConvolutionFwdAlgoWinograd;ConvBinWinogradRxSf3x2:0.751667,0,miopenConvolutionFwdAlgoWinograd;GemmFwd1x1_0_1:0.246931,0,miopenConvolutionFwdAlgoGEMM;ConvDirectNaiveConvFwd:87.4501,0,miopenConvolutionFwdAlgoDirect
256-75-75-1x1-6144-75-75-3-0x0-1x1-1x1-0-NCHW-FP16-F=ConvBinWinogradRxSf2x3g1:11.9158,0,miopenConvolutionFwdAlgoWinograd;ConvBinWinogradRxSf3x2:5.55749,0,miopenConvolutionFwdAlgoWinograd;GemmFwd1x1_0_1:1.76656,0,miopenConvolutionFwdAlgoGEMM;ConvDirectNaiveConvFwd:504.899,0,miopenConvolutionFwdAlgoDirect
6144-75-75-3x3-6144-38-38-3-1x1-2x2-1x1-0-NCHW-FP16-F_g6144=ConvBinWinogradRxSf2x3:10.5886,0,miopenConvolutionFwdAlgoWinograd;ConvBinWinogradRxSf3x2:7.82521,0,miopenConvolutionFwdAlgoWinograd;GemmFwdRest:18.506,159694848,miopenConvolutionFwdAlgoGEMM;ConvDirectNaiveConvFwd:4.86961,0,miopenConvolutionFwdAlgoDirect
6144-38-38-1x1-512-38-38-3-0x0-1x1-1x1-0-NCHW-FP16-F=ConvBinWinogradRxSf2x3g1:6.54831,0,miopenConvolutionFwdAlgoWinograd;ConvBinWinogradRxSf3x2:3.45591,0,miopenConvolutionFwdAlgoWinograd;GemmFwd1x1_0_1:0.999087,0,miopenConvolutionFwdAlgoGEMM;ConvDirectNaiveConvFwd:289.459,0,miopenConvolutionFwdAlgoDirect
512-38-38-1x1-1536-38-38-3-0x0-1x1-1x1-0-NCHW-FP16-F=ConvBinWinogradRxSf2x3g1:1.45411,0,miopenConvolutionFwdAlgoWinograd;ConvBinWinogradRxSf3x2:0.582762,0,miopenConvolutionFwdAlgoWinograd;GemmFwd1x1_0_1:0.191175,0,miopenConvolutionFwdAlgoGEMM;ConvDirectNaiveConvFwd:66.9088,0,miopenConvolutionFwdAlgoDirect
1536-38-38-5x5-1536-38-38-3-2x2-1x1-1x1-0-NCHW-FP16-F_g1536=ConvBinWinogradRxSf2x3:2.61878,0,miopenConvolutionFwdAlgoWinograd;ConvBinWinogradRxSf3x2:3.15197,0,miopenConvolutionFwdAlgoWinograd;GemmFwdRest:5.85495,110899200,miopenConvolutionFwdAlgoGEMM;ConvDirectNaiveConvFwd:2.94995,0,miopenConvolutionFwdAlgoDirect
1536-38-38-1x1-1536-38-38-3-0x0-1x1-1x1-0-NCHW-FP16-F_g48=ConvBinWinogradRxSf2x3:0.15119,0,miopenConvolutionFwdAlgoWinograd;ConvBinWinogradRxSf3x2:0.101777,0,miopenConvolutionFwdAlgoWinograd;GemmFwd1x1_0_1:0.159727,0,miopenConvolutionFwdAlgoGEMM;ConvDirectNaiveConvFwd:4.27314,0,miopenConvolutionFwdAlgoDirect
1024-38-38-1x1-512-38-38-3-0x0-1x1-1x1-0-NCHW-FP16-F=ConvBinWinogradRxSf2x3g1:0.970982,0,miopenConvolutionFwdAlgoWinograd;ConvBinWinogradRxSf3x2:0.379158,0,miopenConvolutionFwdAlgoWinograd;GemmFwd1x1_0_1:0.129029,0,miopenConvolutionFwdAlgoGEMM;ConvDirectNaiveConvFwd:44.6285,0,miopenConvolutionFwdAlgoDirect
512-38-38-1x1-3072-38-38-3-0x0-1x1-1x1-0-NCHW-FP16-F=ConvBinWinogradRxSf2x3g1:2.93235,0,miopenConvolutionFwdAlgoWinograd;ConvBinWinogradRxSf3x2:1.24427,0,miopenConvolutionFwdAlgoWinograd;GemmFwd1x1_0_1:0.342131,0,miopenConvolutionFwdAlgoGEMM;ConvDirectNaiveConvFwd:133.641,0,miopenConvolutionFwdAlgoDirect
3072-38-38-3x3-3072-38-38-3-1x1-1x1-1x1-0-NCHW-FP16-F_g3072=ConvBinWinogradRxSf2x3:3.42422,0,miopenConvolutionFwdAlgoWinograd;ConvBinWinogradRxSf3x2:3.83983,0,miopenConvolutionFwdAlgoWinograd;GemmFwdRest:8.42317,79847424,miopenConvolutionFwdAlgoGEMM;ConvDirectNaiveConvFwd:2.40741,0,miopenConvolutionFwdAlgoDirect
3072-38-38-1x1-512-38-38-3-0x0-1x1-1x1-0-NCHW-FP16-F=ConvBinWinogradRxSf2x3g1:3.13069,0,miopenConvolutionFwdAlgoWinograd;ConvBinWinogradRxSf3x2:1.32433,0,miopenConvolutionFwdAlgoWinograd;GemmFwd1x1_0_1:0.456928,0,miopenConvolutionFwdAlgoGEMM;ConvDirectNaiveConvFwd:139.475,0,miopenConvolutionFwdAlgoDirect
512-300-300-1x1-512-300-300-3-0x0-1x1-1x1-0-NCHW-FP16-F=ConvBinWinogradRxSf2x3g1:30.1837,0,miopenConvolutionFwdAlgoWinograd;ConvBinWinogradRxSf3x2:13.7015,0,miopenConvolutionFwdAlgoWinograd;GemmFwd1x1_0_1:4.67293,0,miopenConvolutionFwdAlgoGEMM;ConvDirectNaiveConvFwd:1652.42,0,miopenConvolutionFwdAlgoDirect
512-300-300-1x1-2-300-300-3-0x0-1x1-1x1-0-NCHW-FP16-F=ConvBinWinogradRxSf2x3g1:1.7616,0,miopenConvolutionFwdAlgoWinograd;ConvBinWinogradRxSf3x2:1.33747,0,miopenConvolutionFwdAlgoWinograd;GemmFwd1x1_0_1:1.25579,0,miopenConvolutionFwdAlgoGEMM;ConvDirectNaiveConvFwd:68.2384,0,miopenConvolutionFwdAlgoDirect
3-1-14-14-1x14x14-1280-1-1-1-8528-0x0x0-1x14x14-1x1x1-0-NCDHW-BF16-F=GemmFwdRest:527.632,1176,miopenConvolutionFwdAlgoGEMM;ConvDirectNaiveConvFwd:13016,0,miopenConvolutionFwdAlgoDirect
3-1-14-14-1x14x14-1280-1-1-1-560-0x0x0-1x14x14-1x1x1-0-NCDHW-BF16-F=GemmFwdRest:33.5132,1176,miopenConvolutionFwdAlgoGEMM;ConvDirectNaiveConvFwd:855.85,0,miopenConvolutionFwdAlgoDirect
3-1-14-14-1x14x14-1280-1-1-1-25916-0x0x0-1x14x14-1x1x1-0-NCDHW-BF16-F=GemmFwdRest:1621.44,1176,miopenConvolutionFwdAlgoGEMM;ConvDirectNaiveConvFwd:19567.9,0,miopenConvolutionFwdAlgoDirect
3-1200-1200-3x3-32-600-600-1-1x1-2x2-1x1-0-NCHW-FP16-F=ConvBinWinogradRxSf2x3g1:0.177274,0,miopenConvolutionFwdAlgoWinograd;ConvBinWinogradRxSf3x2:0.11595,0,miopenConvolutionFwdAlgoWinograd;GemmFwdRest:0.34803,19440000,miopenConvolutionFwdAlgoGEMM;ConvDirectNaiveConvFwd:8.32926,0,miopenConvolutionFwdAlgoDirect
32-600-600-3x3-32-600-600-1-1x1-1x1-1x1-0-NCHW-FP16-F=ConvBinWinogradRxSf2x3g1:0.256562,0,miopenConvolutionFwdAlgoWinograd;ConvBinWinogradRxSf3x2:0.306711,0,miopenConvolutionFwdAlgoWinograd;GemmFwdRest:2.29092,207360000,miopenConvolutionFwdAlgoGEMM;ConvDirectNaiveConvFwd:88.1622,0,miopenConvolutionFwdAlgoDirect
32-600-600-3x3-512-300-300-1-1x1-2x2-1x1-0-NCHW-FP16-F=ConvBinWinogradRxSf2x3g1:3.04693,0,miopenConvolutionFwdAlgoWinograd;ConvBinWinogradRxSf3x2:1.49694,0,miopenConvolutionFwdAlgoWinograd;GemmFwdRest:1.50016,51840000,miopenConvolutionFwdAlgoGEMM;ConvDirectNaiveConvFwd:234.366,0,miopenConvolutionFwdAlgoDirect
512-300-300-1x1-64-300-300-1-0x0-1x1-1x1-0-NCHW-FP16-F=ConvBinWinogradRxSf2x3g1:1.26463,0,miopenConvolutionFwdAlgoWinograd;ConvBinWinogradRxSf3x2:0.703384,0,miopenConvolutionFwdAlgoWinograd;GemmFwd1x1_0_1:0.520188,0,miopenConvolutionFwdAlgoGEMM;ConvDirectNaiveConvFwd:84.0056,0,miopenConvolutionFwdAlgoDirect
64-300-300-3x3-256-300-300-1-1x1-1x1-1x1-0-NCHW-FP16-F=ConvBinWinogradRxSf2x3g1:0.810223,0,miopenConvolutionFwdAlgoWinograd;ConvBinWinogradRxSf3x2:1.09319,0,miopenConvolutionFwdAlgoWinograd;GemmFwdRest:1.51417,103680000,miopenConvolutionFwdAlgoGEMM;ConvDirectNaiveConvFwd:232.682,0,miopenConvolutionFwdAlgoDirect
256-300-300-1x1-64-300-300-1-0x0-1x1-1x1-0-NCHW-FP16-F=ConvBinWinogradRxSf2x3g1:0.616113,0,miopenConvolutionFwdAlgoWinograd;ConvBinWinogradRxSf3x2:0.377576,0,miopenConvolutionFwdAlgoWinograd;GemmFwd1x1_0_1:0.297171,0,miopenConvolutionFwdAlgoGEMM;ConvDirectNaiveConvFwd:41.3492,0,miopenConvolutionFwdAlgoDirect
64-300-300-3x3-1024-150-150-1-1x1-2x2-1x1-0-NCHW-FP16-F=ConvBinWinogradRxSf2x3g1:2.94019,0,miopenConvolutionFwdAlgoWinograd;ConvBinWinogradRxSf3x2:1.27025,0,miopenConvolutionFwdAlgoWinograd;GemmFwdRest:0.960919,25920000,miopenConvolutionFwdAlgoGEMM;ConvDirectNaiveConvFwd:228.397,0,miopenConvolutionFwdAlgoDirect
1024-150-150-1x1-128-150-150-1-0x0-1x1-1x1-0-NCHW-FP16-F=ConvBinWinogradRxSf2x3g1:1.26931,0,miopenConvolutionFwdAlgoWinograd;ConvBinWinogradRxSf3x2:0.632855,0,miopenConvolutionFwdAlgoWinograd;GemmFwd1x1_0_1:0.258146,0,miopenConvolutionFwdAlgoGEMM;ConvDirectNaiveConvFwd:65.687,0,miopenConvolutionFwdAlgoDirect
128-150-150-3x3-512-150-150-1-1x1-1x1-1x1-0-NCHW-FP16-F=ConvBinWinogradRxSf2x3g1:0.718426,0,miopenConvolutionFwdAlgoWinograd;ConvBinWinogradRxSf3x2:1.11552,0,miopenConvolutionFwdAlgoWinograd;GemmFwdRest:0.966034,51840000,miopenConvolutionFwdAlgoGEMM;ConvDirectNaiveConvFwd:227.819,0,miopenConvolutionFwdAlgoDirect
512-150-150-1x1-128-150-150-1-0x0-1x1-1x1-0-NCHW-FP16-F=ConvBinWinogradRxSf2x3g1:0.620348,0,miopenConvolutionFwdAlgoWinograd;ConvBinWinogradRxSf3x2:0.233838,0,miopenConvolutionFwdAlgoWinograd;GemmFwd1x1_0_1:0.0908846,0,miopenConvolutionFwdAlgoGEMM;ConvDirectNaiveConvFwd:32.4947,0,miopenConvolutionFwdAlgoDirect
128-150-150-1x1-2048-150-150-1-0x0-1x1-1x1-0-NCHW-FP16-F=ConvBinWinogradRxSf2x3g1:2.80701,0,miopenConvolutionFwdAlgoWinograd;ConvBinWinogradRxSf3x2:1.30436,0,miopenConvolutionFwdAlgoWinograd;GemmFwd1x1_0_1:0.619966,0,miopenConvolutionFwdAlgoGEMM;ConvDirectNaiveConvFwd:113.732,0,miopenConvolutionFwdAlgoDirect
2048-150-150-3x3-2048-75-75-1-1x1-2x2-1x1-0-NCHW-FP16-F_g2048=ConvBinWinogradRxSf2x3:4.75362,0,miopenConvolutionFwdAlgoWinograd;ConvBinWinogradRxSf3x2:3.25239,0,miopenConvolutionFwdAlgoWinograd;GemmFwdRest:7.41266,207360000,miopenConvolutionFwdAlgoGEMM;ConvDirectNaiveConvFwd:2.06788,0,miopenConvolutionFwdAlgoDirect
2048-75-75-1x1-256-75-75-1-0x0-1x1-1x1-0-NCHW-FP16-F=ConvBinWinogradRxSf2x3g1:1.42058,0,miopenConvolutionFwdAlgoWinograd;ConvBinWinogradRxSf3x2:0.468883,0,miopenConvolutionFwdAlgoWinograd;GemmFwd1x1_0_1:0.141876,0,miopenConvolutionFwdAlgoGEMM;ConvDirectNaiveConvFwd:61.6146,0,miopenConvolutionFwdAlgoDirect
256-75-75-1x1-1024-75-75-1-0x0-1x1-1x1-0-NCHW-FP16-F=ConvBinWinogradRxSf2x3g1:0.624247,0,miopenConvolutionFwdAlgoWinograd;ConvBinWinogradRxSf3x2:0.244057,0,miopenConvolutionFwdAlgoWinograd;GemmFwd1x1_0_1:0.0922975,0,miopenConvolutionFwdAlgoGEMM;ConvDirectNaiveConvFwd:27.7478,0,miopenConvolutionFwdAlgoDirect
1024-75-75-3x3-1024-75-75-1-1x1-1x1-1x1-0-NCHW-FP16-F_g1024=ConvBinWinogradRxSf2x3:1.53229,0,miopenConvolutionFwdAlgoWinograd;ConvBinWinogradRxSf3x2:1.56604,0,miopenConvolutionFwdAlgoWinograd;GemmFwdRest:3.42035,103680000,miopenConvolutionFwdAlgoGEMM;ConvDirectNaiveConvFwd:0.984283,0,miopenConvolutionFwdAlgoDirect
1024-75-75-1x1-256-75-75-1-0x0-1x1-1x1-0-NCHW-FP16-F=ConvBinWinogradRxSf2x3g1:0.654851,0,miopenConvolutionFwdAlgoWinograd;ConvBinWinogradRxSf3x2:0.219513,0,miopenConvolutionFwdAlgoWinograd;GemmFwd1x1_0_1:0.0765035,0,miopenConvolutionFwdAlgoGEMM;ConvDirectNaiveConvFwd:28.3743,0,miopenConvolutionFwdAlgoDirect
256-75-75-1x1-6144-75-75-1-0x0-1x1-1x1-0-NCHW-FP16-F=ConvBinWinogradRxSf2x3g1:4.18497,0,miopenConvolutionFwdAlgoWinograd;ConvBinWinogradRxSf3x2:1.70765,0,miopenConvolutionFwdAlgoWinograd;GemmFwd1x1_0_1:0.561922,0,miopenConvolutionFwdAlgoGEMM;ConvDirectNaiveConvFwd:166.473,0,miopenConvolutionFwdAlgoDirect
6144-75-75-3x3-6144-38-38-1-1x1-2x2-1x1-0-NCHW-FP16-F_g6144=ConvBinWinogradRxSf2x3:4.24818,0,miopenConvolutionFwdAlgoWinograd;ConvBinWinogradRxSf3x2:3.47903,0,miopenConvolutionFwdAlgoWinograd;GemmFwdRest:6.19905,159694848,miopenConvolutionFwdAlgoGEMM;ConvDirectNaiveConvFwd:1.62558,0,miopenConvolutionFwdAlgoDirect
6144-38-38-1x1-512-38-38-1-0x0-1x1-1x1-0-NCHW-FP16-F=ConvBinWinogradRxSf2x3g1:2.08551,0,miopenConvolutionFwdAlgoWinograd;ConvBinWinogradRxSf3x2:1.06143,0,miopenConvolutionFwdAlgoWinograd;GemmFwd1x1_0_1:0.277174,0,miopenConvolutionFwdAlgoGEMM;ConvDirectNaiveConvFwd:101.08,0,miopenConvolutionFwdAlgoDirect
512-38-38-1x1-1536-38-38-1-0x0-1x1-1x1-0-NCHW-FP16-F=ConvBinWinogradRxSf2x3g1:0.475511,0,miopenConvolutionFwdAlgoWinograd;ConvBinWinogradRxSf3x2:0.222007,0,miopenConvolutionFwdAlgoWinograd;GemmFwd1x1_0_1:0.0752947,0,miopenConvolutionFwdAlgoGEMM;ConvDirectNaiveConvFwd:22.2406,0,miopenConvolutionFwdAlgoDirect
1536-38-38-5x5-1536-38-38-1-2x2-1x1-1x1-0-NCHW-FP16-F_g1536=ConvBinWinogradRxSf2x3:0.992895,0,miopenConvolutionFwdAlgoWinograd;ConvBinWinogradRxSf3x2:1.23933,0,miopenConvolutionFwdAlgoWinograd;GemmFwdRest:1.92252,110899200,miopenConvolutionFwdAlgoGEMM;ConvDirectNaiveConvFwd:0.951893,0,miopenConvolutionFwdAlgoDirect
1536-38-38-1x1-1536-38-38-1-0x0-1x1-1x1-0-NCHW-FP16-F_g48=ConvBinWinogradRxSf2x3:0.064633,0,miopenConvolutionFwdAlgoWinograd;ConvBinWinogradRxSf3x2:0.0523817,0,miopenConvolutionFwdAlgoWinograd;GemmFwd1x1_0_1:0.0529032,0,miopenConvolutionFwdAlgoGEMM;ConvDirectNaiveConvFwd:1.42362,0,miopenConvolutionFwdAlgoDirect
1024-38-38-1x1-512-38-38-1-0x0-1x1-1x1-0-NCHW-FP16-F=ConvBinWinogradRxSf2x3g1:0.303924,0,miopenConvolutionFwdAlgoWinograd;ConvBinWinogradRxSf3x2:0.162699,0,miopenConvolutionFwdAlgoWinograd;GemmFwd1x1_0_1:0.0499977,0,miopenConvolutionFwdAlgoGEMM;ConvDirectNaiveConvFwd:15.385,0,miopenConvolutionFwdAlgoDirect
512-38-38-1x1-3072-38-38-1-0x0-1x1-1x1-0-NCHW-FP16-F=ConvBinWinogradRxSf2x3g1:1.00627,0,miopenConvolutionFwdAlgoWinograd;ConvBinWinogradRxSf3x2:0.422524,0,miopenConvolutionFwdAlgoWinograd;GemmFwd1x1_0_1:0.12674,0,miopenConvolutionFwdAlgoGEMM;ConvDirectNaiveConvFwd:44.7924,0,miopenConvolutionFwdAlgoDirect
3072-38-38-3x3-3072-38-38-1-1x1-1x1-1x1-0-NCHW-FP16-F_g3072=ConvBinWinogradRxSf2x3:1.38103,0,miopenConvolutionFwdAlgoWinograd;ConvBinWinogradRxSf3x2:1.64551,0,miopenConvolutionFwdAlgoWinograd;GemmFwdRest:2.77671,79847424,miopenConvolutionFwdAlgoGEMM;ConvDirectNaiveConvFwd:0.777817,0,miopenConvolutionFwdAlgoDirect
3072-38-38-1x1-512-38-38-1-0x0-1x1-1x1-0-NCHW-FP16-F=ConvBinWinogradRxSf2x3g1:1.0157,0,miopenConvolutionFwdAlgoWinograd;ConvBinWinogradRxSf3x2:0.485529,0,miopenConvolutionFwdAlgoWinograd;GemmFwd1x1_0_1:0.136854,0,miopenConvolutionFwdAlgoGEMM;ConvDirectNaiveConvFwd:48,0,miopenConvolutionFwdAlgoDirect
512-300-300-1x1-512-300-300-1-0x0-1x1-1x1-0-NCHW-FP16-F=ConvBinWinogradRxSf2x3g1:10.0177,0,miopenConvolutionFwdAlgoWinograd;ConvBinWinogradRxSf3x2:4.59263,0,miopenConvolutionFwdAlgoWinograd;GemmFwd1x1_0_1:1.51609,0,miopenConvolutionFwdAlgoGEMM;ConvDirectNaiveConvFwd:534.155,0,miopenConvolutionFwdAlgoDirect
512-300-300-1x1-2-300-300-1-0x0-1x1-1x1-0-NCHW-FP16-F=ConvBinWinogradRxSf2x3g1:0.555604,0,miopenConvolutionFwdAlgoWinograd;ConvBinWinogradRxSf3x2:0.438391,0,miopenConvolutionFwdAlgoWinograd;GemmFwd1x1_0_1:0.429896,0,miopenConvolutionFwdAlgoGEMM;ConvDirectNaiveConvFwd:66.9081,0,miopenConvolutionFwdAlgoDirect
3-1-14-14-1x14x14-1280-1-1-1-612-0x0x0-1x14x14-1x1x1-0-NCDHW-BF16-F=GemmFwdRest:36.8177,1176,miopenConvolutionFwdAlgoGEMM;ConvDirectNaiveConvFwd:936.831,0,miopenConvolutionFwdAlgoDirect
3-768-768-4x4-128-192-192-7-0x0-4x4-1x1-0-NCHW-FP16-F=GemmFwdRest:0.685775,3538944,miopenConvolutionFwdAlgoGEMM;ConvDirectNaiveConvFwd:27.0474,0,miopenConvolutionFwdAlgoDirect
3-1-14-14-1x14x14-1280-1-1-1-32208-0x0x0-1x14x14-1x1x1-0-NCDHW-BF16-F=GemmFwdRest:2011.88,1176,miopenConvolutionFwdAlgoGEMM;ConvDirectNaiveConvFwd:9154.63,0,miopenConvolutionFwdAlgoDirect
3-1-14-14-1x14x14-1280-1-1-1-1272-0x0x0-1x14x14-1x1x1-0-NCDHW-BF16-F=GemmFwdRest:77.5382,1176,miopenConvolutionFwdAlgoGEMM;ConvDirectNaiveConvFwd:1944.07,0,miopenConvolutionFwdAlgoDirect
3-768-768-4x4-128-192-192-4-0x0-4x4-1x1-0-NCHW-FP16-F=GemmFwdRest:0.382807,3538944,miopenConvolutionFwdAlgoGEMM;ConvDirectNaiveConvFwd:16.0597,0,miopenConvolutionFwdAlgoDirect
3-1-14-14-1x14x14-1280-1-1-1-32832-0x0x0-1x14x14-1x1x1-0-NCDHW-BF16-F=GemmFwdRest:2053.96,1176,miopenConvolutionFwdAlgoGEMM;ConvDirectNaiveConvFwd:10098.9,0,miopenConvolutionFwdAlgoDirect
3-1-14-14-1x14x14-1280-1-1-1-18240-0x0x0-1x14x14-1x1x1-0-NCDHW-BF16-F=GemmFwdRest:1142.14,1176,miopenConvolutionFwdAlgoGEMM;ConvDirectNaiveConvFwd:7838.26,0,miopenConvolutionFwdAlgoDirect
3-1-14-14-1x14x14-1280-1-1-1-644-0x0x0-1x14x14-1x1x1-0-NCDHW-BF16-F=GemmFwdRest:38.682,1176,miopenConvolutionFwdAlgoGEMM;ConvDirectNaiveConvFwd:984.99,0,miopenConvolutionFwdAlgoDirect
3-1-14-14-1x14x14-1280-1-1-1-3152-0x0x0-1x14x14-1x1x1-0-NCDHW-BF16-F=GemmFwdRest:192.483,1176,miopenConvolutionFwdAlgoGEMM;ConvDirectNaiveConvFwd:4806.79,0,miopenConvolutionFwdAlgoDirect
3-768-768-4x4-128-192-192-1-0x0-4x4-1x1-0-NCHW-FP16-F=GemmFwdRest:0.0556843,3538944,miopenConvolutionFwdAlgoGEMM;ConvDirectNaiveConvFwd:4.22552,0,miopenConvolutionFwdAlgoDirect
3-1-14-14-1x14x14-1280-1-1-1-27360-0x0x0-1x14x14-1x1x1-0-NCDHW-BF16-F=GemmFwdRest:1710.37,1176,miopenConvolutionFwdAlgoGEMM;ConvDirectNaiveConvFwd:1747.47,0,miopenConvolutionFwdAlgoDirect
3-1-14-14-1x14x14-1280-1-1-1-36480-0x0x0-1x14x14-1x1x1-0-NCDHW-BF16-F=GemmFwdRest:2280.83,1176,miopenConvolutionFwdAlgoGEMM;ConvDirectNaiveConvFwd:15682.2,0,miopenConvolutionFwdAlgoDirect
3-1-14-14-1x14x14-1280-1-1-1-22800-0x0x0-1x14x14-1x1x1-0-NCDHW-BF16-F=GemmFwdRest:1426.66,1176,miopenConvolutionFwdAlgoGEMM;ConvDirectNaiveConvFwd:14808.1,0,miopenConvolutionFwdAlgoDirect
3-1200-1200-3x3-32-600-600-2-1x1-2x2-1x1-0-NCHW-FP16-F=ConvBinWinogradRxSf2x3g1:0.37217,0,miopenConvolutionFwdAlgoWinograd;ConvBinWinogradRxSf3x2:0.343711,0,miopenConvolutionFwdAlgoWinograd;GemmFwdRest:0.714736,19440000,miopenConvolutionFwdAlgoGEMM;ConvDirectNaiveConvFwd:14.2811,0,miopenConvolutionFwdAlgoDirect
32-600-600-3x3-32-600-600-2-1x1-1x1-1x1-0-NCHW-FP16-F=ConvBinWinogradRxSf2x3g1:0.507279,0,miopenConvolutionFwdAlgoWinograd;ConvBinWinogradRxSf3x2:0.581314,0,miopenConvolutionFwdAlgoWinograd;GemmFwdRest:4.58167,207360000,miopenConvolutionFwdAlgoGEMM;ConvDirectNaiveConvFwd:152.34,0,miopenConvolutionFwdAlgoDirect
32-600-600-3x3-512-300-300-2-1x1-2x2-1x1-0-NCHW-FP16-F=ConvBinWinogradRxSf2x3g1:5.9921,0,miopenConvolutionFwdAlgoWinograd;ConvBinWinogradRxSf3x2:2.99002,0,miopenConvolutionFwdAlgoWinograd;GemmFwdRest:2.98227,51840000,miopenConvolutionFwdAlgoGEMM;ConvDirectNaiveConvFwd:458.191,0,miopenConvolutionFwdAlgoDirect
512-300-300-1x1-64-300-300-2-0x0-1x1-1x1-0-NCHW-FP16-F=ConvBinWinogradRxSf2x3g1:2.49779,0,miopenConvolutionFwdAlgoWinograd;ConvBinWinogradRxSf3x2:1.41658,0,miopenConvolutionFwdAlgoWinograd;GemmFwd1x1_0_1:1.0028,0,miopenConvolutionFwdAlgoGEMM;ConvDirectNaiveConvFwd:146.293,0,miopenConvolutionFwdAlgoDirect
64-300-300-3x3-256-300-300-2-1x1-1x1-1x1-0-NCHW-FP16-F=ConvBinWinogradRxSf2x3g1:1.51965,0,miopenConvolutionFwdAlgoWinograd;ConvBinWinogradRxSf3x2:2.17755,0,miopenConvolutionFwdAlgoWinograd;GemmFwdRest:2.99945,103680000,miopenConvolutionFwdAlgoGEMM;ConvDirectNaiveConvFwd:476.99,0,miopenConvolutionFwdAlgoDirect
256-300-300-1x1-64-300-300-2-0x0-1x1-1x1-0-NCHW-FP16-F=ConvBinWinogradRxSf2x3g1:1.28282,0,miopenConvolutionFwdAlgoWinograd;ConvBinWinogradRxSf3x2:0.745926,0,miopenConvolutionFwdAlgoWinograd;GemmFwd1x1_0_1:0.574384,0,miopenConvolutionFwdAlgoGEMM;ConvDirectNaiveConvFwd:65.1418,0,miopenConvolutionFwdAlgoDirect
64-300-300-3x3-1024-150-150-2-1x1-2x2-1x1-0-NCHW-FP16-F=ConvBinWinogradRxSf2x3g1:5.68237,0,miopenConvolutionFwdAlgoWinograd;ConvBinWinogradRxSf3x2:2.59383,0,miopenConvolutionFwdAlgoWinograd;GemmFwdRest:2.00428,25920000,miopenConvolutionFwdAlgoGEMM;ConvDirectNaiveConvFwd:458.637,0,miopenConvolutionFwdAlgoDirect
1024-150-150-1x1-128-150-150-2-0x0-1x1-1x1-0-NCHW-FP16-F=ConvBinWinogradRxSf2x3g1:2.44143,0,miopenConvolutionFwdAlgoWinograd;ConvBinWinogradRxSf3x2:1.4069,0,miopenConvolutionFwdAlgoWinograd;GemmFwd1x1_0_1:0.530203,0,miopenConvolutionFwdAlgoGEMM;ConvDirectNaiveConvFwd:130.846,0,miopenConvolutionFwdAlgoDirect
128-150-150-3x3-512-150-150-2-1x1-1x1-1x1-0-NCHW-FP16-F=ConvBinWinogradRxSf2x3g1:1.36226,0,miopenConvolutionFwdAlgoWinograd;ConvBinWinogradRxSf3x2:2.16305,0,miopenConvolutionFwdAlgoWinograd;GemmFwdRest:2.02574,51840000,miopenConvolutionFwdAlgoGEMM;ConvDirectNaiveConvFwd:454.705,0,miopenConvolutionFwdAlgoDirect
512-150-150-1x1-128-150-150-2-0x0-1x1-1x1-0-NCHW-FP16-F=ConvBinWinogradRxSf2x3g1:1.25366,0,miopenConvolutionFwdAlgoWinograd;ConvBinWinogradRxSf3x2:0.627617,0,miopenConvolutionFwdAlgoWinograd;GemmFwd1x1_0_1:0.297743,0,miopenConvolutionFwdAlgoGEMM;ConvDirectNaiveConvFwd:64.4443,0,miopenConvolutionFwdAlgoDirect
128-150-150-1x1-2048-150-150-2-0x0-1x1-1x1-0-NCHW-FP16-F=ConvBinWinogradRxSf2x3g1:5.29203,0,miopenConvolutionFwdAlgoWinograd;ConvBinWinogradRxSf3x2:2.68216,0,miopenConvolutionFwdAlgoWinograd;GemmFwd1x1_0_1:1.24061,0,miopenConvolutionFwdAlgoGEMM;ConvDirectNaiveConvFwd:226.189,0,miopenConvolutionFwdAlgoDirect
2048-150-150-3x3-2048-75-75-2-1x1-2x2-1x1-0-NCHW-FP16-F_g2048=ConvBinWinogradRxSf2x3:9.11177,0,miopenConvolutionFwdAlgoWinograd;ConvBinWinogradRxSf3x2:6.17804,0,miopenConvolutionFwdAlgoWinograd;GemmFwdRest:14.867,207360000,miopenConvolutionFwdAlgoGEMM;ConvDirectNaiveConvFwd:4.11924,0,miopenConvolutionFwdAlgoDirect
2048-75-75-1x1-256-75-75-2-0x0-1x1-1x1-0-NCHW-FP16-F=ConvBinWinogradRxSf2x3g1:2.56212,0,miopenConvolutionFwdAlgoWinograd;ConvBinWinogradRxSf3x2:1.66988,0,miopenConvolutionFwdAlgoWinograd;GemmFwd1x1_0_1:0.317902,0,miopenConvolutionFwdAlgoGEMM;ConvDirectNaiveConvFwd:125.508,0,miopenConvolutionFwdAlgoDirect
256-75-75-1x1-1024-75-75-2-0x0-1x1-1x1-0-NCHW-FP16-F=ConvBinWinogradRxSf2x3g1:1.28559,0,miopenConvolutionFwdAlgoWinograd;ConvBinWinogradRxSf3x2:0.507446,0,miopenConvolutionFwdAlgoWinograd;GemmFwd1x1_0_1:0.20501,0,miopenConvolutionFwdAlgoGEMM;ConvDirectNaiveConvFwd:56.2006,0,miopenConvolutionFwdAlgoDirect
1024-75-75-3x3-1024-75-75-2-1x1-1x1-1x1-0-NCHW-FP16-F_g1024=ConvBinWinogradRxSf2x3:2.977,0,miopenConvolutionFwdAlgoWinograd;ConvBinWinogradRxSf3x2:3.02692,0,miopenConvolutionFwdAlgoWinograd;GemmFwdRest:6.80891,103680000,miopenConvolutionFwdAlgoGEMM;ConvDirectNaiveConvFwd:1.98116,0,miopenConvolutionFwdAlgoDirect
1024-75-75-1x1-256-75-75-2-0x0-1x1-1x1-0-NCHW-FP16-F=ConvBinWinogradRxSf2x3g1:1.33751,0,miopenConvolutionFwdAlgoWinograd;ConvBinWinogradRxSf3x2:0.471022,0,miopenConvolutionFwdAlgoWinograd;GemmFwd1x1_0_1:0.146687,0,miopenConvolutionFwdAlgoGEMM;ConvDirectNaiveConvFwd:60.5853,0,miopenConvolutionFwdAlgoDirect
256-75-75-1x1-6144-75-75-2-0x0-1x1-1x1-0-NCHW-FP16-F=ConvBinWinogradRxSf2x3g1:7.9254,0,miopenConvolutionFwdAlgoWinograd;ConvBinWinogradRxSf3x2:3.45319,0,miopenConvolutionFwdAlgoWinograd;GemmFwd1x1_0_1:1.17118,0,miopenConvolutionFwdAlgoGEMM;ConvDirectNaiveConvFwd:336.222,0,miopenConvolutionFwdAlgoDirect
6144-75-75-3x3-6144-38-38-2-1x1-2x2-1x1-0-NCHW-FP16-F_g6144=ConvBinWinogradRxSf2x3:7.2923,0,miopenConvolutionFwdAlgoWinograd;ConvBinWinogradRxSf3x2:5.53875,0,miopenConvolutionFwdAlgoWinograd;GemmFwdRest:12.2464,159694848,miopenConvolutionFwdAlgoGEMM;ConvDirectNaiveConvFwd:3.25133,0,miopenConvolutionFwdAlgoDirect
6144-38-38-1x1-512-38-38-2-0x0-1x1-1x1-0-NCHW-FP16-F=ConvBinWinogradRxSf2x3g1:4.12884,0,miopenConvolutionFwdAlgoWinograd;ConvBinWinogradRxSf3x2:1.86195,0,miopenConvolutionFwdAlgoWinograd;GemmFwd1x1_0_1:0.587168,0,miopenConvolutionFwdAlgoGEMM;ConvDirectNaiveConvFwd:201.233,0,miopenConvolutionFwdAlgoDirect
512-38-38-1x1-1536-38-38-2-0x0-1x1-1x1-0-NCHW-FP16-F=ConvBinWinogradRxSf2x3g1:1.01843,0,miopenConvolutionFwdAlgoWinograd;ConvBinWinogradRxSf3x2:0.398508,0,miopenConvolutionFwdAlgoWinograd;GemmFwd1x1_0_1:0.138,0,miopenConvolutionFwdAlgoGEMM;ConvDirectNaiveConvFwd:44.8577,0,miopenConvolutionFwdAlgoDirect
1536-38-38-5x5-1536-38-38-2-2x2-1x1-1x1-0-NCHW-FP16-F_g1536=ConvBinWinogradRxSf2x3:1.76414,0,miopenConvolutionFwdAlgoWinograd;ConvBinWinogradRxSf3x2:2.12577,0,miopenConvolutionFwdAlgoWinograd;GemmFwdRest:3.81641,110899200,miopenConvolutionFwdAlgoGEMM;ConvDirectNaiveConvFwd:1.92383,0,miopenConvolutionFwdAlgoDirect
1536-38-38-1x1-1536-38-38-2-0x0-1x1-1x1-0-NCHW-FP16-F_g48=ConvBinWinogradRxSf2x3:0.110827,0,miopenConvolutionFwdAlgoWinograd;ConvBinWinogradRxSf3x2:0.0858195,0,miopenConvolutionFwdAlgoWinograd;GemmFwd1x1_0_1:0.106517,0,miopenConvolutionFwdAlgoGEMM;ConvDirectNaiveConvFwd:2.85378,0,miopenConvolutionFwdAlgoDirect
1024-38-38-1x1-512-38-38-2-0x0-1x1-1x1-0-NCHW-FP16-F=ConvBinWinogradRxSf2x3g1:0.643724,0,miopenConvolutionFwdAlgoWinograd;ConvBinWinogradRxSf3x2:0.273146,0,miopenConvolutionFwdAlgoWinograd;GemmFwd1x1_0_1:0.0783608,0,miopenConvolutionFwdAlgoGEMM;ConvDirectNaiveConvFwd:30.1872,0,miopenConvolutionFwdAlgoDirect
512-38-38-1x1-3072-38-38-2-0x0-1x1-1x1-0-NCHW-FP16-F=ConvBinWinogradRxSf2x3g1:1.95174,0,miopenConvolutionFwdAlgoWinograd;ConvBinWinogradRxSf3x2:0.836513,0,miopenConvolutionFwdAlgoWinograd;GemmFwd1x1_0_1:0.247961,0,miopenConvolutionFwdAlgoGEMM;ConvDirectNaiveConvFwd:89.84,0,miopenConvolutionFwdAlgoDirect
3072-38-38-3x3-3072-38-38-2-1x1-1x1-1x1-0-NCHW-FP16-F_g3072=ConvBinWinogradRxSf2x3:2.40617,0,miopenConvolutionFwdAlgoWinograd;ConvBinWinogradRxSf3x2:2.7376,0,miopenConvolutionFwdAlgoWinograd;GemmFwdRest:5.5425,79847424,miopenConvolutionFwdAlgoGEMM;ConvDirectNaiveConvFwd:1.54138,0,miopenConvolutionFwdAlgoDirect
3072-38-38-1x1-512-38-38-2-0x0-1x1-1x1-0-NCHW-FP16-F=ConvBinWinogradRxSf2x3g1:2.0478,0,miopenConvolutionFwdAlgoWinograd;ConvBinWinogradRxSf3x2:0.9114,0,miopenConvolutionFwdAlgoWinograd;GemmFwd1x1_0_1:0.25842,0,miopenConvolutionFwdAlgoGEMM;ConvDirectNaiveConvFwd:95.0485,0,miopenConvolutionFwdAlgoDirect
512-300-300-1x1-512-300-300-2-0x0-1x1-1x1-0-NCHW-FP16-F=ConvBinWinogradRxSf2x3g1:19.7313,0,miopenConvolutionFwdAlgoWinograd;ConvBinWinogradRxSf3x2:9.0453,0,miopenConvolutionFwdAlgoWinograd;GemmFwd1x1_0_1:3.10629,0,miopenConvolutionFwdAlgoGEMM;ConvDirectNaiveConvFwd:1062.16,0,miopenConvolutionFwdAlgoDirect
512-300-300-1x1-2-300-300-2-0x0-1x1-1x1-0-NCHW-FP16-F=ConvBinWinogradRxSf2x3g1:1.15759,0,miopenConvolutionFwdAlgoWinograd;ConvBinWinogradRxSf3x2:0.888726,0,miopenConvolutionFwdAlgoWinograd;GemmFwd1x1_0_1:0.848366,0,miopenConvolutionFwdAlgoGEMM;ConvDirectNaiveConvFwd:66.6596,0,miopenConvolutionFwdAlgoDirect
3-1-14-14-1x14x14-1280-1-1-1-756-0x0x0-1x14x14-1x1x1-0-NCDHW-BF16-F=GemmFwdRest:45.4368,1176,miopenConvolutionFwdAlgoGEMM;ConvDirectNaiveConvFwd:1155.99,0,miopenConvolutionFwdAlgoDirect
3-1-14-14-1x14x14-1280-1-1-1-10540-0x0x0-1x14x14-1x1x1-0-NCDHW-BF16-F=GemmFwdRest:656.836,1176,miopenConvolutionFwdAlgoGEMM;ConvDirectNaiveConvFwd:16110.9,0,miopenConvolutionFwdAlgoDirect
3-1-14-14-1x14x14-1280-1-1-1-33792-0x0x0-1x14x14-1x1x1-0-NCDHW-BF16-F=GemmFwdRest:2112.32,1176,miopenConvolutionFwdAlgoGEMM;ConvDirectNaiveConvFwd:11573.6,0,miopenConvolutionFwdAlgoDirect
3-1200-1200-3x3-32-600-600-9-1x1-2x2-1x1-0-NCHW-FP16-F=ConvBinWinogradRxSf2x3g1:1.66868,0,miopenConvolutionFwdAlgoWinograd;ConvBinWinogradRxSf3x2:1.52562,0,miopenConvolutionFwdAlgoWinograd;GemmFwdRest:3.2486,19440000,miopenConvolutionFwdAlgoGEMM;ConvDirectNaiveConvFwd:50.8116,0,miopenConvolutionFwdAlgoDirect
32-600-600-3x3-32-600-600-9-1x1-1x1-1x1-0-NCHW-FP16-F=ConvBinWinogradRxSf2x3g1:2.25025,0,miopenConvolutionFwdAlgoWinograd;ConvBinWinogradRxSf3x2:2.81198,0,miopenConvolutionFwdAlgoWinograd;GemmFwdRest:20.5857,207360000,miopenConvolutionFwdAlgoGEMM;ConvDirectNaiveConvFwd:529.773,0,miopenConvolutionFwdAlgoDirect
32-600-600-3x3-512-300-300-9-1x1-2x2-1x1-0-NCHW-FP16-F=ConvBinWinogradRxSf2x3g1:26.753,0,miopenConvolutionFwdAlgoWinograd;ConvBinWinogradRxSf3x2:13.374,0,miopenConvolutionFwdAlgoWinograd;GemmFwdRest:13.1998,51840000,miopenConvolutionFwdAlgoGEMM;ConvDirectNaiveConvFwd:2045.65,0,miopenConvolutionFwdAlgoDirect
512-300-300-1x1-64-300-300-9-0x0-1x1-1x1-0-NCHW-FP16-F=ConvBinWinogradRxSf2x3g1:11.0882,0,miopenConvolutionFwdAlgoWinograd;ConvBinWinogradRxSf3x2:6.27854,0,miopenConvolutionFwdAlgoWinograd;GemmFwd1x1_0_1:4.38531,0,miopenConvolutionFwdAlgoGEMM;ConvDirectNaiveConvFwd:599.135,0,miopenConvolutionFwdAlgoDirect
64-300-300-3x3-256-300-300-9-1x1-1x1-1x1-0-NCHW-FP16-F=ConvBinWinogradRxSf2x3g1:6.77002,0,miopenConvolutionFwdAlgoWinograd;ConvBinWinogradRxSf3x2:9.78792,0,miopenConvolutionFwdAlgoWinograd;GemmFwdRest:13.6307,103680000,miopenConvolutionFwdAlgoGEMM;ConvDirectNaiveConvFwd:2050.05,0,miopenConvolutionFwdAlgoDirect
256-300-300-1x1-64-300-300-9-0x0-1x1-1x1-0-NCHW-FP16-F=ConvBinWinogradRxSf2x3g1:5.63475,0,miopenConvolutionFwdAlgoWinograd;ConvBinWinogradRxSf3x2:3.29074,0,miopenConvolutionFwdAlgoWinograd;GemmFwd1x1_0_1:2.47702,0,miopenConvolutionFwdAlgoGEMM;ConvDirectNaiveConvFwd:279.122,0,miopenConvolutionFwdAlgoDirect
64-300-300-3x3-1024-150-150-9-1x1-2x2-1x1-0-NCHW-FP16-F=ConvBinWinogradRxSf2x3g1:25.5315,0,miopenConvolutionFwdAlgoWinograd;ConvBinWinogradRxSf3x2:11.5463,0,miopenConvolutionFwdAlgoWinograd;GemmFwdRest:9.13599,25920000,miopenConvolutionFwdAlgoGEMM;ConvDirectNaiveConvFwd:2050.19,0,miopenConvolutionFwdAlgoDirect
1024-150-150-1x1-128-150-150-9-0x0-1x1-1x1-0-NCHW-FP16-F=ConvBinWinogradRxSf2x3g1:10.9635,0,miopenConvolutionFwdAlgoWinograd;ConvBinWinogradRxSf3x2:6.36626,0,miopenConvolutionFwdAlgoWinograd;GemmFwd1x1_0_1:2.35884,0,miopenConvolutionFwdAlgoGEMM;ConvDirectNaiveConvFwd:569.555,0,miopenConvolutionFwdAlgoDirect
128-150-150-3x3-512-150-150-9-1x1-1x1-1x1-0-NCHW-FP16-F=ConvBinWinogradRxSf2x3g1:6.2193,0,miopenConvolutionFwdAlgoWinograd;ConvBinWinogradRxSf3x2:9.40817,0,miopenConvolutionFwdAlgoWinograd;GemmFwdRest:9.08384,51840000,miopenConvolutionFwdAlgoGEMM;ConvDirectNaiveConvFwd:2043.01,0,miopenConvolutionFwdAlgoDirect
512-150-150-1x1-128-150-150-9-0x0-1x1-1x1-0-NCHW-FP16-F=ConvBinWinogradRxSf2x3g1:5.62381,0,miopenConvolutionFwdAlgoWinograd;ConvBinWinogradRxSf3x2:2.89175,0,miopenConvolutionFwdAlgoWinograd;GemmFwd1x1_0_1:1.34221,0,miopenConvolutionFwdAlgoGEMM;ConvDirectNaiveConvFwd:270.702,0,miopenConvolutionFwdAlgoDirect
128-150-150-1x1-2048-150-150-9-0x0-1x1-1x1-0-NCHW-FP16-F=ConvBinWinogradRxSf2x3g1:23.3106,0,miopenConvolutionFwdAlgoWinograd;ConvBinWinogradRxSf3x2:11.865,0,miopenConvolutionFwdAlgoWinograd;GemmFwd1x1_0_1:5.66603,0,miopenConvolutionFwdAlgoGEMM;ConvDirectNaiveConvFwd:1025.5,0,miopenConvolutionFwdAlgoDirect
2048-150-150-3x3-2048-75-75-9-1x1-2x2-1x1-0-NCHW-FP16-F_g2048=ConvBinWinogradRxSf2x3:39.3616,0,miopenConvolutionFwdAlgoWinograd;ConvBinWinogradRxSf3x2:25.6422,0,miopenConvolutionFwdAlgoWinograd;GemmFwdRest:65.6795,207360000,miopenConvolutionFwdAlgoGEMM;ConvDirectNaiveConvFwd:18.4835,0,miopenConvolutionFwdAlgoDirect
2048-75-75-1x1-256-75-75-9-0x0-1x1-1x1-0-NCHW-FP16-F=ConvBinWinogradRxSf2x3g1:11.0618,0,miopenConvolutionFwdAlgoWinograd;ConvBinWinogradRxSf3x2:8.64044,0,miopenConvolutionFwdAlgoWinograd;GemmFwd1x1_0_1:1.81259,0,miopenConvolutionFwdAlgoGEMM;ConvDirectNaiveConvFwd:556.487,0,miopenConvolutionFwdAlgoDirect
256-75-75-1x1-1024-75-75-9-0x0-1x1-1x1-0-NCHW-FP16-F=ConvBinWinogradRxSf2x3g1:5.78039,0,miopenConvolutionFwdAlgoWinograd;ConvBinWinogradRxSf3x2:2.63116,0,miopenConvolutionFwdAlgoWinograd;GemmFwd1x1_0_1:1.0728,0,miopenConvolutionFwdAlgoGEMM;ConvDirectNaiveConvFwd:252.522,0,miopenConvolutionFwdAlgoDirect
1024-75-75-3x3-1024-75-75-9-1x1-1x1-1x1-0-NCHW-FP16-F_g1024=ConvBinWinogradRxSf2x3:12.7603,0,miopenConvolutionFwdAlgoWinograd;ConvBinWinogradRxSf3x2:12.6134,0,miopenConvolutionFwdAlgoWinograd;GemmFwdRest:30.2933,103680000,miopenConvolutionFwdAlgoGEMM;ConvDirectNaiveConvFwd:8.84896,0,miopenConvolutionFwdAlgoDirect
1024-75-75-1x1-256-75-75-9-0x0-1x1-1x1-0-NCHW-FP16-F=ConvBinWinogradRxSf2x3g1:5.72549,0,miopenConvolutionFwdAlgoWinograd;ConvBinWinogradRxSf3x2:2.73876,0,miopenConvolutionFwdAlgoWinograd;GemmFwd1x1_0_1:0.793782,0,miopenConvolutionFwdAlgoGEMM;ConvDirectNaiveConvFwd:265.346,0,miopenConvolutionFwdAlgoDirect
256-75-75-1x1-6144-75-75-9-0x0-1x1-1x1-0-NCHW-FP16-F=ConvBinWinogradRxSf2x3g1:35.3296,0,miopenConvolutionFwdAlgoWinograd;ConvBinWinogradRxSf3x2:16.0196,0,miopenConvolutionFwdAlgoWinograd;GemmFwd1x1_0_1:5.19391,0,miopenConvolutionFwdAlgoGEMM;ConvDirectNaiveConvFwd:1518.26,0,miopenConvolutionFwdAlgoDirect
6144-75-75-3x3-6144-38-38-9-1x1-2x2-1x1-0-NCHW-FP16-F_g6144=ConvBinWinogradRxSf2x3:29.6325,0,miopenConvolutionFwdAlgoWinograd;ConvBinWinogradRxSf3x2:21.3158,0,miopenConvolutionFwdAlgoWinograd;GemmFwdRest:54.8281,159694848,miopenConvolutionFwdAlgoGEMM;ConvDirectNaiveConvFwd:14.6112,0,miopenConvolutionFwdAlgoDirect
6144-38-38-1x1-512-38-38-9-0x0-1x1-1x1-0-NCHW-FP16-F=ConvBinWinogradRxSf2x3g1:17.5897,0,miopenConvolutionFwdAlgoWinograd;ConvBinWinogradRxSf3x2:14.5168,0,miopenConvolutionFwdAlgoWinograd;GemmFwd1x1_0_1:3.19932,0,miopenConvolutionFwdAlgoGEMM;ConvDirectNaiveConvFwd:898.845,0,miopenConvolutionFwdAlgoDirect
512-38-38-1x1-1536-38-38-9-0x0-1x1-1x1-0-NCHW-FP16-F=ConvBinWinogradRxSf2x3g1:4.59851,0,miopenConvolutionFwdAlgoWinograd;ConvBinWinogradRxSf3x2:1.95012,0,miopenConvolutionFwdAlgoWinograd;GemmFwd1x1_0_1:0.591444,0,miopenConvolutionFwdAlgoGEMM;ConvDirectNaiveConvFwd:203.457,0,miopenConvolutionFwdAlgoDirect
1536-38-38-5x5-1536-38-38-9-2x2-1x1-1x1-0-NCHW-FP16-F_g1536=ConvBinWinogradRxSf2x3:7.38854,0,miopenConvolutionFwdAlgoWinograd;ConvBinWinogradRxSf3x2:8.87245,0,miopenConvolutionFwdAlgoWinograd;GemmFwdRest:17.4744,110899200,miopenConvolutionFwdAlgoGEMM;ConvDirectNaiveConvFwd:8.65396,0,miopenConvolutionFwdAlgoDirect
1536-38-38-1x1-1536-38-38-9-0x0-1x1-1x1-0-NCHW-FP16-F_g48=ConvBinWinogradRxSf2x3:0.447883,0,miopenConvolutionFwdAlgoWinograd;ConvBinWinogradRxSf3x2:0.415207,0,miopenConvolutionFwdAlgoWinograd;GemmFwd1x1_0_1:0.574167,0,miopenConvolutionFwdAlgoGEMM;ConvDirectNaiveConvFwd:13.1148,0,miopenConvolutionFwdAlgoDirect
1024-38-38-1x1-512-38-38-9-0x0-1x1-1x1-0-NCHW-FP16-F=ConvBinWinogradRxSf2x3g1:2.87947,0,miopenConvolutionFwdAlgoWinograd;ConvBinWinogradRxSf3x2:1.25849,0,miopenConvolutionFwdAlgoWinograd;GemmFwd1x1_0_1:0.396901,0,miopenConvolutionFwdAlgoGEMM;ConvDirectNaiveConvFwd:137.097,0,miopenConvolutionFwdAlgoDirect
512-38-38-1x1-3072-38-38-9-0x0-1x1-1x1-0-NCHW-FP16-F=ConvBinWinogradRxSf2x3g1:9.07969,0,miopenConvolutionFwdAlgoWinograd;ConvBinWinogradRxSf3x2:3.9477,0,miopenConvolutionFwdAlgoWinograd;GemmFwd1x1_0_1:1.17724,0,miopenConvolutionFwdAlgoGEMM;ConvDirectNaiveConvFwd:406.434,0,miopenConvolutionFwdAlgoDirect
3072-38-38-3x3-3072-38-38-9-1x1-1x1-1x1-0-NCHW-FP16-F_g3072=ConvBinWinogradRxSf2x3:9.60863,0,miopenConvolutionFwdAlgoWinograd;ConvBinWinogradRxSf3x2:10.3102,0,miopenConvolutionFwdAlgoWinograd;GemmFwdRest:24.7733,79847424,miopenConvolutionFwdAlgoGEMM;ConvDirectNaiveConvFwd:7.00385,0,miopenConvolutionFwdAlgoDirect
3072-38-38-1x1-512-38-38-9-0x0-1x1-1x1-0-NCHW-FP16-F=ConvBinWinogradRxSf2x3g1:8.42285,0,miopenConvolutionFwdAlgoWinograd;ConvBinWinogradRxSf3x2:6.47411,0,miopenConvolutionFwdAlgoWinograd;GemmFwd1x1_0_1:1.44175,0,miopenConvolutionFwdAlgoGEMM;ConvDirectNaiveConvFwd:427.176,0,miopenConvolutionFwdAlgoDirect
512-300-300-1x1-512-300-300-9-0x0-1x1-1x1-0-NCHW-FP16-F=ConvBinWinogradRxSf2x3g1:88.8012,0,miopenConvolutionFwdAlgoWinograd;ConvBinWinogradRxSf3x2:40.4792,0,miopenConvolutionFwdAlgoWinograd;GemmFwd1x1_0_1:14.2102,0,miopenConvolutionFwdAlgoGEMM;ConvDirectNaiveConvFwd:5409.41,0,miopenConvolutionFwdAlgoDirect
512-300-300-1x1-2-300-300-9-0x0-1x1-1x1-0-NCHW-FP16-F=ConvBinWinogradRxSf2x3g1:5.33236,0,miopenConvolutionFwdAlgoWinograd;ConvBinWinogradRxSf3x2:4.25539,0,miopenConvolutionFwdAlgoWinograd;GemmFwd1x1_0_1:3.73325,0,miopenConvolutionFwdAlgoGEMM;ConvDirectNaiveConvFwd:77.9838,0,miopenConvolutionFwdAlgoDirect
3-1-14-14-1x14x14-1280-1-1-1-20336-0x0x0-1x14x14-1x1x1-0-NCDHW-BF16-F=GemmFwdRest:1272.82,1176,miopenConvolutionFwdAlgoGEMM;ConvDirectNaiveConvFwd:11048.8,0,miopenConvolutionFwdAlgoDirect
3-1-14-14-1x14x14-1280-1-1-1-2792-0x0x0-1x14x14-1x1x1-0-NCDHW-BF16-F=GemmFwdRest:170.931,1176,miopenConvolutionFwdAlgoGEMM;ConvDirectNaiveConvFwd:4266.4,0,miopenConvolutionFwdAlgoDirect
3-1-14-14-1x14x14-1280-1-1-1-952-0x0x0-1x14x14-1x1x1-0-NCDHW-BF16-F=GemmFwdRest:57.0678,1176,miopenConvolutionFwdAlgoGEMM;ConvDirectNaiveConvFwd:1453.43,0,miopenConvolutionFwdAlgoDirect
3-1-14-14-1x14x14-1280-1-1-1-31248-0x0x0-1x14x14-1x1x1-0-NCDHW-BF16-F=GemmFwdRest:1953.63,1176,miopenConvolutionFwdAlgoGEMM;ConvDirectNaiveConvFwd:7687.19,0,miopenConvolutionFwdAlgoDirect
3-1-14-14-1x14x14-1280-1-1-1-10416-0x0x0-1x14x14-1x1x1-0-NCDHW-BF16-F=GemmFwdRest:649.961,1176,miopenConvolutionFwdAlgoGEMM;ConvDirectNaiveConvFwd:15889.2,0,miopenConvolutionFwdAlgoDirect
3-1-14-14-1x14x14-1280-1-1-1-13020-0x0x0-1x14x14-1x1x1-0-NCDHW-BF16-F=GemmFwdRest:815.043,1176,miopenConvolutionFwdAlgoGEMM;ConvDirectNaiveConvFwd:19895.8,0,miopenConvolutionFwdAlgoDirect
3-1-14-14-1x14x14-1280-1-1-1-7812-0x0x0-1x14x14-1x1x1-0-NCDHW-BF16-F=GemmFwdRest:486.545,1176,miopenConvolutionFwdAlgoGEMM;ConvDirectNaiveConvFwd:11936.2,0,miopenConvolutionFwdAlgoDirect
3-1-14-14-1x14x14-1280-1-1-1-32676-0x0x0-1x14x14-1x1x1-0-NCDHW-BF16-F=GemmFwdRest:2044.11,1176,miopenConvolutionFwdAlgoGEMM;ConvDirectNaiveConvFwd:9876.75,0,miopenConvolutionFwdAlgoDirect
3-1-14-14-1x14x14-1280-1-1-1-1480-0x0x0-1x14x14-1x1x1-0-NCDHW-BF16-F=GemmFwdRest:90.4417,1176,miopenConvolutionFwdAlgoGEMM;ConvDirectNaiveConvFwd:2264.27,0,miopenConvolutionFwdAlgoDirect
3-1-14-14-1x14x14-1280-1-1-1-1980-0x0x0-1x14x14-1x1x1-0-NCDHW-BF16-F=GemmFwdRest:121.623,1176,miopenConvolutionFwdAlgoGEMM;ConvDirectNaiveConvFwd:3024.59,0,miopenConvolutionFwdAlgoDirect
3-1-14-14-1x14x14-1280-1-1-1-2288-0x0x0-1x14x14-1x1x1-0-NCDHW-BF16-F=GemmFwdRest:139.817,1176,miopenConvolutionFwdAlgoGEMM;ConvDirectNaiveConvFwd:3500.72,0,miopenConvolutionFwdAlgoDirect
3-1-14-14-1x14x14-1280-1-1-1-25680-0x0x0-1x14x14-1x1x1-0-NCDHW-BF16-F=GemmFwdRest:1607.41,1176,miopenConvolutionFwdAlgoGEMM;ConvDirectNaiveConvFwd:19207.3,0,miopenConvolutionFwdAlgoDirect
3-1-14-14-1x14x14-1280-1-1-1-1600-0x0x0-1x14x14-1x1x1-0-NCDHW-BF16-F=GemmFwdRest:98.9276,1176,miopenConvolutionFwdAlgoGEMM;ConvDirectNaiveConvFwd:2446.75,0,miopenConvolutionFwdAlgoDirect
3-1-14-14-1x14x14-1280-1-1-1-16896-0x0x0-1x14x14-1x1x1-0-NCDHW-BF16-F=GemmFwdRest:1054.98,1176,miopenConvolutionFwdAlgoGEMM;ConvDirectNaiveConvFwd:5774.68,0,miopenConvolutionFwdAlgoDirect
3-1-14-14-1x14x14-1280-1-1-1-19712-0x0x0-1x14x14-1x1x1-0-NCDHW-BF16-F=GemmFwdRest:1232.02,1176,miopenConvolutionFwdAlgoGEMM;ConvDirectNaiveConvFwd:10080.3,0,miopenConvolutionFwdAlgoDirect
3-1-14-14-1x14x14-1280-1-1-1-22528-0x0x0-1x14x14-1x1x1-0-NCDHW-BF16-F=GemmFwdRest:1406.55,1176,miopenConvolutionFwdAlgoGEMM;ConvDirectNaiveConvFwd:14383.7,0,miopenConvolutionFwdAlgoDirect
3-1-14-14-1x14x14-1280-1-1-1-31020-0x0x0-1x14x14-1x1x1-0-NCDHW-BF16-F=GemmFwdRest:1939.13,1176,miopenConvolutionFwdAlgoGEMM;ConvDirectNaiveConvFwd:7333.79,0,miopenConvolutionFwdAlgoDirect
3-1-14-14-1x14x14-1280-1-1-1-2664-0x0x0-1x14x14-1x1x1-0-NCDHW-BF16-F=GemmFwdRest:160.672,1176,miopenConvolutionFwdAlgoGEMM;ConvDirectNaiveConvFwd:4072.04,0,miopenConvolutionFwdAlgoDirect
3-1-14-14-1x14x14-1280-1-1-1-2640-0x0x0-1x14x14-1x1x1-0-NCDHW-BF16-F=GemmFwdRest:158.831,1176,miopenConvolutionFwdAlgoGEMM;ConvDirectNaiveConvFwd:4028.42,0,miopenConvolutionFwdAlgoDirect
3-1-14-14-1x14x14-1280-1-1-1-2672-0x0x0-1x14x14-1x1x1-0-NCDHW-BF16-F=GemmFwdRest:164.657,1176,miopenConvolutionFwdAlgoGEMM;ConvDirectNaiveConvFwd:4083.99,0,miopenConvolutionFwdAlgoDirect
3-1-14-14-1x14x14-1280-1-1-1-2800-0x0x0-1x14x14-1x1x1-0-NCDHW-BF16-F=GemmFwdRest:167.601,1176,miopenConvolutionFwdAlgoGEMM;ConvDirectNaiveConvFwd:4275.52,0,miopenConvolutionFwdAlgoDirect
3-1-14-14-1x14x14-1280-1-1-1-2768-0x0x0-1x14x14-1x1x1-0-NCDHW-BF16-F=GemmFwdRest:171.306,1176,miopenConvolutionFwdAlgoGEMM;ConvDirectNaiveConvFwd:4229.72,0,miopenConvolutionFwdAlgoDirect
3-1-14-14-1x14x14-1280-1-1-1-2880-0x0x0-1x14x14-1x1x1-0-NCDHW-BF16-F=GemmFwdRest:175.444,1176,miopenConvolutionFwdAlgoGEMM;ConvDirectNaiveConvFwd:4401.42,0,miopenConvolutionFwdAlgoDirect
3-1-14-14-1x14x14-1280-1-1-1-3168-0x0x0-1x14x14-1x1x1-0-NCDHW-BF16-F=GemmFwdRest:194.767,1176,miopenConvolutionFwdAlgoGEMM;ConvDirectNaiveConvFwd:4837.88,0,miopenConvolutionFwdAlgoDirect
3-1-14-14-1x14x14-1280-1-1-1-2428-0x0x0-1x14x14-1x1x1-0-NCDHW-BF16-F=GemmFwdRest:147.225,1176,miopenConvolutionFwdAlgoGEMM;ConvDirectNaiveConvFwd:3706.22,0,miopenConvolutionFwdAlgoDirect
3-1-14-14-1x14x14-1280-1-1-1-1704-0x0x0-1x14x14-1x1x1-0-NCDHW-BF16-F=GemmFwdRest:103.998,1176,miopenConvolutionFwdAlgoGEMM;ConvDirectNaiveConvFwd:2600.32,0,miopenConvolutionFwdAlgoDirect
3-1-14-14-1x14x14-1280-1-1-1-2544-0x0x0-1x14x14-1x1x1-0-NCDHW-BF16-F=GemmFwdRest:152.19,1176,miopenConvolutionFwdAlgoGEMM;ConvDirectNaiveConvFwd:3888.59,0,miopenConvolutionFwdAlgoDirect
3-1-14-14-1x14x14-1280-1-1-1-2368-0x0x0-1x14x14-1x1x1-0-NCDHW-BF16-F=GemmFwdRest:147.62,1176,miopenConvolutionFwdAlgoGEMM;ConvDirectNaiveConvFwd:3617.03,0,miopenConvolutionFwdAlgoDirect
3-1-14-14-1x14x14-1280-1-1-1-2072-0x0x0-1x14x14-1x1x1-0-NCDHW-BF16-F=GemmFwdRest:124.592,1176,miopenConvolutionFwdAlgoGEMM;ConvDirectNaiveConvFwd:3162.78,0,miopenConvolutionFwdAlgoDirect
3-1-14-14-1x14x14-1280-1-1-1-2016-0x0x0-1x14x14-1x1x1-0-NCDHW-BF16-F=GemmFwdRest:120.72,1176,miopenConvolutionFwdAlgoGEMM;ConvDirectNaiveConvFwd:3078,0,miopenConvolutionFwdAlgoDirect
3-1-14-14-1x14x14-1280-1-1-1-2412-0x0x0-1x14x14-1x1x1-0-NCDHW-BF16-F=GemmFwdRest:150.422,1176,miopenConvolutionFwdAlgoGEMM;ConvDirectNaiveConvFwd:3681.37,0,miopenConvolutionFwdAlgoDirect
3-1-14-14-1x14x14-1280-1-1-1-1792-0x0x0-1x14x14-1x1x1-0-NCDHW-BF16-F=GemmFwdRest:110.783,1176,miopenConvolutionFwdAlgoGEMM;ConvDirectNaiveConvFwd:2734.57,0,miopenConvolutionFwdAlgoDirect
3-1-14-14-1x14x14-1280-1-1-1-1696-0x0x0-1x14x14-1x1x1-0-NCDHW-BF16-F=GemmFwdRest:105.221,1176,miopenConvolutionFwdAlgoGEMM;ConvDirectNaiveConvFwd:2591.68,0,miopenConvolutionFwdAlgoDirect
3-1-14-14-1x14x14-1280-1-1-1-2108-0x0x0-1x14x14-1x1x1-0-NCDHW-BF16-F=GemmFwdRest:129.274,1176,miopenConvolutionFwdAlgoGEMM;ConvDirectNaiveConvFwd:3217.5,0,miopenConvolutionFwdAlgoDirect
3-1-14-14-1x14x14-1280-1-1-1-1892-0x0x0-1x14x14-1x1x1-0-NCDHW-BF16-F=GemmFwdRest:115.171,1176,miopenConvolutionFwdAlgoGEMM;ConvDirectNaiveConvFwd:2887.31,0,miopenConvolutionFwdAlgoDirect
3-1-14-14-1x14x14-1280-1-1-1-1848-0x0x0-1x14x14-1x1x1-0-NCDHW-BF16-F=GemmFwdRest:114.714,1176,miopenConvolutionFwdAlgoGEMM;ConvDirectNaiveConvFwd:2822.85,0,miopenConvolutionFwdAlgoDirect
3-1-14-14-1x14x14-1280-1-1-1-704-0x0x0-1x14x14-1x1x1-0-NCDHW-BF16-F=GemmFwdRest:42.1884,1176,miopenConvolutionFwdAlgoGEMM;ConvDirectNaiveConvFwd:1075.49,0,miopenConvolutionFwdAlgoDirect
3-768-768-4x4-128-192-192-11-0x0-4x4-1x1-0-NCHW-FP16-F=GemmFwdRest:1.09766,3538944,miopenConvolutionFwdAlgoGEMM;ConvDirectNaiveConvFwd:42.6487,0,miopenConvolutionFwdAlgoDirect
3-1-14-14-1x14x14-1280-1-1-1-9080-0x0x0-1x14x14-1x1x1-0-NCDHW-BF16-F=GemmFwdRest:567.698,1176,miopenConvolutionFwdAlgoGEMM;ConvDirectNaiveConvFwd:13875.3,0,miopenConvolutionFwdAlgoDirect
3-1-14-14-1x14x14-1280-1-1-1-2032-0x0x0-1x14x14-1x1x1-0-NCDHW-BF16-F=GemmFwdRest:123.966,1176,miopenConvolutionFwdAlgoGEMM;ConvDirectNaiveConvFwd:3102.01,0,miopenConvolutionFwdAlgoDirect
3-1-14-14-1x14x14-1280-1-1-1-2456-0x0x0-1x14x14-1x1x1-0-NCDHW-BF16-F=GemmFwdRest:150.473,1176,miopenConvolutionFwdAlgoGEMM;ConvDirectNaiveConvFwd:3747.96,0,miopenConvolutionFwdAlgoDirect
3-1-14-14-1x14x14-1280-1-1-1-2120-0x0x0-1x14x14-1x1x1-0-NCDHW-BF16-F=GemmFwdRest:130.059,1176,miopenConvolutionFwdAlgoGEMM;ConvDirectNaiveConvFwd:3238.46,0,miopenConvolutionFwdAlgoDirect
3-1-14-14-1x14x14-1280-1-1-1-2080-0x0x0-1x14x14-1x1x1-0-NCDHW-BF16-F=GemmFwdRest:124.616,1176,miopenConvolutionFwdAlgoGEMM;ConvDirectNaiveConvFwd:3177.86,0,miopenConvolutionFwdAlgoDirect
3-1-14-14-1x14x14-1280-1-1-1-1248-0x0x0-1x14x14-1x1x1-0-NCDHW-BF16-F=GemmFwdRest:74.6605,1176,miopenConvolutionFwdAlgoGEMM;ConvDirectNaiveConvFwd:1905.32,0,miopenConvolutionFwdAlgoDirect
3-1-14-14-1x14x14-1280-1-1-1-34408-0x0x0-1x14x14-1x1x1-0-NCDHW-BF16-F=GemmFwdRest:2152.48,1176,miopenConvolutionFwdAlgoGEMM;ConvDirectNaiveConvFwd:12509.6,0,miopenConvolutionFwdAlgoDirect
3-1-14-14-1x14x14-1280-1-1-1-3128-0x0x0-1x14x14-1x1x1-0-NCDHW-BF16-F=GemmFwdRest:193.338,1176,miopenConvolutionFwdAlgoGEMM;ConvDirectNaiveConvFwd:4780.6,0,miopenConvolutionFwdAlgoDirect
3-1-14-14-1x14x14-1280-1-1-1-15640-0x0x0-1x14x14-1x1x1-0-NCDHW-BF16-F=GemmFwdRest:978.148,1176,miopenConvolutionFwdAlgoGEMM;ConvDirectNaiveConvFwd:3860.86,0,miopenConvolutionFwdAlgoDirect
3-1-14-14-1x14x14-1280-1-1-1-9384-0x0x0-1x14x14-1x1x1-0-NCDHW-BF16-F=GemmFwdRest:585.99,1176,miopenConvolutionFwdAlgoGEMM;ConvDirectNaiveConvFwd:14328.2,0,miopenConvolutionFwdAlgoDirect
3-1-14-14-1x14x14-1280-1-1-1-12512-0x0x0-1x14x14-1x1x1-0-NCDHW-BF16-F=GemmFwdRest:781.437,1176,miopenConvolutionFwdAlgoGEMM;ConvDirectNaiveConvFwd:19122.1,0,miopenConvolutionFwdAlgoDirect
3-1-14-14-1x14x14-1280-1-1-1-25024-0x0x0-1x14x14-1x1x1-0-NCDHW-BF16-F=GemmFwdRest:1596.98,1176,miopenConvolutionFwdAlgoGEMM;ConvDirectNaiveConvFwd:18217.8,0,miopenConvolutionFwdAlgoDirect
3-1-14-14-1x14x14-1280-1-1-1-29072-0x0x0-1x14x14-1x1x1-0-NCDHW-BF16-F=GemmFwdRest:1818.33,1176,miopenConvolutionFwdAlgoGEMM;ConvDirectNaiveConvFwd:4360.79,0,miopenConvolutionFwdAlgoDirect
3-1-14-14-1x14x14-1280-1-1-1-7680-0x0x0-1x14x14-1x1x1-0-NCDHW-BF16-F=GemmFwdRest:476.542,1176,miopenConvolutionFwdAlgoGEMM;ConvDirectNaiveConvFwd:11739.8,0,miopenConvolutionFwdAlgoDirect
3-1-14-14-1x14x14-1280-1-1-1-10240-0x0x0-1x14x14-1x1x1-0-NCDHW-BF16-F=GemmFwdRest:636.647,1176,miopenConvolutionFwdAlgoGEMM;ConvDirectNaiveConvFwd:15646,0,miopenConvolutionFwdAlgoDirect
3-1-14-14-1x14x14-1280-1-1-1-15360-0x0x0-1x14x14-1x1x1-0-NCDHW-BF16-F=GemmFwdRest:955.935,1176,miopenConvolutionFwdAlgoGEMM;ConvDirectNaiveConvFwd:3448.27,0,miopenConvolutionFwdAlgoDirect
3-1-14-14-1x14x14-1280-1-1-1-12800-0x0x0-1x14x14-1x1x1-0-NCDHW-BF16-F=GemmFwdRest:800.223,1176,miopenConvolutionFwdAlgoGEMM;ConvDirectNaiveConvFwd:19559,0,miopenConvolutionFwdAlgoDirect
3-1-14-14-1x14x14-1280-1-1-1-20480-0x0x0-1x14x14-1x1x1-0-NCDHW-BF16-F=GemmFwdRest:1280.48,1176,miopenConvolutionFwdAlgoGEMM;ConvDirectNaiveConvFwd:11261.1,0,miopenConvolutionFwdAlgoDirect
3-1-14-14-1x14x14-1280-1-1-1-17920-0x0x0-1x14x14-1x1x1-0-NCDHW-BF16-F=GemmFwdRest:1119.4,1176,miopenConvolutionFwdAlgoGEMM;ConvDirectNaiveConvFwd:7357.89,0,miopenConvolutionFwdAlgoDirect
3-1-14-14-1x14x14-1280-1-1-1-33720-0x0x0-1x14x14-1x1x1-0-NCDHW-BF16-F=GemmFwdRest:2108.64,1176,miopenConvolutionFwdAlgoGEMM;ConvDirectNaiveConvFwd:11459,0,miopenConvolutionFwdAlgoDirect
3-1-14-14-1x14x14-1280-1-1-1-33084-0x0x0-1x14x14-1x1x1-0-NCDHW-BF16-F=GemmFwdRest:2069.25,1176,miopenConvolutionFwdAlgoGEMM;ConvDirectNaiveConvFwd:10498.7,0,miopenConvolutionFwdAlgoDirect
3-1-14-14-1x14x14-1280-1-1-1-28664-0x0x0-1x14x14-1x1x1-0-NCDHW-BF16-F=GemmFwdRest:1792.04,1176,miopenConvolutionFwdAlgoGEMM;ConvDirectNaiveConvFwd:3748.88,0,miopenConvolutionFwdAlgoDirect
3-1-14-14-1x14x14-1280-1-1-1-17056-0x0x0-1x14x14-1x1x1-0-NCDHW-BF16-F=GemmFwdRest:1067.08,1176,miopenConvolutionFwdAlgoGEMM;ConvDirectNaiveConvFwd:6036,0,miopenConvolutionFwdAlgoDirect
3-1-14-14-1x14x14-1280-1-1-1-15896-0x0x0-1x14x14-1x1x1-0-NCDHW-BF16-F=GemmFwdRest:994.661,1176,miopenConvolutionFwdAlgoGEMM;ConvDirectNaiveConvFwd:4269.04,0,miopenConvolutionFwdAlgoDirect
3-1-14-14-1x14x14-1280-1-1-1-14460-0x0x0-1x14x14-1x1x1-0-NCDHW-BF16-F=GemmFwdRest:902.982,1176,miopenConvolutionFwdAlgoGEMM;ConvDirectNaiveConvFwd:2070.71,0,miopenConvolutionFwdAlgoDirect
3-1-14-14-1x14x14-1280-1-1-1-13200-0x0x0-1x14x14-1x1x1-0-NCDHW-BF16-F=GemmFwdRest:826.723,1176,miopenConvolutionFwdAlgoGEMM;ConvDirectNaiveConvFwd:142.078,0,miopenConvolutionFwdAlgoDirect
3-1-14-14-1x14x14-1280-1-1-1-12108-0x0x0-1x14x14-1x1x1-0-NCDHW-BF16-F=GemmFwdRest:757.211,1176,miopenConvolutionFwdAlgoGEMM;ConvDirectNaiveConvFwd:18511.6,0,miopenConvolutionFwdAlgoDirect
3-1-14-14-1x14x14-1280-1-1-1-10560-0x0x0-1x14x14-1x1x1-0-NCDHW-BF16-F=GemmFwdRest:660.272,1176,miopenConvolutionFwdAlgoGEMM;ConvDirectNaiveConvFwd:16142.4,0,miopenConvolutionFwdAlgoDirect
3-1-14-14-1x14x14-1280-1-1-1-10120-0x0x0-1x14x14-1x1x1-0-NCDHW-BF16-F=GemmFwdRest:632.908,1176,miopenConvolutionFwdAlgoGEMM;ConvDirectNaiveConvFwd:15464.6,0,miopenConvolutionFwdAlgoDirect
3-1-14-14-1x14x14-1280-1-1-1-9056-0x0x0-1x14x14-1x1x1-0-NCDHW-BF16-F=GemmFwdRest:565.587,1176,miopenConvolutionFwdAlgoGEMM;ConvDirectNaiveConvFwd:13838,0,miopenConvolutionFwdAlgoDirect
3-1-14-14-1x14x14-1280-1-1-1-7872-0x0x0-1x14x14-1x1x1-0-NCDHW-BF16-F=GemmFwdRest:490.148,1176,miopenConvolutionFwdAlgoGEMM;ConvDirectNaiveConvFwd:12026.6,0,miopenConvolutionFwdAlgoDirect
3-1-14-14-1x14x14-1280-1-1-1-7268-0x0x0-1x14x14-1x1x1-0-NCDHW-BF16-F=GemmFwdRest:450.939,1176,miopenConvolutionFwdAlgoGEMM;ConvDirectNaiveConvFwd:11113.4,0,miopenConvolutionFwdAlgoDirect
3-1-14-14-1x14x14-1280-1-1-1-6600-0x0x0-1x14x14-1x1x1-0-NCDHW-BF16-F=GemmFwdRest:409.778,1176,miopenConvolutionFwdAlgoGEMM;ConvDirectNaiveConvFwd:10087.7,0,miopenConvolutionFwdAlgoDirect
3-1-14-14-1x14x14-1280-1-1-1-5336-0x0x0-1x14x14-1x1x1-0-NCDHW-BF16-F=GemmFwdRest:327.688,1176,miopenConvolutionFwdAlgoGEMM;ConvDirectNaiveConvFwd:8152.75,0,miopenConvolutionFwdAlgoDirect
3-1-14-14-1x14x14-1280-1-1-1-5220-0x0x0-1x14x14-1x1x1-0-NCDHW-BF16-F=GemmFwdRest:323.904,1176,miopenConvolutionFwdAlgoGEMM;ConvDirectNaiveConvFwd:7980.63,0,miopenConvolutionFwdAlgoDirect
3-1-14-14-1x14x14-1280-1-1-1-4656-0x0x0-1x14x14-1x1x1-0-NCDHW-BF16-F=GemmFwdRest:288.531,1176,miopenConvolutionFwdAlgoGEMM;ConvDirectNaiveConvFwd:7121.67,0,miopenConvolutionFwdAlgoDirect
3-1-14-14-1x14x14-1280-1-1-1-3924-0x0x0-1x14x14-1x1x1-0-NCDHW-BF16-F=GemmFwdRest:242.902,1176,miopenConvolutionFwdAlgoGEMM;ConvDirectNaiveConvFwd:6001.73,0,miopenConvolutionFwdAlgoDirect
3-1-14-14-1x14x14-1280-1-1-1-4096-0x0x0-1x14x14-1x1x1-0-NCDHW-BF16-F=GemmFwdRest:254.86,1176,miopenConvolutionFwdAlgoGEMM;ConvDirectNaiveConvFwd:6264.79,0,miopenConvolutionFwdAlgoDirect
3-1-14-14-1x14x14-1280-1-1-1-3796-0x0x0-1x14x14-1x1x1-0-NCDHW-BF16-F=GemmFwdRest:232.987,1176,miopenConvolutionFwdAlgoGEMM;ConvDirectNaiveConvFwd:5808.46,0,miopenConvolutionFwdAlgoDirect
3-1-14-14-1x14x14-1280-1-1-1-4152-0x0x0-1x14x14-1x1x1-0-NCDHW-BF16-F=GemmFwdRest:258.702,1176,miopenConvolutionFwdAlgoGEMM;ConvDirectNaiveConvFwd:6344.67,0,miopenConvolutionFwdAlgoDirect
3-1-14-14-1x14x14-1280-1-1-1-2684-0x0x0-1x14x14-1x1x1-0-NCDHW-BF16-F=GemmFwdRest:164.498,1176,miopenConvolutionFwdAlgoGEMM;ConvDirectNaiveConvFwd:4099.1,0,miopenConvolutionFwdAlgoDirect
3-1-14-14-1x14x14-1280-1-1-1-2592-0x0x0-1x14x14-1x1x1-0-NCDHW-BF16-F=GemmFwdRest:159.375,1176,miopenConvolutionFwdAlgoGEMM;ConvDirectNaiveConvFwd:3966.36,0,miopenConvolutionFwdAlgoDirect
3-1-14-14-1x14x14-1280-1-1-1-2624-0x0x0-1x14x14-1x1x1-0-NCDHW-BF16-F=GemmFwdRest:160.6,1176,miopenConvolutionFwdAlgoGEMM;ConvDirectNaiveConvFwd:4010,0,miopenConvolutionFwdAlgoDirect
3-1-14-14-1x14x14-1280-1-1-1-2864-0x0x0-1x14x14-1x1x1-0-NCDHW-BF16-F=GemmFwdRest:177.652,1176,miopenConvolutionFwdAlgoGEMM;ConvDirectNaiveConvFwd:4378.08,0,miopenConvolutionFwdAlgoDirect
3-1-14-14-1x14x14-1280-1-1-1-2904-0x0x0-1x14x14-1x1x1-0-NCDHW-BF16-F=GemmFwdRest:179.451,1176,miopenConvolutionFwdAlgoGEMM;ConvDirectNaiveConvFwd:4438.08,0,miopenConvolutionFwdAlgoDirect
3-1-14-14-1x14x14-1280-1-1-1-2984-0x0x0-1x14x14-1x1x1-0-NCDHW-BF16-F=GemmFwdRest:185.956,1176,miopenConvolutionFwdAlgoGEMM;ConvDirectNaiveConvFwd:4564.17,0,miopenConvolutionFwdAlgoDirect
3-1-14-14-1x14x14-1280-1-1-1-3000-0x0x0-1x14x14-1x1x1-0-NCDHW-BF16-F=GemmFwdRest:182.331,1176,miopenConvolutionFwdAlgoGEMM;ConvDirectNaiveConvFwd:4589.16,0,miopenConvolutionFwdAlgoDirect
3-1-14-14-1x14x14-1280-1-1-1-2720-0x0x0-1x14x14-1x1x1-0-NCDHW-BF16-F=GemmFwdRest:165.924,1176,miopenConvolutionFwdAlgoGEMM;ConvDirectNaiveConvFwd:4151.93,0,miopenConvolutionFwdAlgoDirect
3-1-14-14-1x14x14-1280-1-1-1-2992-0x0x0-1x14x14-1x1x1-0-NCDHW-BF16-F=GemmFwdRest:186.153,1176,miopenConvolutionFwdAlgoGEMM;ConvDirectNaiveConvFwd:4579.51,0,miopenConvolutionFwdAlgoDirect
3-1-14-14-1x14x14-1280-1-1-1-3264-0x0x0-1x14x14-1x1x1-0-NCDHW-BF16-F=GemmFwdRest:202.11,1176,miopenConvolutionFwdAlgoGEMM;ConvDirectNaiveConvFwd:4985.49,0,miopenConvolutionFwdAlgoDirect
3-1-14-14-1x14x14-1280-1-1-1-2704-0x0x0-1x14x14-1x1x1-0-NCDHW-BF16-F=GemmFwdRest:165.343,1176,miopenConvolutionFwdAlgoGEMM;ConvDirectNaiveConvFwd:4133.57,0,miopenConvolutionFwdAlgoDirect
3-1-14-14-1x14x14-1280-1-1-1-2928-0x0x0-1x14x14-1x1x1-0-NCDHW-BF16-F=GemmFwdRest:180.569,1176,miopenConvolutionFwdAlgoGEMM;ConvDirectNaiveConvFwd:4476.47,0,miopenConvolutionFwdAlgoDirect
3-1-14-14-1x14x14-1280-1-1-1-3032-0x0x0-1x14x14-1x1x1-0-NCDHW-BF16-F=GemmFwdRest:187.894,1176,miopenConvolutionFwdAlgoGEMM;ConvDirectNaiveConvFwd:4634.46,0,miopenConvolutionFwdAlgoDirect
3-1-14-14-1x14x14-1280-1-1-1-3456-0x0x0-1x14x14-1x1x1-0-NCDHW-BF16-F=GemmFwdRest:213.144,1176,miopenConvolutionFwdAlgoGEMM;ConvDirectNaiveConvFwd:5286.83,0,miopenConvolutionFwdAlgoDirect
3-1-14-14-1x14x14-1280-1-1-1-3744-0x0x0-1x14x14-1x1x1-0-NCDHW-BF16-F=GemmFwdRest:230.44,1176,miopenConvolutionFwdAlgoGEMM;ConvDirectNaiveConvFwd:5721.83,0,miopenConvolutionFwdAlgoDirect
3-1-14-14-1x14x14-1280-1-1-1-2856-0x0x0-1x14x14-1x1x1-0-NCDHW-BF16-F=GemmFwdRest:175.527,1176,miopenConvolutionFwdAlgoGEMM;ConvDirectNaiveConvFwd:4362.33,0,miopenConvolutionFwdAlgoDirect
3-1-14-14-1x14x14-1280-1-1-1-2752-0x0x0-1x14x14-1x1x1-0-NCDHW-BF16-F=GemmFwdRest:168.598,1176,miopenConvolutionFwdAlgoGEMM;ConvDirectNaiveConvFwd:4209.78,0,miopenConvolutionFwdAlgoDirect
3-1-14-14-1x14x14-1280-1-1-1-2332-0x0x0-1x14x14-1x1x1-0-NCDHW-BF16-F=GemmFwdRest:142.931,1176,miopenConvolutionFwdAlgoGEMM;ConvDirectNaiveConvFwd:3567.07,0,miopenConvolutionFwdAlgoDirect
3-1-14-14-1x14x14-1280-1-1-1-1628-0x0x0-1x14x14-1x1x1-0-NCDHW-BF16-F=GemmFwdRest:97.449,1176,miopenConvolutionFwdAlgoGEMM;ConvDirectNaiveConvFwd:2491.19,0,miopenConvolutionFwdAlgoDirect
3-1-14-14-1x14x14-1280-1-1-1-2184-0x0x0-1x14x14-1x1x1-0-NCDHW-BF16-F=GemmFwdRest:135.218,1176,miopenConvolutionFwdAlgoGEMM;ConvDirectNaiveConvFwd:3340.45,0,miopenConvolutionFwdAlgoDirect
3-1-14-14-1x14x14-1280-1-1-1-2584-0x0x0-1x14x14-1x1x1-0-NCDHW-BF16-F=GemmFwdRest:154.683,1176,miopenConvolutionFwdAlgoGEMM;ConvDirectNaiveConvFwd:3943.07,0,miopenConvolutionFwdAlgoDirect
3-1-14-14-1x14x14-1280-1-1-1-2656-0x0x0-1x14x14-1x1x1-0-NCDHW-BF16-F=GemmFwdRest:163.236,1176,miopenConvolutionFwdAlgoGEMM;ConvDirectNaiveConvFwd:4058.48,0,miopenConvolutionFwdAlgoDirect
3-1-14-14-1x14x14-1280-1-1-1-2296-0x0x0-1x14x14-1x1x1-0-NCDHW-BF16-F=GemmFwdRest:140.455,1176,miopenConvolutionFwdAlgoGEMM;ConvDirectNaiveConvFwd:3510.04,0,miopenConvolutionFwdAlgoDirect
3-1-14-14-1x14x14-1280-1-1-1-2088-0x0x0-1x14x14-1x1x1-0-NCDHW-BF16-F=GemmFwdRest:128.992,1176,miopenConvolutionFwdAlgoGEMM;ConvDirectNaiveConvFwd:3191.61,0,miopenConvolutionFwdAlgoDirect
3-1-14-14-1x14x14-1280-1-1-1-2024-0x0x0-1x14x14-1x1x1-0-NCDHW-BF16-F=GemmFwdRest:124.47,1176,miopenConvolutionFwdAlgoGEMM;ConvDirectNaiveConvFwd:3094.5,0,miopenConvolutionFwdAlgoDirect
3-1-14-14-1x14x14-1280-1-1-1-2136-0x0x0-1x14x14-1x1x1-0-NCDHW-BF16-F=GemmFwdRest:133.218,1176,miopenConvolutionFwdAlgoGEMM;ConvDirectNaiveConvFwd:3264.55,0,miopenConvolutionFwdAlgoDirect
3-1-14-14-1x14x14-1280-1-1-1-1808-0x0x0-1x14x14-1x1x1-0-NCDHW-BF16-F=GemmFwdRest:112.304,1176,miopenConvolutionFwdAlgoGEMM;ConvDirectNaiveConvFwd:2759.16,0,miopenConvolutionFwdAlgoDirect
3-1-14-14-1x14x14-1280-1-1-1-1760-0x0x0-1x14x14-1x1x1-0-NCDHW-BF16-F=GemmFwdRest:106.9,1176,miopenConvolutionFwdAlgoGEMM;ConvDirectNaiveConvFwd:2687.82,0,miopenConvolutionFwdAlgoDirect
3-1-14-14-1x14x14-1280-1-1-1-2392-0x0x0-1x14x14-1x1x1-0-NCDHW-BF16-F=GemmFwdRest:148,1176,miopenConvolutionFwdAlgoGEMM;ConvDirectNaiveConvFwd:3652.79,0,miopenConvolutionFwdAlgoDirect
3-1-14-14-1x14x14-1280-1-1-1-2256-0x0x0-1x14x14-1x1x1-0-NCDHW-BF16-F=GemmFwdRest:139.146,1176,miopenConvolutionFwdAlgoGEMM;ConvDirectNaiveConvFwd:3448.67,0,miopenConvolutionFwdAlgoDirect
3-1-14-14-1x14x14-1280-1-1-1-2820-0x0x0-1x14x14-1x1x1-0-NCDHW-BF16-F=GemmFwdRest:175.277,1176,miopenConvolutionFwdAlgoGEMM;ConvDirectNaiveConvFwd:4307.27,0,miopenConvolutionFwdAlgoDirect
3-1-14-14-1x14x14-1280-1-1-1-14220-0x0x0-1x14x14-1x1x1-0-NCDHW-BF16-F=GemmFwdRest:882.743,1176,miopenConvolutionFwdAlgoGEMM;ConvDirectNaiveConvFwd:1702.28,0,miopenConvolutionFwdAlgoDirect
3-1-14-14-1x14x14-1280-1-1-1-12640-0x0x0-1x14x14-1x1x1-0-NCDHW-BF16-F=GemmFwdRest:780.658,1176,miopenConvolutionFwdAlgoGEMM;ConvDirectNaiveConvFwd:19311.9,0,miopenConvolutionFwdAlgoDirect
3-1-14-14-1x14x14-1280-1-1-1-9624-0x0x0-1x14x14-1x1x1-0-NCDHW-BF16-F=GemmFwdRest:596.009,1176,miopenConvolutionFwdAlgoGEMM;ConvDirectNaiveConvFwd:14698,0,miopenConvolutionFwdAlgoDirect
3-1-14-14-1x14x14-1280-1-1-1-9296-0x0x0-1x14x14-1x1x1-0-NCDHW-BF16-F=GemmFwdRest:580.667,1176,miopenConvolutionFwdAlgoGEMM;ConvDirectNaiveConvFwd:14217.5,0,miopenConvolutionFwdAlgoDirect
3-1-14-14-1x14x14-1280-1-1-1-8564-0x0x0-1x14x14-1x1x1-0-NCDHW-BF16-F=GemmFwdRest:531.897,1176,miopenConvolutionFwdAlgoGEMM;ConvDirectNaiveConvFwd:13091.9,0,miopenConvolutionFwdAlgoDirect
3-1-14-14-1x14x14-1280-1-1-1-7976-0x0x0-1x14x14-1x1x1-0-NCDHW-BF16-F=GemmFwdRest:496.958,1176,miopenConvolutionFwdAlgoGEMM;ConvDirectNaiveConvFwd:12190.7,0,miopenConvolutionFwdAlgoDirect
3-1-14-14-1x14x14-1280-1-1-1-6260-0x0x0-1x14x14-1x1x1-0-NCDHW-BF16-F=GemmFwdRest:389.304,1176,miopenConvolutionFwdAlgoGEMM;ConvDirectNaiveConvFwd:9550.71,0,miopenConvolutionFwdAlgoDirect
3-1-14-14-1x14x14-1280-1-1-1-4396-0x0x0-1x14x14-1x1x1-0-NCDHW-BF16-F=GemmFwdRest:271.363,1176,miopenConvolutionFwdAlgoGEMM;ConvDirectNaiveConvFwd:6710.72,0,miopenConvolutionFwdAlgoDirect
3-1-14-14-1x14x14-1280-1-1-1-3960-0x0x0-1x14x14-1x1x1-0-NCDHW-BF16-F=GemmFwdRest:238.317,1176,miopenConvolutionFwdAlgoGEMM;ConvDirectNaiveConvFwd:6042.52,0,miopenConvolutionFwdAlgoDirect
3-1-14-14-1x14x14-1280-1-1-1-4036-0x0x0-1x14x14-1x1x1-0-NCDHW-BF16-F=GemmFwdRest:242.112,1176,miopenConvolutionFwdAlgoGEMM;ConvDirectNaiveConvFwd:6166,0,miopenConvolutionFwdAlgoDirect
3-1-14-14-1x14x14-1280-1-1-1-4216-0x0x0-1x14x14-1x1x1-0-NCDHW-BF16-F=GemmFwdRest:261.396,1176,miopenConvolutionFwdAlgoGEMM;ConvDirectNaiveConvFwd:6442,0,miopenConvolutionFwdAlgoDirect
3-1-14-14-1x14x14-1280-1-1-1-3504-0x0x0-1x14x14-1x1x1-0-NCDHW-BF16-F=GemmFwdRest:217.652,1176,miopenConvolutionFwdAlgoGEMM;ConvDirectNaiveConvFwd:5353.6,0,miopenConvolutionFwdAlgoDirect
3-1-14-14-1x14x14-1280-1-1-1-4336-0x0x0-1x14x14-1x1x1-0-NCDHW-BF16-F=GemmFwdRest:266.44,1176,miopenConvolutionFwdAlgoGEMM;ConvDirectNaiveConvFwd:6625.66,0,miopenConvolutionFwdAlgoDirect
3-1-14-14-1x14x14-1280-1-1-1-2692-0x0x0-1x14x14-1x1x1-0-NCDHW-BF16-F=GemmFwdRest:161.301,1176,miopenConvolutionFwdAlgoGEMM;ConvDirectNaiveConvFwd:4110.82,0,miopenConvolutionFwdAlgoDirect
3-1-14-14-1x14x14-1280-1-1-1-3944-0x0x0-1x14x14-1x1x1-0-NCDHW-BF16-F=GemmFwdRest:240.31,1176,miopenConvolutionFwdAlgoGEMM;ConvDirectNaiveConvFwd:6026.01,0,miopenConvolutionFwdAlgoDirect
3-1-14-14-1x14x14-1280-1-1-1-4144-0x0x0-1x14x14-1x1x1-0-NCDHW-BF16-F=GemmFwdRest:257.098,1176,miopenConvolutionFwdAlgoGEMM;ConvDirectNaiveConvFwd:6329.77,0,miopenConvolutionFwdAlgoDirect
3-1-14-14-1x14x14-1280-1-1-1-2936-0x0x0-1x14x14-1x1x1-0-NCDHW-BF16-F=GemmFwdRest:176.211,1176,miopenConvolutionFwdAlgoGEMM;ConvDirectNaiveConvFwd:4480.73,0,miopenConvolutionFwdAlgoDirect
3-1-14-14-1x14x14-1280-1-1-1-4760-0x0x0-1x14x14-1x1x1-0-NCDHW-BF16-F=GemmFwdRest:292.485,1176,miopenConvolutionFwdAlgoGEMM;ConvDirectNaiveConvFwd:7263.22,0,miopenConvolutionFwdAlgoDirect
3-1-14-14-1x14x14-1280-1-1-1-2776-0x0x0-1x14x14-1x1x1-0-NCDHW-BF16-F=GemmFwdRest:166.161,1176,miopenConvolutionFwdAlgoGEMM;ConvDirectNaiveConvFwd:4242.73,0,miopenConvolutionFwdAlgoDirect
3-1-14-14-1x14x14-1280-1-1-1-4624-0x0x0-1x14x14-1x1x1-0-NCDHW-BF16-F=GemmFwdRest:287.355,1176,miopenConvolutionFwdAlgoGEMM;ConvDirectNaiveConvFwd:7067.98,0,miopenConvolutionFwdAlgoDirect
3-1-14-14-1x14x14-1280-1-1-1-4896-0x0x0-1x14x14-1x1x1-0-NCDHW-BF16-F=GemmFwdRest:303.056,1176,miopenConvolutionFwdAlgoGEMM;ConvDirectNaiveConvFwd:7484.47,0,miopenConvolutionFwdAlgoDirect
3-1-14-14-1x14x14-1280-1-1-1-2976-0x0x0-1x14x14-1x1x1-0-NCDHW-BF16-F=GemmFwdRest:184.095,1176,miopenConvolutionFwdAlgoGEMM;ConvDirectNaiveConvFwd:4548.59,0,miopenConvolutionFwdAlgoDirect
3-1-14-14-1x14x14-1280-1-1-1-3200-0x0x0-1x14x14-1x1x1-0-NCDHW-BF16-F=GemmFwdRest:197.143,1176,miopenConvolutionFwdAlgoGEMM;ConvDirectNaiveConvFwd:4890.46,0,miopenConvolutionFwdAlgoDirect
3-1-14-14-1x14x14-1280-1-1-1-3672-0x0x0-1x14x14-1x1x1-0-NCDHW-BF16-F=GemmFwdRest:219.904,1176,miopenConvolutionFwdAlgoGEMM;ConvDirectNaiveConvFwd:5613.19,0,miopenConvolutionFwdAlgoDirect
3-1-14-14-1x14x14-1280-1-1-1-5184-0x0x0-1x14x14-1x1x1-0-NCDHW-BF16-F=GemmFwdRest:317.653,1176,miopenConvolutionFwdAlgoGEMM;ConvDirectNaiveConvFwd:7919.05,0,miopenConvolutionFwdAlgoDirect
3-1-14-14-1x14x14-1280-1-1-1-4320-0x0x0-1x14x14-1x1x1-0-NCDHW-BF16-F=GemmFwdRest:266.994,1176,miopenConvolutionFwdAlgoGEMM;ConvDirectNaiveConvFwd:6596.6,0,miopenConvolutionFwdAlgoDirect
3-1-14-14-1x14x14-1280-1-1-1-4608-0x0x0-1x14x14-1x1x1-0-NCDHW-BF16-F=GemmFwdRest:287.054,1176,miopenConvolutionFwdAlgoGEMM;ConvDirectNaiveConvFwd:7043.07,0,miopenConvolutionFwdAlgoDirect
3-1-14-14-1x14x14-1280-1-1-1-4032-0x0x0-1x14x14-1x1x1-0-NCDHW-BF16-F=GemmFwdRest:247.85,1176,miopenConvolutionFwdAlgoGEMM;ConvDirectNaiveConvFwd:6161.21,0,miopenConvolutionFwdAlgoDirect
3-1-14-14-1x14x14-1280-1-1-1-3144-0x0x0-1x14x14-1x1x1-0-NCDHW-BF16-F=GemmFwdRest:193.4,1176,miopenConvolutionFwdAlgoGEMM;ConvDirectNaiveConvFwd:4805.43,0,miopenConvolutionFwdAlgoDirect
3-1-14-14-1x14x14-1280-1-1-1-3840-0x0x0-1x14x14-1x1x1-0-NCDHW-BF16-F=GemmFwdRest:236.227,1176,miopenConvolutionFwdAlgoGEMM;ConvDirectNaiveConvFwd:5866.8,0,miopenConvolutionFwdAlgoDirect
3-1-14-14-1x14x14-1280-1-1-1-1952-0x0x0-1x14x14-1x1x1-0-NCDHW-BF16-F=GemmFwdRest:119.852,1176,miopenConvolutionFwdAlgoGEMM;ConvDirectNaiveConvFwd:2986.83,0,miopenConvolutionFwdAlgoDirect
3-1-14-14-1x14x14-1280-1-1-1-2232-0x0x0-1x14x14-1x1x1-0-NCDHW-BF16-F=GemmFwdRest:136.158,1176,miopenConvolutionFwdAlgoGEMM;ConvDirectNaiveConvFwd:3413.28,0,miopenConvolutionFwdAlgoDirect
3-1-14-14-1x14x14-1280-1-1-1-2512-0x0x0-1x14x14-1x1x1-0-NCDHW-BF16-F=GemmFwdRest:150.427,1176,miopenConvolutionFwdAlgoGEMM;ConvDirectNaiveConvFwd:3838.97,0,miopenConvolutionFwdAlgoDirect
3-1-14-14-1x14x14-1280-1-1-1-2324-0x0x0-1x14x14-1x1x1-0-NCDHW-BF16-F=GemmFwdRest:142.561,1176,miopenConvolutionFwdAlgoGEMM;ConvDirectNaiveConvFwd:3550.11,0,miopenConvolutionFwdAlgoDirect
3-1-14-14-1x14x14-1280-1-1-1-2344-0x0x0-1x14x14-1x1x1-0-NCDHW-BF16-F=GemmFwdRest:143.907,1176,miopenConvolutionFwdAlgoGEMM;ConvDirectNaiveConvFwd:3582.23,0,miopenConvolutionFwdAlgoDirect
3-1-14-14-1x14x14-1280-1-1-1-3256-0x0x0-1x14x14-1x1x1-0-NCDHW-BF16-F=GemmFwdRest:198.873,1176,miopenConvolutionFwdAlgoGEMM;ConvDirectNaiveConvFwd:4978.6,0,miopenConvolutionFwdAlgoDirect
3-1-14-14-1x14x14-1280-1-1-1-2264-0x0x0-1x14x14-1x1x1-0-NCDHW-BF16-F=GemmFwdRest:139.81,1176,miopenConvolutionFwdAlgoGEMM;ConvDirectNaiveConvFwd:3456.85,0,miopenConvolutionFwdAlgoDirect
3-1-14-14-1x14x14-1280-1-1-1-2128-0x0x0-1x14x14-1x1x1-0-NCDHW-BF16-F=GemmFwdRest:130.474,1176,miopenConvolutionFwdAlgoGEMM;ConvDirectNaiveConvFwd:3248.29,0,miopenConvolutionFwdAlgoDirect
3-1-14-14-1x14x14-1280-1-1-1-2176-0x0x0-1x14x14-1x1x1-0-NCDHW-BF16-F=GemmFwdRest:134.845,1176,miopenConvolutionFwdAlgoGEMM;ConvDirectNaiveConvFwd:3321.83,0,miopenConvolutionFwdAlgoDirect
3-1-14-14-1x14x14-1280-1-1-1-1800-0x0x0-1x14x14-1x1x1-0-NCDHW-BF16-F=GemmFwdRest:110.461,1176,miopenConvolutionFwdAlgoGEMM;ConvDirectNaiveConvFwd:2747.53,0,miopenConvolutionFwdAlgoDirect
3-1-14-14-1x14x14-1280-1-1-1-2280-0x0x0-1x14x14-1x1x1-0-NCDHW-BF16-F=GemmFwdRest:136.549,1176,miopenConvolutionFwdAlgoGEMM;ConvDirectNaiveConvFwd:3483.53,0,miopenConvolutionFwdAlgoDirect
3-1-14-14-1x14x14-1280-1-1-1-1688-0x0x0-1x14x14-1x1x1-0-NCDHW-BF16-F=GemmFwdRest:101.28,1176,miopenConvolutionFwdAlgoGEMM;ConvDirectNaiveConvFwd:2576.26,0,miopenConvolutionFwdAlgoDirect
3-1-14-14-1x14x14-1280-1-1-1-3176-0x0x0-1x14x14-1x1x1-0-NCDHW-BF16-F=GemmFwdRest:195.064,1176,miopenConvolutionFwdAlgoGEMM;ConvDirectNaiveConvFwd:4847.84,0,miopenConvolutionFwdAlgoDirect
3-1-14-14-1x14x14-1280-1-1-1-3432-0x0x0-1x14x14-1x1x1-0-NCDHW-BF16-F=GemmFwdRest:211.981,1176,miopenConvolutionFwdAlgoGEMM;ConvDirectNaiveConvFwd:5243.7,0,miopenConvolutionFwdAlgoDirect
3-1-14-14-1x14x14-1280-1-1-1-1856-0x0x0-1x14x14-1x1x1-0-NCDHW-BF16-F=GemmFwdRest:113.877,1176,miopenConvolutionFwdAlgoGEMM;ConvDirectNaiveConvFwd:2833.34,0,miopenConvolutionFwdAlgoDirect
3-1-14-14-1x14x14-1280-1-1-1-2836-0x0x0-1x14x14-1x1x1-0-NCDHW-BF16-F=GemmFwdRest:169.924,1176,miopenConvolutionFwdAlgoGEMM;ConvDirectNaiveConvFwd:4331.34,0,miopenConvolutionFwdAlgoDirect
3-1-14-14-1x14x14-1280-1-1-1-3096-0x0x0-1x14x14-1x1x1-0-NCDHW-BF16-F=GemmFwdRest:193.572,1176,miopenConvolutionFwdAlgoGEMM;ConvDirectNaiveConvFwd:4725.36,0,miopenConvolutionFwdAlgoDirect
3-1-14-14-1x14x14-1280-1-1-1-168-0x0x0-1x14x14-1x1x1-0-NCDHW-BF16-F=GemmFwdRest:10.0652,1176,miopenConvolutionFwdAlgoGEMM;ConvDirectNaiveConvFwd:256.339,0,miopenConvolutionFwdAlgoDirect
3-1-14-14-1x14x14-1280-1-1-1-1128-0x0x0-1x14x14-1x1x1-0-NCDHW-BF16-F=GemmFwdRest:67.803,1176,miopenConvolutionFwdAlgoGEMM;ConvDirectNaiveConvFwd:1721.5,0,miopenConvolutionFwdAlgoDirect
3-1-14-14-1x14x14-1280-1-1-1-8280-0x0x0-1x14x14-1x1x1-0-NCDHW-BF16-F=GemmFwdRest:512.848,1176,miopenConvolutionFwdAlgoGEMM;ConvDirectNaiveConvFwd:12644,0,miopenConvolutionFwdAlgoDirect
3-1-14-14-1x14x14-1280-1-1-1-2096-0x0x0-1x14x14-1x1x1-0-NCDHW-BF16-F=GemmFwdRest:125.398,1176,miopenConvolutionFwdAlgoGEMM;ConvDirectNaiveConvFwd:3203.6,0,miopenConvolutionFwdAlgoDirect
3-1-14-14-1x14x14-1280-1-1-1-2112-0x0x0-1x14x14-1x1x1-0-NCDHW-BF16-F=GemmFwdRest:126.465,1176,miopenConvolutionFwdAlgoGEMM;ConvDirectNaiveConvFwd:3225.46,0,miopenConvolutionFwdAlgoDirect
3-1-14-14-1x14x14-1280-1-1-1-1968-0x0x0-1x14x14-1x1x1-0-NCDHW-BF16-F=GemmFwdRest:117.931,1176,miopenConvolutionFwdAlgoGEMM;ConvDirectNaiveConvFwd:3003.96,0,miopenConvolutionFwdAlgoDirect
3-1-14-14-1x14x14-1280-1-1-1-1944-0x0x0-1x14x14-1x1x1-0-NCDHW-BF16-F=GemmFwdRest:119.375,1176,miopenConvolutionFwdAlgoGEMM;ConvDirectNaiveConvFwd:2967.25,0,miopenConvolutionFwdAlgoDirect
3-1-14-14-1x14x14-1280-1-1-1-1816-0x0x0-1x14x14-1x1x1-0-NCDHW-BF16-F=GemmFwdRest:111.759,1176,miopenConvolutionFwdAlgoGEMM;ConvDirectNaiveConvFwd:2771.94,0,miopenConvolutionFwdAlgoDirect
3-1-14-14-1x14x14-1280-1-1-1-2208-0x0x0-1x14x14-1x1x1-0-NCDHW-BF16-F=GemmFwdRest:135.794,1176,miopenConvolutionFwdAlgoGEMM;ConvDirectNaiveConvFwd:3370.97,0,miopenConvolutionFwdAlgoDirect
3-1-14-14-1x14x14-1280-1-1-1-1840-0x0x0-1x14x14-1x1x1-0-NCDHW-BF16-F=GemmFwdRest:112.376,1176,miopenConvolutionFwdAlgoGEMM;ConvDirectNaiveConvFwd:2808.87,0,miopenConvolutionFwdAlgoDirect
3-1-14-14-1x14x14-1280-1-1-1-1992-0x0x0-1x14x14-1x1x1-0-NCDHW-BF16-F=GemmFwdRest:119.076,1176,miopenConvolutionFwdAlgoGEMM;ConvDirectNaiveConvFwd:3044.47,0,miopenConvolutionFwdAlgoDirect
3-1-14-14-1x14x14-1280-1-1-1-2424-0x0x0-1x14x14-1x1x1-0-NCDHW-BF16-F=GemmFwdRest:149.809,1176,miopenConvolutionFwdAlgoGEMM;ConvDirectNaiveConvFwd:3700.85,0,miopenConvolutionFwdAlgoDirect
3-1-14-14-1x14x14-1280-1-1-1-2472-0x0x0-1x14x14-1x1x1-0-NCDHW-BF16-F=GemmFwdRest:152.798,1176,miopenConvolutionFwdAlgoGEMM;ConvDirectNaiveConvFwd:3775.95,0,miopenConvolutionFwdAlgoDirect
3-1-14-14-1x14x14-1280-1-1-1-1904-0x0x0-1x14x14-1x1x1-0-NCDHW-BF16-F=GemmFwdRest:114.103,1176,miopenConvolutionFwdAlgoGEMM;ConvDirectNaiveConvFwd:2905.99,0,miopenConvolutionFwdAlgoDirect
3-1-14-14-1x14x14-1280-1-1-1-1920-0x0x0-1x14x14-1x1x1-0-NCDHW-BF16-F=GemmFwdRest:117.687,1176,miopenConvolutionFwdAlgoGEMM;ConvDirectNaiveConvFwd:2931.33,0,miopenConvolutionFwdAlgoDirect
3-1-14-14-1x14x14-1280-1-1-1-2304-0x0x0-1x14x14-1x1x1-0-NCDHW-BF16-F=GemmFwdRest:140.355,1176,miopenConvolutionFwdAlgoGEMM;ConvDirectNaiveConvFwd:3519.64,0,miopenConvolutionFwdAlgoDirect
3-1-14-14-1x14x14-1280-1-1-1-1928-0x0x0-1x14x14-1x1x1-0-NCDHW-BF16-F=GemmFwdRest:118.2,1176,miopenConvolutionFwdAlgoGEMM;ConvDirectNaiveConvFwd:2942.97,0,miopenConvolutionFwdAlgoDirect
3-1-14-14-1x14x14-1280-1-1-1-2432-0x0x0-1x14x14-1x1x1-0-NCDHW-BF16-F=GemmFwdRest:148.714,1176,miopenConvolutionFwdAlgoGEMM;ConvDirectNaiveConvFwd:3711.96,0,miopenConvolutionFwdAlgoDirect
3-1-14-14-1x14x14-1280-1-1-1-31920-0x0x0-1x14x14-1x1x1-0-NCDHW-BF16-F=GemmFwdRest:1997.25,1176,miopenConvolutionFwdAlgoGEMM;ConvDirectNaiveConvFwd:8711.11,0,miopenConvolutionFwdAlgoDirect
3-1-14-14-1x14x14-1280-1-1-1-33096-0x0x0-1x14x14-1x1x1-0-NCDHW-BF16-F=GemmFwdRest:2070.16,1176,miopenConvolutionFwdAlgoGEMM;ConvDirectNaiveConvFwd:10499.9,0,miopenConvolutionFwdAlgoDirect
3-1-14-14-1x14x14-1280-1-1-1-6452-0x0x0-1x14x14-1x1x1-0-NCDHW-BF16-F=GemmFwdRest:398.341,1176,miopenConvolutionFwdAlgoGEMM;ConvDirectNaiveConvFwd:9850.26,0,miopenConvolutionFwdAlgoDirect
3-1-14-14-1x14x14-1280-1-1-1-1312-0x0x0-1x14x14-1x1x1-0-NCDHW-BF16-F=GemmFwdRest:78.556,1176,miopenConvolutionFwdAlgoGEMM;ConvDirectNaiveConvFwd:2004.52,0,miopenConvolutionFwdAlgoDirect
3-1-14-14-1x14x14-1280-1-1-1-18768-0x0x0-1x14x14-1x1x1-0-NCDHW-BF16-F=GemmFwdRest:1168.1,1176,miopenConvolutionFwdAlgoGEMM;ConvDirectNaiveConvFwd:8663.32,0,miopenConvolutionFwdAlgoDirect
3-1-14-14-1x14x14-1280-1-1-1-33744-0x0x0-1x14x14-1x1x1-0-NCDHW-BF16-F=GemmFwdRest:2121.21,1176,miopenConvolutionFwdAlgoGEMM;ConvDirectNaiveConvFwd:11505.5,0,miopenConvolutionFwdAlgoDirect
3-1-14-14-1x14x14-1280-1-1-1-33212-0x0x0-1x14x14-1x1x1-0-NCDHW-BF16-F=GemmFwdRest:2084.87,1176,miopenConvolutionFwdAlgoGEMM;ConvDirectNaiveConvFwd:10698.1,0,miopenConvolutionFwdAlgoDirect
3-1-14-14-1x14x14-1280-1-1-1-35388-0x0x0-1x14x14-1x1x1-0-NCDHW-BF16-F=GemmFwdRest:2227.26,1176,miopenConvolutionFwdAlgoGEMM;ConvDirectNaiveConvFwd:14034.1,0,miopenConvolutionFwdAlgoDirect
3-1-14-14-1x14x14-1280-1-1-1-29172-0x0x0-1x14x14-1x1x1-0-NCDHW-BF16-F=GemmFwdRest:1822.62,1176,miopenConvolutionFwdAlgoGEMM;ConvDirectNaiveConvFwd:4524.22,0,miopenConvolutionFwdAlgoDirect
3-1-14-14-1x14x14-1280-1-1-1-25896-0x0x0-1x14x14-1x1x1-0-NCDHW-BF16-F=GemmFwdRest:1623.41,1176,miopenConvolutionFwdAlgoGEMM;ConvDirectNaiveConvFwd:19572.6,0,miopenConvolutionFwdAlgoDirect
3-1-14-14-1x14x14-1280-1-1-1-24960-0x0x0-1x14x14-1x1x1-0-NCDHW-BF16-F=GemmFwdRest:1564.51,1176,miopenConvolutionFwdAlgoGEMM;ConvDirectNaiveConvFwd:18131.3,0,miopenConvolutionFwdAlgoDirect
3-1-14-14-1x14x14-1280-1-1-1-26872-0x0x0-1x14x14-1x1x1-0-NCDHW-BF16-F=GemmFwdRest:1681.01,1176,miopenConvolutionFwdAlgoGEMM;ConvDirectNaiveConvFwd:1006.87,0,miopenConvolutionFwdAlgoDirect
3-1-14-14-1x14x14-1280-1-1-1-23400-0x0x0-1x14x14-1x1x1-0-NCDHW-BF16-F=GemmFwdRest:1453.45,1176,miopenConvolutionFwdAlgoGEMM;ConvDirectNaiveConvFwd:15758.1,0,miopenConvolutionFwdAlgoDirect
3-1-14-14-1x14x14-1280-1-1-1-22464-0x0x0-1x14x14-1x1x1-0-NCDHW-BF16-F=GemmFwdRest:1392.47,1176,miopenConvolutionFwdAlgoGEMM;ConvDirectNaiveConvFwd:14306.9,0,miopenConvolutionFwdAlgoDirect
3-1-14-14-1x14x14-1280-1-1-1-22620-0x0x0-1x14x14-1x1x1-0-NCDHW-BF16-F=GemmFwdRest:1415.52,1176,miopenConvolutionFwdAlgoGEMM;ConvDirectNaiveConvFwd:14555.7,0,miopenConvolutionFwdAlgoDirect
3-1-14-14-1x14x14-1280-1-1-1-21684-0x0x0-1x14x14-1x1x1-0-NCDHW-BF16-F=GemmFwdRest:1346.93,1176,miopenConvolutionFwdAlgoGEMM;ConvDirectNaiveConvFwd:13117.2,0,miopenConvolutionFwdAlgoDirect
3-1-14-14-1x14x14-1280-1-1-1-18720-0x0x0-1x14x14-1x1x1-0-NCDHW-BF16-F=GemmFwdRest:1165.33,1176,miopenConvolutionFwdAlgoGEMM;ConvDirectNaiveConvFwd:8584.18,0,miopenConvolutionFwdAlgoDirect
3-1-14-14-1x14x14-1280-1-1-1-18096-0x0x0-1x14x14-1x1x1-0-NCDHW-BF16-F=GemmFwdRest:1127.5,1176,miopenConvolutionFwdAlgoGEMM;ConvDirectNaiveConvFwd:7629.77,0,miopenConvolutionFwdAlgoDirect
3-1-14-14-1x14x14-1280-1-1-1-17124-0x0x0-1x14x14-1x1x1-0-NCDHW-BF16-F=GemmFwdRest:1054.82,1176,miopenConvolutionFwdAlgoGEMM;ConvDirectNaiveConvFwd:6147.27,0,miopenConvolutionFwdAlgoDirect
3-1-14-14-1x14x14-1280-1-1-1-17160-0x0x0-1x14x14-1x1x1-0-NCDHW-BF16-F=GemmFwdRest:1059.96,1176,miopenConvolutionFwdAlgoGEMM;ConvDirectNaiveConvFwd:6201.64,0,miopenConvolutionFwdAlgoDirect
3-1-14-14-1x14x14-1280-1-1-1-15540-0x0x0-1x14x14-1x1x1-0-NCDHW-BF16-F=GemmFwdRest:964.937,1176,miopenConvolutionFwdAlgoGEMM;ConvDirectNaiveConvFwd:3722.13,0,miopenConvolutionFwdAlgoDirect
3-1-14-14-1x14x14-1280-1-1-1-16848-0x0x0-1x14x14-1x1x1-0-NCDHW-BF16-F=GemmFwdRest:1029.73,1176,miopenConvolutionFwdAlgoGEMM;ConvDirectNaiveConvFwd:5725.38,0,miopenConvolutionFwdAlgoDirect
3-1-14-14-1x14x14-1280-1-1-1-14036-0x0x0-1x14x14-1x1x1-0-NCDHW-BF16-F=GemmFwdRest:864.023,1176,miopenConvolutionFwdAlgoGEMM;ConvDirectNaiveConvFwd:1421.98,0,miopenConvolutionFwdAlgoDirect
3-1-14-14-1x14x14-1280-1-1-1-12716-0x0x0-1x14x14-1x1x1-0-NCDHW-BF16-F=GemmFwdRest:785.366,1176,miopenConvolutionFwdAlgoGEMM;ConvDirectNaiveConvFwd:19461.2,0,miopenConvolutionFwdAlgoDirect
3-1-14-14-1x14x14-1280-1-1-1-12480-0x0x0-1x14x14-1x1x1-0-NCDHW-BF16-F=GemmFwdRest:765.807,1176,miopenConvolutionFwdAlgoGEMM;ConvDirectNaiveConvFwd:19108.2,0,miopenConvolutionFwdAlgoDirect
3-1-14-14-1x14x14-1280-1-1-1-12492-0x0x0-1x14x14-1x1x1-0-NCDHW-BF16-F=GemmFwdRest:770.269,1176,miopenConvolutionFwdAlgoGEMM;ConvDirectNaiveConvFwd:19123.9,0,miopenConvolutionFwdAlgoDirect
3-1-14-14-1x14x14-1280-1-1-1-11576-0x0x0-1x14x14-1x1x1-0-NCDHW-BF16-F=GemmFwdRest:709.59,1176,miopenConvolutionFwdAlgoGEMM;ConvDirectNaiveConvFwd:17718.9,0,miopenConvolutionFwdAlgoDirect
3-1-14-14-1x14x14-1280-1-1-1-10920-0x0x0-1x14x14-1x1x1-0-NCDHW-BF16-F=GemmFwdRest:667.536,1176,miopenConvolutionFwdAlgoGEMM;ConvDirectNaiveConvFwd:16701,0,miopenConvolutionFwdAlgoDirect
3-1-14-14-1x14x14-1280-1-1-1-11032-0x0x0-1x14x14-1x1x1-0-NCDHW-BF16-F=GemmFwdRest:668.96,1176,miopenConvolutionFwdAlgoGEMM;ConvDirectNaiveConvFwd:16886.2,0,miopenConvolutionFwdAlgoDirect
3-1-14-14-1x14x14-1280-1-1-1-10724-0x0x0-1x14x14-1x1x1-0-NCDHW-BF16-F=GemmFwdRest:652.953,1176,miopenConvolutionFwdAlgoGEMM;ConvDirectNaiveConvFwd:16414.2,0,miopenConvolutionFwdAlgoDirect
3-1-14-14-1x14x14-1280-1-1-1-9460-0x0x0-1x14x14-1x1x1-0-NCDHW-BF16-F=GemmFwdRest:574.404,1176,miopenConvolutionFwdAlgoGEMM;ConvDirectNaiveConvFwd:14475.7,0,miopenConvolutionFwdAlgoDirect
3-1-14-14-1x14x14-1280-1-1-1-10008-0x0x0-1x14x14-1x1x1-0-NCDHW-BF16-F=GemmFwdRest:617.471,1176,miopenConvolutionFwdAlgoGEMM;ConvDirectNaiveConvFwd:15319.4,0,miopenConvolutionFwdAlgoDirect
3-1-14-14-1x14x14-1280-1-1-1-8976-0x0x0-1x14x14-1x1x1-0-NCDHW-BF16-F=GemmFwdRest:545.924,1176,miopenConvolutionFwdAlgoGEMM;ConvDirectNaiveConvFwd:13721.2,0,miopenConvolutionFwdAlgoDirect
3-1-14-14-1x14x14-1280-1-1-1-9048-0x0x0-1x14x14-1x1x1-0-NCDHW-BF16-F=GemmFwdRest:561,1176,miopenConvolutionFwdAlgoGEMM;ConvDirectNaiveConvFwd:13841.7,0,miopenConvolutionFwdAlgoDirect
3-1-14-14-1x14x14-1280-1-1-1-7480-0x0x0-1x14x14-1x1x1-0-NCDHW-BF16-F=GemmFwdRest:453.063,1176,miopenConvolutionFwdAlgoGEMM;ConvDirectNaiveConvFwd:11435.7,0,miopenConvolutionFwdAlgoDirect
3-1-14-14-1x14x14-1280-1-1-1-7240-0x0x0-1x14x14-1x1x1-0-NCDHW-BF16-F=GemmFwdRest:444.552,1176,miopenConvolutionFwdAlgoGEMM;ConvDirectNaiveConvFwd:11081.5,0,miopenConvolutionFwdAlgoDirect
3-1-14-14-1x14x14-1280-1-1-1-6668-0x0x0-1x14x14-1x1x1-0-NCDHW-BF16-F=GemmFwdRest:404.764,1176,miopenConvolutionFwdAlgoGEMM;ConvDirectNaiveConvFwd:10190.2,0,miopenConvolutionFwdAlgoDirect
3-1-14-14-1x14x14-1280-1-1-1-6240-0x0x0-1x14x14-1x1x1-0-NCDHW-BF16-F=GemmFwdRest:384.763,1176,miopenConvolutionFwdAlgoGEMM;ConvDirectNaiveConvFwd:9548.09,0,miopenConvolutionFwdAlgoDirect
3-1-14-14-1x14x14-1280-1-1-1-6176-0x0x0-1x14x14-1x1x1-0-NCDHW-BF16-F=GemmFwdRest:373.7,1176,miopenConvolutionFwdAlgoGEMM;ConvDirectNaiveConvFwd:9445.01,0,miopenConvolutionFwdAlgoDirect
3-1-14-14-1x14x14-1280-1-1-1-6112-0x0x0-1x14x14-1x1x1-0-NCDHW-BF16-F=GemmFwdRest:370.079,1176,miopenConvolutionFwdAlgoGEMM;ConvDirectNaiveConvFwd:9342.32,0,miopenConvolutionFwdAlgoDirect
3-1-14-14-1x14x14-1280-1-1-1-6736-0x0x0-1x14x14-1x1x1-0-NCDHW-BF16-F=GemmFwdRest:411.337,1176,miopenConvolutionFwdAlgoGEMM;ConvDirectNaiveConvFwd:10302.5,0,miopenConvolutionFwdAlgoDirect
3-1-14-14-1x14x14-1280-1-1-1-5920-0x0x0-1x14x14-1x1x1-0-NCDHW-BF16-F=GemmFwdRest:361.145,1176,miopenConvolutionFwdAlgoGEMM;ConvDirectNaiveConvFwd:9054.34,0,miopenConvolutionFwdAlgoDirect
3-1-14-14-1x14x14-1280-1-1-1-5224-0x0x0-1x14x14-1x1x1-0-NCDHW-BF16-F=GemmFwdRest:324.362,1176,miopenConvolutionFwdAlgoGEMM;ConvDirectNaiveConvFwd:7990.26,0,miopenConvolutionFwdAlgoDirect
3-1-14-14-1x14x14-1280-1-1-1-4536-0x0x0-1x14x14-1x1x1-0-NCDHW-BF16-F=GemmFwdRest:277.581,1176,miopenConvolutionFwdAlgoGEMM;ConvDirectNaiveConvFwd:6938.15,0,miopenConvolutionFwdAlgoDirect
3-1-14-14-1x14x14-1280-1-1-1-4632-0x0x0-1x14x14-1x1x1-0-NCDHW-BF16-F=GemmFwdRest:286.052,1176,miopenConvolutionFwdAlgoGEMM;ConvDirectNaiveConvFwd:7084.33,0,miopenConvolutionFwdAlgoDirect
3-1-14-14-1x14x14-1280-1-1-1-3936-0x0x0-1x14x14-1x1x1-0-NCDHW-BF16-F=GemmFwdRest:238.873,1176,miopenConvolutionFwdAlgoGEMM;ConvDirectNaiveConvFwd:6016.65,0,miopenConvolutionFwdAlgoDirect
3-1-14-14-1x14x14-1280-1-1-1-3120-0x0x0-1x14x14-1x1x1-0-NCDHW-BF16-F=GemmFwdRest:188.541,1176,miopenConvolutionFwdAlgoGEMM;ConvDirectNaiveConvFwd:4776.52,0,miopenConvolutionFwdAlgoDirect
3-1-14-14-1x14x14-1280-1-1-1-3072-0x0x0-1x14x14-1x1x1-0-NCDHW-BF16-F=GemmFwdRest:186.415,1176,miopenConvolutionFwdAlgoGEMM;ConvDirectNaiveConvFwd:4700.51,0,miopenConvolutionFwdAlgoDirect
3-1-14-14-1x14x14-1280-1-1-1-4056-0x0x0-1x14x14-1x1x1-0-NCDHW-BF16-F=GemmFwdRest:246.258,1176,miopenConvolutionFwdAlgoGEMM;ConvDirectNaiveConvFwd:6201.62,0,miopenConvolutionFwdAlgoDirect
3-1-14-14-1x14x14-1280-1-1-1-3280-0x0x0-1x14x14-1x1x1-0-NCDHW-BF16-F=GemmFwdRest:198.682,1176,miopenConvolutionFwdAlgoGEMM;ConvDirectNaiveConvFwd:5015.65,0,miopenConvolutionFwdAlgoDirect
3-1-14-14-1x14x14-1280-1-1-1-3024-0x0x0-1x14x14-1x1x1-0-NCDHW-BF16-F=GemmFwdRest:183.374,1176,miopenConvolutionFwdAlgoGEMM;ConvDirectNaiveConvFwd:4625.02,0,miopenConvolutionFwdAlgoDirect
3-1-14-14-1x14x14-1280-1-1-1-3416-0x0x0-1x14x14-1x1x1-0-NCDHW-BF16-F=GemmFwdRest:206.585,1176,miopenConvolutionFwdAlgoGEMM;ConvDirectNaiveConvFwd:5225.13,0,miopenConvolutionFwdAlgoDirect
3-1-14-14-1x14x14-1280-1-1-1-3296-0x0x0-1x14x14-1x1x1-0-NCDHW-BF16-F=GemmFwdRest:200.955,1176,miopenConvolutionFwdAlgoGEMM;ConvDirectNaiveConvFwd:5041.13,0,miopenConvolutionFwdAlgoDirect
3-1-14-14-1x14x14-1280-1-1-1-2960-0x0x0-1x14x14-1x1x1-0-NCDHW-BF16-F=GemmFwdRest:178.886,1176,miopenConvolutionFwdAlgoGEMM;ConvDirectNaiveConvFwd:4529.54,0,miopenConvolutionFwdAlgoDirect
3-1-14-14-1x14x14-1280-1-1-1-3320-0x0x0-1x14x14-1x1x1-0-NCDHW-BF16-F=GemmFwdRest:201.23,1176,miopenConvolutionFwdAlgoGEMM;ConvDirectNaiveConvFwd:5075.75,0,miopenConvolutionFwdAlgoDirect
3-1-14-14-1x14x14-1280-1-1-1-3104-0x0x0-1x14x14-1x1x1-0-NCDHW-BF16-F=GemmFwdRest:188.515,1176,miopenConvolutionFwdAlgoGEMM;ConvDirectNaiveConvFwd:4750.16,0,miopenConvolutionFwdAlgoDirect
3-1-14-14-1x14x14-1280-1-1-1-3080-0x0x0-1x14x14-1x1x1-0-NCDHW-BF16-F=GemmFwdRest:186.698,1176,miopenConvolutionFwdAlgoGEMM;ConvDirectNaiveConvFwd:4713.01,0,miopenConvolutionFwdAlgoDirect
3-1-14-14-1x14x14-1280-1-1-1-3568-0x0x0-1x14x14-1x1x1-0-NCDHW-BF16-F=GemmFwdRest:216.427,1176,miopenConvolutionFwdAlgoGEMM;ConvDirectNaiveConvFwd:5459.08,0,miopenConvolutionFwdAlgoDirect
3-1-14-14-1x14x14-1280-1-1-1-2028-0x0x0-1x14x14-1x1x1-0-NCDHW-BF16-F=GemmFwdRest:123.003,1176,miopenConvolutionFwdAlgoGEMM;ConvDirectNaiveConvFwd:3103.72,0,miopenConvolutionFwdAlgoDirect
3-1-14-14-1x14x14-1280-1-1-1-2020-0x0x0-1x14x14-1x1x1-0-NCDHW-BF16-F=GemmFwdRest:122.475,1176,miopenConvolutionFwdAlgoGEMM;ConvDirectNaiveConvFwd:3090.99,0,miopenConvolutionFwdAlgoDirect
3-1-14-14-1x14x14-1280-1-1-1-2268-0x0x0-1x14x14-1x1x1-0-NCDHW-BF16-F=GemmFwdRest:137.481,1176,miopenConvolutionFwdAlgoGEMM;ConvDirectNaiveConvFwd:3468.16,0,miopenConvolutionFwdAlgoDirect
3-1-14-14-1x14x14-1280-1-1-1-2272-0x0x0-1x14x14-1x1x1-0-NCDHW-BF16-F=GemmFwdRest:137.629,1176,miopenConvolutionFwdAlgoGEMM;ConvDirectNaiveConvFwd:3475.07,0,miopenConvolutionFwdAlgoDirect
3-1-14-14-1x14x14-1280-1-1-1-2164-0x0x0-1x14x14-1x1x1-0-NCDHW-BF16-F=GemmFwdRest:131.277,1176,miopenConvolutionFwdAlgoGEMM;ConvDirectNaiveConvFwd:3309.47,0,miopenConvolutionFwdAlgoDirect
3-1-14-14-1x14x14-1280-1-1-1-2216-0x0x0-1x14x14-1x1x1-0-NCDHW-BF16-F=GemmFwdRest:134.29,1176,miopenConvolutionFwdAlgoGEMM;ConvDirectNaiveConvFwd:3388.53,0,miopenConvolutionFwdAlgoDirect
3-1-14-14-1x14x14-1280-1-1-1-3056-0x0x0-1x14x14-1x1x1-0-NCDHW-BF16-F=GemmFwdRest:184.899,1176,miopenConvolutionFwdAlgoGEMM;ConvDirectNaiveConvFwd:4676.37,0,miopenConvolutionFwdAlgoDirect
3-1-14-14-1x14x14-1280-1-1-1-2144-0x0x0-1x14x14-1x1x1-0-NCDHW-BF16-F=GemmFwdRest:129.344,1176,miopenConvolutionFwdAlgoGEMM;ConvDirectNaiveConvFwd:3281.04,0,miopenConvolutionFwdAlgoDirect
3-1-14-14-1x14x14-1280-1-1-1-2008-0x0x0-1x14x14-1x1x1-0-NCDHW-BF16-F=GemmFwdRest:121.594,1176,miopenConvolutionFwdAlgoGEMM;ConvDirectNaiveConvFwd:3071.67,0,miopenConvolutionFwdAlgoDirect
3-1-14-14-1x14x14-1280-1-1-1-2204-0x0x0-1x14x14-1x1x1-0-NCDHW-BF16-F=GemmFwdRest:133.508,1176,miopenConvolutionFwdAlgoGEMM;ConvDirectNaiveConvFwd:3370.71,0,miopenConvolutionFwdAlgoDirect
3-1-14-14-1x14x14-1280-1-1-1-2536-0x0x0-1x14x14-1x1x1-0-NCDHW-BF16-F=GemmFwdRest:153.314,1176,miopenConvolutionFwdAlgoGEMM;ConvDirectNaiveConvFwd:3878.16,0,miopenConvolutionFwdAlgoDirect
3-1-14-14-1x14x14-1280-1-1-1-2056-0x0x0-1x14x14-1x1x1-0-NCDHW-BF16-F=GemmFwdRest:124.464,1176,miopenConvolutionFwdAlgoGEMM;ConvDirectNaiveConvFwd:3142.91,0,miopenConvolutionFwdAlgoDirect
3-1-14-14-1x14x14-1280-1-1-1-2648-0x0x0-1x14x14-1x1x1-0-NCDHW-BF16-F=GemmFwdRest:160.426,1176,miopenConvolutionFwdAlgoGEMM;ConvDirectNaiveConvFwd:4049.01,0,miopenConvolutionFwdAlgoDirect
3-1-14-14-1x14x14-1280-1-1-1-2000-0x0x0-1x14x14-1x1x1-0-NCDHW-BF16-F=GemmFwdRest:120.926,1176,miopenConvolutionFwdAlgoGEMM;ConvDirectNaiveConvFwd:3061.57,0,miopenConvolutionFwdAlgoDirect
3-1-14-14-1x14x14-1280-1-1-1-1912-0x0x0-1x14x14-1x1x1-0-NCDHW-BF16-F=GemmFwdRest:115.646,1176,miopenConvolutionFwdAlgoGEMM;ConvDirectNaiveConvFwd:2926.09,0,miopenConvolutionFwdAlgoDirect
3-1-14-14-1x14x14-1280-1-1-1-1832-0x0x0-1x14x14-1x1x1-0-NCDHW-BF16-F=GemmFwdRest:110.899,1176,miopenConvolutionFwdAlgoGEMM;ConvDirectNaiveConvFwd:2803.11,0,miopenConvolutionFwdAlgoDirect
3-1-14-14-1x14x14-1280-1-1-1-1936-0x0x0-1x14x14-1x1x1-0-NCDHW-BF16-F=GemmFwdRest:117.258,1176,miopenConvolutionFwdAlgoGEMM;ConvDirectNaiveConvFwd:2960.26,0,miopenConvolutionFwdAlgoDirect
3-1-14-14-1x14x14-1280-1-1-1-1880-0x0x0-1x14x14-1x1x1-0-NCDHW-BF16-F=GemmFwdRest:113.763,1176,miopenConvolutionFwdAlgoGEMM;ConvDirectNaiveConvFwd:2874.65,0,miopenConvolutionFwdAlgoDirect
3-1-14-14-1x14x14-1280-1-1-1-1824-0x0x0-1x14x14-1x1x1-0-NCDHW-BF16-F=GemmFwdRest:110.338,1176,miopenConvolutionFwdAlgoGEMM;ConvDirectNaiveConvFwd:2790.73,0,miopenConvolutionFwdAlgoDirect
3-1-14-14-1x14x14-1280-1-1-1-2668-0x0x0-1x14x14-1x1x1-0-NCDHW-BF16-F=GemmFwdRest:161.737,1176,miopenConvolutionFwdAlgoGEMM;ConvDirectNaiveConvFwd:4082.22,0,miopenConvolutionFwdAlgoDirect
3-1-14-14-1x14x14-1280-1-1-1-2376-0x0x0-1x14x14-1x1x1-0-NCDHW-BF16-F=GemmFwdRest:144.248,1176,miopenConvolutionFwdAlgoGEMM;ConvDirectNaiveConvFwd:3635.08,0,miopenConvolutionFwdAlgoDirect
3-1-14-14-1x14x14-1280-1-1-1-1972-0x0x0-1x14x14-1x1x1-0-NCDHW-BF16-F=GemmFwdRest:119.49,1176,miopenConvolutionFwdAlgoGEMM;ConvDirectNaiveConvFwd:3018.49,0,miopenConvolutionFwdAlgoDirect
3-1-14-14-1x14x14-1280-1-1-1-2248-0x0x0-1x14x14-1x1x1-0-NCDHW-BF16-F=GemmFwdRest:136.341,1176,miopenConvolutionFwdAlgoGEMM;ConvDirectNaiveConvFwd:3440.48,0,miopenConvolutionFwdAlgoDirect
3-1-14-14-1x14x14-1280-1-1-1-1708-0x0x0-1x14x14-1x1x1-0-NCDHW-BF16-F=GemmFwdRest:103.554,1176,miopenConvolutionFwdAlgoGEMM;ConvDirectNaiveConvFwd:2612.68,0,miopenConvolutionFwdAlgoDirect
3-1-14-14-1x14x14-1280-1-1-1-2616-0x0x0-1x14x14-1x1x1-0-NCDHW-BF16-F=GemmFwdRest:158.658,1176,miopenConvolutionFwdAlgoGEMM;ConvDirectNaiveConvFwd:4002.88,0,miopenConvolutionFwdAlgoDirect
3-1-14-14-1x14x14-1280-1-1-1-1988-0x0x0-1x14x14-1x1x1-0-NCDHW-BF16-F=GemmFwdRest:120.545,1176,miopenConvolutionFwdAlgoGEMM;ConvDirectNaiveConvFwd:3041.79,0,miopenConvolutionFwdAlgoDirect
3-1-14-14-1x14x14-1280-1-1-1-2124-0x0x0-1x14x14-1x1x1-0-NCDHW-BF16-F=GemmFwdRest:128.06,1176,miopenConvolutionFwdAlgoGEMM;ConvDirectNaiveConvFwd:3249.73,0,miopenConvolutionFwdAlgoDirect
3-1-14-14-1x14x14-1280-1-1-1-1948-0x0x0-1x14x14-1x1x1-0-NCDHW-BF16-F=GemmFwdRest:117.993,1176,miopenConvolutionFwdAlgoGEMM;ConvDirectNaiveConvFwd:2978.74,0,miopenConvolutionFwdAlgoDirect
3-1-14-14-1x14x14-1280-1-1-1-1932-0x0x0-1x14x14-1x1x1-0-NCDHW-BF16-F=GemmFwdRest:117.017,1176,miopenConvolutionFwdAlgoGEMM;ConvDirectNaiveConvFwd:2955.2,0,miopenConvolutionFwdAlgoDirect
3-1-14-14-1x14x14-1280-1-1-1-2336-0x0x0-1x14x14-1x1x1-0-NCDHW-BF16-F=GemmFwdRest:141.269,1176,miopenConvolutionFwdAlgoGEMM;ConvDirectNaiveConvFwd:3573.33,0,miopenConvolutionFwdAlgoDirect
3-1-14-14-1x14x14-1280-1-1-1-3940-0x0x0-1x14x14-1x1x1-0-NCDHW-BF16-F=GemmFwdRest:238.744,1176,miopenConvolutionFwdAlgoGEMM;ConvDirectNaiveConvFwd:6024.57,0,miopenConvolutionFwdAlgoDirect
3-1-14-14-1x14x14-1280-1-1-1-3232-0x0x0-1x14x14-1x1x1-0-NCDHW-BF16-F=GemmFwdRest:194.598,1176,miopenConvolutionFwdAlgoGEMM;ConvDirectNaiveConvFwd:4942.14,0,miopenConvolutionFwdAlgoDirect
3-1-14-14-1x14x14-1280-1-1-1-4348-0x0x0-1x14x14-1x1x1-0-NCDHW-BF16-F=GemmFwdRest:263.677,1176,miopenConvolutionFwdAlgoGEMM;ConvDirectNaiveConvFwd:6650.14,0,miopenConvolutionFwdAlgoDirect
3-1-14-14-1x14x14-1280-1-1-1-336-0x0x0-1x14x14-1x1x1-0-NCDHW-BF16-F=GemmFwdRest:20.3584,1176,miopenConvolutionFwdAlgoGEMM;ConvDirectNaiveConvFwd:513.837,0,miopenConvolutionFwdAlgoDirect
3-1-14-14-1x14x14-1280-1-1-1-2380-0x0x0-1x14x14-1x1x1-0-NCDHW-BF16-F=GemmFwdRest:143.277,1176,miopenConvolutionFwdAlgoGEMM;ConvDirectNaiveConvFwd:3636.09,0,miopenConvolutionFwdAlgoDirect
3-768-768-4x4-128-192-192-5-0x0-4x4-1x1-0-NCHW-FP16-F=GemmFwdRest:0.492044,3538944,miopenConvolutionFwdAlgoGEMM;ConvDirectNaiveConvFwd:19.4858,0,miopenConvolutionFwdAlgoDirect
3-1-14-14-1x14x14-1280-1-1-1-14576-0x0x0-1x14x14-1x1x1-0-NCDHW-BF16-F=GemmFwdRest:891.18,1176,miopenConvolutionFwdAlgoGEMM;ConvDirectNaiveConvFwd:2243.81,0,miopenConvolutionFwdAlgoDirect
3-1-14-14-1x14x14-1280-1-1-1-1864-0x0x0-1x14x14-1x1x1-0-NCDHW-BF16-F=GemmFwdRest:112.75,1176,miopenConvolutionFwdAlgoGEMM;ConvDirectNaiveConvFwd:2852.95,0,miopenConvolutionFwdAlgoDirect
3-1-14-14-1x14x14-1280-1-1-1-2240-0x0x0-1x14x14-1x1x1-0-NCDHW-BF16-F=GemmFwdRest:135.764,1176,miopenConvolutionFwdAlgoGEMM;ConvDirectNaiveConvFwd:3427.46,0,miopenConvolutionFwdAlgoDirect
3-1-14-14-1x14x14-1280-1-1-1-2660-0x0x0-1x14x14-1x1x1-0-NCDHW-BF16-F=GemmFwdRest:161.197,1176,miopenConvolutionFwdAlgoGEMM;ConvDirectNaiveConvFwd:4069.46,0,miopenConvolutionFwdAlgoDirect
3-1-14-14-1x14x14-1280-1-1-1-440-0x0x0-1x14x14-1x1x1-0-NCDHW-BF16-F=GemmFwdRest:26.6855,1176,miopenConvolutionFwdAlgoGEMM;ConvDirectNaiveConvFwd:673.529,0,miopenConvolutionFwdAlgoDirect
